commentId,comment,classification,comment_processed,word_phrase_list,needle,please,similarity_score
135381,I am a repeat patient and I have been extremely pleased with the results of my procedures.,0,repeat patient extremely please result procedure,"['repeat', 'repeat patient', 'repeat patient extremely', 'repeat patient extremely please', 'repeat patient extremely please result', 'repeat patient extremely please result procedure', 'patient', 'patient extremely', 'patient extremely please', 'patient extremely please result', 'patient extremely please result procedure', 'extremely', 'extremely please', 'extremely please result', 'extremely please result procedure', 'please', 'please result', 'please result procedure', 'result', 'result procedure', 'procedure']",0,1,0.3846153846153846
99722,Very pleased with the staff on my visit today.,0,please staff visit,"['please', 'please staff', 'please staff visit', 'staff', 'staff visit', 'visit']",0,1,0.3846153846153846
161494,I could not be more pleased with my visit,0,please visit,"['please', 'please visit', 'visit']",0,1,0.3846153846153846
65401,I was pleased that she pursued a possible genetic issue from my family.,0,please pursue possible genetic issue family,"['please', 'please pursue', 'please pursue possible', 'please pursue possible genetic', 'please pursue possible genetic issue', 'please pursue possible genetic issue family', 'pursue', 'pursue possible', 'pursue possible genetic', 'pursue possible genetic issue', 'pursue possible genetic issue family', 'possible', 'possible genetic', 'possible genetic issue', 'possible genetic issue family', 'genetic', 'genetic issue', 'genetic issue family', 'issue', 'issue family', 'family']",0,1,0.3846153846153846
77530,Very pleased.,0,please,['please'],0,1,0.3846153846153846
180743,"Needless pain, suffering and anxiety all because the after care orders for nurse and physical therapy were completely neglected.",1,needle pain suffer anxiety care order nurse physical therapy completely neglect,"['needle', 'needle pain', 'needle pain suffer', 'needle pain suffer anxiety', 'needle pain suffer anxiety care', 'needle pain suffer anxiety care order', 'needle pain suffer anxiety care order nurse', 'needle pain suffer anxiety care order nurse physical', 'needle pain suffer anxiety care order nurse physical therapy', 'needle pain suffer anxiety care order nurse physical therapy completely', 'needle pain suffer anxiety care order nurse physical therapy completely neglect', 'pain', 'pain suffer', 'pain suffer anxiety', 'pain suffer anxiety care', 'pain suffer anxiety care order', 'pain suffer anxiety care order nurse', 'pain suffer anxiety care order nurse physical', 'pain suffer anxiety care order nurse physical therapy', 'pain suffer anxiety care order nurse physical therapy completely', 'pain suffer anxiety care order nurse physical therapy completely neglect', 'suffer', 'suffer anxiety', 'suffer anxiety care', 'suffer anxiety care order', 'suffer anxiety care order nurse', 'suffer anxiety care order nurse physical', 'suffer anxiety care order nurse physical therapy', 'suffer anxiety care order nurse physical therapy completely', 'suffer anxiety care order nurse physical therapy completely neglect', 'anxiety', 'anxiety care', 'anxiety care order', 'anxiety care order nurse', 'anxiety care order nurse physical', 'anxiety care order nurse physical therapy', 'anxiety care order nurse physical therapy completely', 'anxiety care order nurse physical therapy completely neglect', 'care', 'care order', 'care order nurse', 'care order nurse physical', 'care order nurse physical therapy', 'care order nurse physical therapy completely', 'care order nurse physical therapy completely neglect', 'order', 'order nurse', 'order nurse physical', 'order nurse physical therapy', 'order nurse physical therapy completely', 'order nurse physical therapy completely neglect', 'nurse', 'nurse physical', 'nurse physical therapy', 'nurse physical therapy completely', 'nurse physical therapy completely neglect', 'physical', 'physical therapy', 'physical therapy completely', 'physical therapy completely neglect', 'therapy', 'therapy completely', 'therapy completely neglect', 'completely', 'completely neglect', 'neglect']",1,0,0.3846153846153846
73707,The office is aesthetically pleasing even during construction.,0,office aesthetically please construction,"['office', 'office aesthetically', 'office aesthetically please', 'office aesthetically please construction', 'aesthetically', 'aesthetically please', 'aesthetically please construction', 'please', 'please construction', 'construction']",0,1,0.3846153846153846
169153,Couldn't be more pleased with Dr Brian Beard and entire staff.,0,please entire staff,"['please', 'please entire', 'please entire staff', 'entire', 'entire staff', 'staff']",0,1,0.3846153846153846
58250,I'm always pleased when I have my service done at the hospital. ,0,m please service hospital,"['m', 'm please', 'm please service', 'm please service hospital', 'please', 'please service', 'please service hospital', 'service', 'service hospital', 'hospital']",0,1,0.3846153846153846
86514,so pleased with Dr. Shell and the results from my reconstructive surgery.,0,please dr shell result reconstructive surgery,"['please', 'please dr', 'please dr shell', 'please dr shell result', 'please dr shell result reconstructive', 'please dr shell result reconstructive surgery', 'dr', 'dr shell', 'dr shell result', 'dr shell result reconstructive', 'dr shell result reconstructive surgery', 'shell', 'shell result', 'shell result reconstructive', 'shell result reconstructive surgery', 'result', 'result reconstructive', 'result reconstructive surgery', 'reconstructive', 'reconstructive surgery', 'surgery']",0,1,0.3846153846153846
103588,No needles were used to get me numb.,0,needle numb,"['needle', 'needle numb', 'numb']",1,0,0.3846153846153846
66105,I was more than pleased,0,please,['please'],0,1,0.3846153846153846
177498,I've had Botox and Lip Filler done before but I am extra pleased with Dr. Florins work.,0,ve lip filler extra please work,"['ve', 've lip', 've lip filler', 've lip filler extra', 've lip filler extra please', 've lip filler extra please work', 'lip', 'lip filler', 'lip filler extra', 'lip filler extra please', 'lip filler extra please work', 'filler', 'filler extra', 'filler extra please', 'filler extra please work', 'extra', 'extra please', 'extra please work', 'please', 'please work', 'work']",0,1,0.3846153846153846
98387,I am very pleased with this practice.,0,please practice,"['please', 'please practice', 'practice']",0,1,0.3846153846153846
112715,"Needless to say, I will not be returning to this office, nor will I recommend it to my clients.",1,needle return office recommend client,"['needle', 'needle return', 'needle return office', 'needle return office recommend', 'needle return office recommend client', 'return', 'return office', 'return office recommend', 'return office recommend client', 'office', 'office recommend', 'office recommend client', 'recommend', 'recommend client', 'client']",1,0,0.3846153846153846
152901,I came back to the office for several visits after the procedure and told both Michelle and Dr. Robinson I was not pleased.,1,come office visit procedure tell please,"['come', 'come office', 'come office visit', 'come office visit procedure', 'come office visit procedure tell', 'come office visit procedure tell please', 'office', 'office visit', 'office visit procedure', 'office visit procedure tell', 'office visit procedure tell please', 'visit', 'visit procedure', 'visit procedure tell', 'visit procedure tell please', 'procedure', 'procedure tell', 'procedure tell please', 'tell', 'tell please', 'please']",0,1,0.3846153846153846
176805,Always very pleased when I leave.,0,please leave,"['please', 'please leave', 'leave']",0,1,0.3846153846153846
163271,Couldn't be more pleased with this place.,0,please place,"['please', 'please place', 'place']",0,1,0.3846153846153846
97509,and I've been very pleased with the quality of care I've received following each surgical procedure.,0,ve please quality care ve receive follow surgical procedure,"['ve', 've please', 've please quality', 've please quality care', 've please quality care ve', 've please quality care ve receive', 've please quality care ve receive follow', 've please quality care ve receive follow surgical', 've please quality care ve receive follow surgical procedure', 'please', 'please quality', 'please quality care', 'please quality care ve', 'please quality care ve receive', 'please quality care ve receive follow', 'please quality care ve receive follow surgical', 'please quality care ve receive follow surgical procedure', 'quality', 'quality care', 'quality care ve', 'quality care ve receive', 'quality care ve receive follow', 'quality care ve receive follow surgical', 'quality care ve receive follow surgical procedure', 'care', 'care ve', 'care ve receive', 'care ve receive follow', 'care ve receive follow surgical', 'care ve receive follow surgical procedure', 've', 've receive', 've receive follow', 've receive follow surgical', 've receive follow surgical procedure', 'receive', 'receive follow', 'receive follow surgical', 'receive follow surgical procedure', 'follow', 'follow surgical', 'follow surgical procedure', 'surgical', 'surgical procedure', 'procedure']",0,1,0.3846153846153846
101409,I was able to make an informed and confident decision and I am beyond pleased with the results of the surgery.,0,able inform confident decision please result surgery,"['able', 'able inform', 'able inform confident', 'able inform confident decision', 'able inform confident decision please', 'able inform confident decision please result', 'able inform confident decision please result surgery', 'inform', 'inform confident', 'inform confident decision', 'inform confident decision please', 'inform confident decision please result', 'inform confident decision please result surgery', 'confident', 'confident decision', 'confident decision please', 'confident decision please result', 'confident decision please result surgery', 'decision', 'decision please', 'decision please result', 'decision please result surgery', 'please', 'please result', 'please result surgery', 'result', 'result surgery', 'surgery']",0,1,0.3846153846153846
105127,I had upper eyelid surgery and couldn't be more pleased with the results!,0,upper eyelid surgery please result,"['upper', 'upper eyelid', 'upper eyelid surgery', 'upper eyelid surgery please', 'upper eyelid surgery please result', 'eyelid', 'eyelid surgery', 'eyelid surgery please', 'eyelid surgery please result', 'surgery', 'surgery please', 'surgery please result', 'please', 'please result', 'result']",0,1,0.3846153846153846
75818,I am terrified of needles and pain.,1,terrify needle pain,"['terrify', 'terrify needle', 'terrify needle pain', 'needle', 'needle pain', 'pain']",1,0,0.3846153846153846
104057,I'm very pleased with this practice.,0,m please practice,"['m', 'm please', 'm please practice', 'please', 'please practice', 'practice']",0,1,0.3846153846153846
180101,If you're not a fan of needles like I amKassie is definitely your person to help ease your discomfort level.,0,fan needle like amkassie decidedly person help ease discomfort level,"['fan', 'fan needle', 'fan needle like', 'fan needle like amkassie', 'fan needle like amkassie decidedly', 'fan needle like amkassie decidedly person', 'fan needle like amkassie decidedly person help', 'fan needle like amkassie decidedly person help ease', 'fan needle like amkassie decidedly person help ease discomfort', 'fan needle like amkassie decidedly person help ease discomfort level', 'needle', 'needle like', 'needle like amkassie', 'needle like amkassie decidedly', 'needle like amkassie decidedly person', 'needle like amkassie decidedly person help', 'needle like amkassie decidedly person help ease', 'needle like amkassie decidedly person help ease discomfort', 'needle like amkassie decidedly person help ease discomfort level', 'like', 'like amkassie', 'like amkassie decidedly', 'like amkassie decidedly person', 'like amkassie decidedly person help', 'like amkassie decidedly person help ease', 'like amkassie decidedly person help ease discomfort', 'like amkassie decidedly person help ease discomfort level', 'amkassie', 'amkassie decidedly', 'amkassie decidedly person', 'amkassie decidedly person help', 'amkassie decidedly person help ease', 'amkassie decidedly person help ease discomfort', 'amkassie decidedly person help ease discomfort level', 'decidedly', 'decidedly person', 'decidedly person help', 'decidedly person help ease', 'decidedly person help ease discomfort', 'decidedly person help ease discomfort level', 'person', 'person help', 'person help ease', 'person help ease discomfort', 'person help ease discomfort level', 'help', 'help ease', 'help ease discomfort', 'help ease discomfort level', 'ease', 'ease discomfort', 'ease discomfort level', 'discomfort', 'discomfort level', 'level']",1,0,0.3846153846153846
62233,I'm very pleased with the doctor.,0,m please doctor,"['m', 'm please', 'm please doctor', 'please', 'please doctor', 'doctor']",0,1,0.3846153846153846
166396,"She legit makes the aestheticians TAPE cheap needles onto the micro needling machines,",1,leave make tape cheap needle micro needle machine,"['leave', 'leave make', 'leave make tape', 'leave make tape cheap', 'leave make tape cheap needle', 'leave make tape cheap needle micro', 'leave make tape cheap needle micro needle', 'leave make tape cheap needle micro needle machine', 'make', 'make tape', 'make tape cheap', 'make tape cheap needle', 'make tape cheap needle micro', 'make tape cheap needle micro needle', 'make tape cheap needle micro needle machine', 'tape', 'tape cheap', 'tape cheap needle', 'tape cheap needle micro', 'tape cheap needle micro needle', 'tape cheap needle micro needle machine', 'cheap', 'cheap needle', 'cheap needle micro', 'cheap needle micro needle', 'cheap needle micro needle machine', 'needle', 'needle micro', 'needle micro needle', 'needle micro needle machine', 'micro', 'micro needle', 'micro needle machine', 'needle', 'needle machine', 'machine']",1,0,0.3846153846153846
189652,"In general, I was pleased by the staff and service",0,general please staff service,"['general', 'general please', 'general please staff', 'general please staff service', 'please', 'please staff', 'please staff service', 'staff', 'staff service', 'service']",0,1,0.3846153846153846
115888,I have been very pleased with this doctor and his services at the Brentwood location and Alameda!,0,please doctor service brentwood location alarm,"['please', 'please doctor', 'please doctor service', 'please doctor service brentwood', 'please doctor service brentwood location', 'please doctor service brentwood location alarm', 'doctor', 'doctor service', 'doctor service brentwood', 'doctor service brentwood location', 'doctor service brentwood location alarm', 'service', 'service brentwood', 'service brentwood location', 'service brentwood location alarm', 'brentwood', 'brentwood location', 'brentwood location alarm', 'location', 'location alarm', 'alarm']",0,1,0.3846153846153846
73405,I underwent my rhinoplasty surgery and I can't tell you how pleased I am with the initial improvements.,0,undergo nose job surgery tell please initial improvement,"['undergo', 'undergo nose', 'undergo nose job', 'undergo nose job surgery', 'undergo nose job surgery tell', 'undergo nose job surgery tell please', 'undergo nose job surgery tell please initial', 'undergo nose job surgery tell please initial improvement', 'nose', 'nose job', 'nose job surgery', 'nose job surgery tell', 'nose job surgery tell please', 'nose job surgery tell please initial', 'nose job surgery tell please initial improvement', 'job', 'job surgery', 'job surgery tell', 'job surgery tell please', 'job surgery tell please initial', 'job surgery tell please initial improvement', 'surgery', 'surgery tell', 'surgery tell please', 'surgery tell please initial', 'surgery tell please initial improvement', 'tell', 'tell please', 'tell please initial', 'tell please initial improvement', 'please', 'please initial', 'please initial improvement', 'initial', 'initial improvement', 'improvement']",0,1,0.3846153846153846
93719,very pleased with my treatment would come back again.,0,please treatment come,"['please', 'please treatment', 'please treatment come', 'treatment', 'treatment come', 'come']",0,1,0.3846153846153846
127109,"Every procedure I have had at Dr Langdons (ExpreSs facelift, facial injections and laser resurfacing) office has been a very pleasing improvement for me.",0,procedure dr langdons express face lift facial injection laser resurface office please improvement,"['procedure', 'procedure dr', 'procedure dr langdons', 'procedure dr langdons express', 'procedure dr langdons express face', 'procedure dr langdons express face lift', 'procedure dr langdons express face lift facial', 'procedure dr langdons express face lift facial injection', 'procedure dr langdons express face lift facial injection laser', 'procedure dr langdons express face lift facial injection laser resurface', 'procedure dr langdons express face lift facial injection laser resurface office', 'procedure dr langdons express face lift facial injection laser resurface office please', 'procedure dr langdons express face lift facial injection laser resurface office please improvement', 'dr', 'dr langdons', 'dr langdons express', 'dr langdons express face', 'dr langdons express face lift', 'dr langdons express face lift facial', 'dr langdons express face lift facial injection', 'dr langdons express face lift facial injection laser', 'dr langdons express face lift facial injection laser resurface', 'dr langdons express face lift facial injection laser resurface office', 'dr langdons express face lift facial injection laser resurface office please', 'dr langdons express face lift facial injection laser resurface office please improvement', 'langdons', 'langdons express', 'langdons express face', 'langdons express face lift', 'langdons express face lift facial', 'langdons express face lift facial injection', 'langdons express face lift facial injection laser', 'langdons express face lift facial injection laser resurface', 'langdons express face lift facial injection laser resurface office', 'langdons express face lift facial injection laser resurface office please', 'langdons express face lift facial injection laser resurface office please improvement', 'express', 'express face', 'express face lift', 'express face lift facial', 'express face lift facial injection', 'express face lift facial injection laser', 'express face lift facial injection laser resurface', 'express face lift facial injection laser resurface office', 'express face lift facial injection laser resurface office please', 'express face lift facial injection laser resurface office please improvement', 'face', 'face lift', 'face lift facial', 'face lift facial injection', 'face lift facial injection laser', 'face lift facial injection laser resurface', 'face lift facial injection laser resurface office', 'face lift facial injection laser resurface office please', 'face lift facial injection laser resurface office please improvement', 'lift', 'lift facial', 'lift facial injection', 'lift facial injection laser', 'lift facial injection laser resurface', 'lift facial injection laser resurface office', 'lift facial injection laser resurface office please', 'lift facial injection laser resurface office please improvement', 'facial', 'facial injection', 'facial injection laser', 'facial injection laser resurface', 'facial injection laser resurface office', 'facial injection laser resurface office please', 'facial injection laser resurface office please improvement', 'injection', 'injection laser', 'injection laser resurface', 'injection laser resurface office', 'injection laser resurface office please', 'injection laser resurface office please improvement', 'laser', 'laser resurface', 'laser resurface office', 'laser resurface office please', 'laser resurface office please improvement', 'resurface', 'resurface office', 'resurface office please', 'resurface office please improvement', 'office', 'office please', 'office please improvement', 'please', 'please improvement', 'improvement']",0,1,0.3846153846153846
104998,I had a breast augmentation with Doctor Sam Speron and have been extremely pleased with my results.,0,breast pigmentation doctor extremely please result,"['breast', 'breast pigmentation', 'breast pigmentation doctor', 'breast pigmentation doctor extremely', 'breast pigmentation doctor extremely please', 'breast pigmentation doctor extremely please result', 'pigmentation', 'pigmentation doctor', 'pigmentation doctor extremely', 'pigmentation doctor extremely please', 'pigmentation doctor extremely please result', 'doctor', 'doctor extremely', 'doctor extremely please', 'doctor extremely please result', 'extremely', 'extremely please', 'extremely please result', 'please', 'please result', 'result']",0,1,0.3846153846153846
152558,I stilled his head and she was so quick to inject the needle.,0,skilled head quick inject needle,"['skilled', 'skilled head', 'skilled head quick', 'skilled head quick inject', 'skilled head quick inject needle', 'head', 'head quick', 'head quick inject', 'head quick inject needle', 'quick', 'quick inject', 'quick inject needle', 'inject', 'inject needle', 'needle']",1,0,0.3846153846153846
135537,"Dr. Pontell performed my rhinoplasty a little over a month and I could not be happier,. I am very pleased with the results already.",0,perform nose job little month happy please result,"['perform', 'perform nose', 'perform nose job', 'perform nose job little', 'perform nose job little month', 'perform nose job little month happy', 'perform nose job little month happy please', 'perform nose job little month happy please result', 'nose', 'nose job', 'nose job little', 'nose job little month', 'nose job little month happy', 'nose job little month happy please', 'nose job little month happy please result', 'job', 'job little', 'job little month', 'job little month happy', 'job little month happy please', 'job little month happy please result', 'little', 'little month', 'little month happy', 'little month happy please', 'little month happy please result', 'month', 'month happy', 'month happy please', 'month happy please result', 'happy', 'happy please', 'happy please result', 'please', 'please result', 'result']",0,1,0.3846153846153846
67849,My reconstructive surgery is great and I am very pleased with the end results and with my care.,0,reconstructive surgery great please end result care,"['reconstructive', 'reconstructive surgery', 'reconstructive surgery great', 'reconstructive surgery great please', 'reconstructive surgery great please end', 'reconstructive surgery great please end result', 'reconstructive surgery great please end result care', 'surgery', 'surgery great', 'surgery great please', 'surgery great please end', 'surgery great please end result', 'surgery great please end result care', 'great', 'great please', 'great please end', 'great please end result', 'great please end result care', 'please', 'please end', 'please end result', 'please end result care', 'end', 'end result', 'end result care', 'result', 'result care', 'care']",0,1,0.3846153846153846
133814,This is my second surgical appointment and we both (my husband and I) were very pleased with the service rendered.,0,surgical appointment husband please service render,"['surgical', 'surgical appointment', 'surgical appointment husband', 'surgical appointment husband please', 'surgical appointment husband please service', 'surgical appointment husband please service render', 'appointment', 'appointment husband', 'appointment husband please', 'appointment husband please service', 'appointment husband please service render', 'husband', 'husband please', 'husband please service', 'husband please service render', 'please', 'please service', 'please service render', 'service', 'service render', 'render']",0,1,0.3846153846153846
67844,I am so very pleased at the results of my breast augmentation.,0,please result breast pigmentation,"['please', 'please result', 'please result breast', 'please result breast pigmentation', 'result', 'result breast', 'result breast pigmentation', 'breast', 'breast pigmentation', 'pigmentation']",0,1,0.3846153846153846
113797,"My son, my daughter and my husband have all gotten their braces through this practice and everyone is beyond pleased with the service.",0,son daughter husband get brace practice please service,"['son', 'son daughter', 'son daughter husband', 'son daughter husband get', 'son daughter husband get brace', 'son daughter husband get brace practice', 'son daughter husband get brace practice please', 'son daughter husband get brace practice please service', 'daughter', 'daughter husband', 'daughter husband get', 'daughter husband get brace', 'daughter husband get brace practice', 'daughter husband get brace practice please', 'daughter husband get brace practice please service', 'husband', 'husband get', 'husband get brace', 'husband get brace practice', 'husband get brace practice please', 'husband get brace practice please service', 'get', 'get brace', 'get brace practice', 'get brace practice please', 'get brace practice please service', 'brace', 'brace practice', 'brace practice please', 'brace practice please service', 'practice', 'practice please', 'practice please service', 'please', 'please service', 'service']",0,1,0.3846153846153846
173887,I could not be more pleased with my cosmetic surgery.,0,please cosmetic surgery,"['please', 'please cosmetic', 'please cosmetic surgery', 'cosmetic', 'cosmetic surgery', 'surgery']",0,1,0.3846153846153846
