commentId,comment,classification,comment_processed,word_phrase_list,needle,please,similarity_score
146302,I now still have extreme numbness and pins and needles tingling in my lower palm which has not improved.,1,extreme numbness pin needle tingle low palm improved,"['extreme', 'extreme numbness', 'extreme numbness pin', 'extreme numbness pin needle', 'extreme numbness pin needle tingle', 'extreme numbness pin needle tingle low', 'extreme numbness pin needle tingle low palm', 'extreme numbness pin needle tingle low palm improved', 'numbness', 'numbness pin', 'numbness pin needle', 'numbness pin needle tingle', 'numbness pin needle tingle low', 'numbness pin needle tingle low palm', 'numbness pin needle tingle low palm improved', 'pin', 'pin needle', 'pin needle tingle', 'pin needle tingle low', 'pin needle tingle low palm', 'pin needle tingle low palm improved', 'needle', 'needle tingle', 'needle tingle low', 'needle tingle low palm', 'needle tingle low palm improved', 'tingle', 'tingle low', 'tingle low palm', 'tingle low palm improved', 'low', 'low palm', 'low palm improved', 'palm', 'palm improved', 'improved']",1,0,0.3846153846153846
143341,He was amazing I was so nervous about the needle and it hurting,0,amaze nervous needle hurt,"['amaze', 'amaze nervous', 'amaze nervous needle', 'amaze nervous needle hurt', 'nervous', 'nervous needle', 'nervous needle hurt', 'needle', 'needle hurt', 'hurt']",1,0,0.3846153846153846
168636,"From my initial inquiry phone call to the follow up after my surgery I couldn't be more pleased with the professional, courteous",0,initial inquiry phone follow surgery please professional courteous,"['initial', 'initial inquiry', 'initial inquiry phone', 'initial inquiry phone follow', 'initial inquiry phone follow surgery', 'initial inquiry phone follow surgery please', 'initial inquiry phone follow surgery please professional', 'initial inquiry phone follow surgery please professional courteous', 'inquiry', 'inquiry phone', 'inquiry phone follow', 'inquiry phone follow surgery', 'inquiry phone follow surgery please', 'inquiry phone follow surgery please professional', 'inquiry phone follow surgery please professional courteous', 'phone', 'phone follow', 'phone follow surgery', 'phone follow surgery please', 'phone follow surgery please professional', 'phone follow surgery please professional courteous', 'follow', 'follow surgery', 'follow surgery please', 'follow surgery please professional', 'follow surgery please professional courteous', 'surgery', 'surgery please', 'surgery please professional', 'surgery please professional courteous', 'please', 'please professional', 'please professional courteous', 'professional', 'professional courteous', 'courteous']",0,1,0.3846153846153846
107873,I never thought it would be possible to look in the mirror and be pleased with my body after I had my twins.,0,think possible look mirror please body twin,"['think', 'think possible', 'think possible look', 'think possible look mirror', 'think possible look mirror please', 'think possible look mirror please body', 'think possible look mirror please body twin', 'possible', 'possible look', 'possible look mirror', 'possible look mirror please', 'possible look mirror please body', 'possible look mirror please body twin', 'look', 'look mirror', 'look mirror please', 'look mirror please body', 'look mirror please body twin', 'mirror', 'mirror please', 'mirror please body', 'mirror please body twin', 'please', 'please body', 'please body twin', 'body', 'body twin', 'twin']",0,1,0.3846153846153846
164482,"I was particularly pleased that, during this pandemic, his office is spacing out the appointments",0,particularly please anemic office pace appointment,"['particularly', 'particularly please', 'particularly please anemic', 'particularly please anemic office', 'particularly please anemic office pace', 'particularly please anemic office pace appointment', 'please', 'please anemic', 'please anemic office', 'please anemic office pace', 'please anemic office pace appointment', 'anemic', 'anemic office', 'anemic office pace', 'anemic office pace appointment', 'office', 'office pace', 'office pace appointment', 'pace', 'pace appointment', 'appointment']",0,1,0.3846153846153846
103077,"Everything great so far, sorry only second time here but I am very pleased,!",0,great far sorry time please,"['great', 'great far', 'great far sorry', 'great far sorry time', 'great far sorry time please', 'far', 'far sorry', 'far sorry time', 'far sorry time please', 'sorry', 'sorry time', 'sorry time please', 'time', 'time please', 'please']",0,1,0.3846153846153846
90542,so pleased with my results I have another surgery scheduled with Dr. M on January 27th 2016.,0,please result surgery schedule dr m january th,"['please', 'please result', 'please result surgery', 'please result surgery schedule', 'please result surgery schedule dr', 'please result surgery schedule dr m', 'please result surgery schedule dr m january', 'please result surgery schedule dr m january th', 'result', 'result surgery', 'result surgery schedule', 'result surgery schedule dr', 'result surgery schedule dr m', 'result surgery schedule dr m january', 'result surgery schedule dr m january th', 'surgery', 'surgery schedule', 'surgery schedule dr', 'surgery schedule dr m', 'surgery schedule dr m january', 'surgery schedule dr m january th', 'schedule', 'schedule dr', 'schedule dr m', 'schedule dr m january', 'schedule dr m january th', 'dr', 'dr m', 'dr m january', 'dr m january th', 'm', 'm january', 'm january th', 'january', 'january th', 'th']",0,1,0.3846153846153846
119856,I am always pleased with his decisions about any procedure I?ve received in his office.,0,please decision procedure ve receive office,"['please', 'please decision', 'please decision procedure', 'please decision procedure ve', 'please decision procedure ve receive', 'please decision procedure ve receive office', 'decision', 'decision procedure', 'decision procedure ve', 'decision procedure ve receive', 'decision procedure ve receive office', 'procedure', 'procedure ve', 'procedure ve receive', 'procedure ve receive office', 've', 've receive', 've receive office', 'receive', 'receive office', 'office']",0,1,0.3846153846153846
133956,I was EXTREMELY pleased and thank goodness I'm no longer in pain.,0,extremely please thank good m long pain,"['extremely', 'extremely please', 'extremely please thank', 'extremely please thank good', 'extremely please thank good m', 'extremely please thank good m long', 'extremely please thank good m long pain', 'please', 'please thank', 'please thank good', 'please thank good m', 'please thank good m long', 'please thank good m long pain', 'thank', 'thank good', 'thank good m', 'thank good m long', 'thank good m long pain', 'good', 'good m', 'good m long', 'good m long pain', 'm', 'm long', 'm long pain', 'long', 'long pain', 'pain']",0,1,0.3846153846153846
62849,He answers my questions so I'm very pleased,0,answer question m please,"['answer', 'answer question', 'answer question m', 'answer question m please', 'question', 'question m', 'question m please', 'm', 'm please', 'please']",0,1,0.3846153846153846
121000,"Chemical peels, Fraxel, Co2 laser, PRP w/ micro needling, nothing helped.",1,feel frame co needle help,"['feel', 'feel frame', 'feel frame co', 'feel frame co needle', 'feel frame co needle help', 'frame', 'frame co', 'frame co needle', 'frame co needle help', 'co', 'co needle', 'co needle help', 'needle', 'needle help', 'help']",1,0,0.3846153846153846
161502,I have a fear of needles so I was a little nervous,1,fear needle little nervous,"['fear', 'fear needle', 'fear needle little', 'fear needle little nervous', 'needle', 'needle little', 'needle little nervous', 'little', 'little nervous', 'nervous']",1,0,0.3846153846153846
96232,I was very pleased with how inviting,0,please invite,"['please', 'please invite', 'invite']",0,1,0.3846153846153846
103757,"I was very pleased with Dr. Schecht, his manner, his explanations, the time he spent with me,",0,please dr schecht manner explanation time spend,"['please', 'please dr', 'please dr schecht', 'please dr schecht manner', 'please dr schecht manner explanation', 'please dr schecht manner explanation time', 'please dr schecht manner explanation time spend', 'dr', 'dr schecht', 'dr schecht manner', 'dr schecht manner explanation', 'dr schecht manner explanation time', 'dr schecht manner explanation time spend', 'schecht', 'schecht manner', 'schecht manner explanation', 'schecht manner explanation time', 'schecht manner explanation time spend', 'manner', 'manner explanation', 'manner explanation time', 'manner explanation time spend', 'explanation', 'explanation time', 'explanation time spend', 'time', 'time spend', 'spend']",0,1,0.3846153846153846
77359,"With just 3 treatments, I am happy with the great outcome of the needling!",0,treatment happy great result needle,"['treatment', 'treatment happy', 'treatment happy great', 'treatment happy great result', 'treatment happy great result needle', 'happy', 'happy great', 'happy great result', 'happy great result needle', 'great', 'great result', 'great result needle', 'result', 'result needle', 'needle']",1,0,0.3846153846153846
58993,I am not pleased.,1,please,['please'],0,1,0.3846153846153846
113338,Very scared after her 6 employees testified about her using dirty needles and syringes.,1,scare employee testify dirty needle syrinx,"['scare', 'scare employee', 'scare employee testify', 'scare employee testify dirty', 'scare employee testify dirty needle', 'scare employee testify dirty needle syrinx', 'employee', 'employee testify', 'employee testify dirty', 'employee testify dirty needle', 'employee testify dirty needle syrinx', 'testify', 'testify dirty', 'testify dirty needle', 'testify dirty needle syrinx', 'dirty', 'dirty needle', 'dirty needle syrinx', 'needle', 'needle syrinx', 'syrinx']",1,0,0.3846153846153846
92541,for similar work and could not be more pleased.,0,similar work please,"['similar', 'similar work', 'similar work please', 'work', 'work please', 'please']",0,1,0.3846153846153846
77484,I had a nice visit and I am pleased with everything that happened.,0,nice visit please happen,"['nice', 'nice visit', 'nice visit please', 'nice visit please happen', 'visit', 'visit please', 'visit please happen', 'please', 'please happen', 'happen']",0,1,0.3846153846153846
100169,I could not be more pleased with the quality of care and treatment I have received from Dr O'Malley.He was not only professional,0,please quality care treatment receive dr omalleyhe professional,"['please', 'please quality', 'please quality care', 'please quality care treatment', 'please quality care treatment receive', 'please quality care treatment receive dr', 'please quality care treatment receive dr omalleyhe', 'please quality care treatment receive dr omalleyhe professional', 'quality', 'quality care', 'quality care treatment', 'quality care treatment receive', 'quality care treatment receive dr', 'quality care treatment receive dr omalleyhe', 'quality care treatment receive dr omalleyhe professional', 'care', 'care treatment', 'care treatment receive', 'care treatment receive dr', 'care treatment receive dr omalleyhe', 'care treatment receive dr omalleyhe professional', 'treatment', 'treatment receive', 'treatment receive dr', 'treatment receive dr omalleyhe', 'treatment receive dr omalleyhe professional', 'receive', 'receive dr', 'receive dr omalleyhe', 'receive dr omalleyhe professional', 'dr', 'dr omalleyhe', 'dr omalleyhe professional', 'omalleyhe', 'omalleyhe professional', 'professional']",0,1,0.3846153846153846
168642,"From scheduling, to pre-op, to surgery and post op appointments, I have been incredibly pleased",0,schelling prop surgery post op appointment incredibly please,"['schelling', 'schelling prop', 'schelling prop surgery', 'schelling prop surgery post', 'schelling prop surgery post op', 'schelling prop surgery post op appointment', 'schelling prop surgery post op appointment incredibly', 'schelling prop surgery post op appointment incredibly please', 'prop', 'prop surgery', 'prop surgery post', 'prop surgery post op', 'prop surgery post op appointment', 'prop surgery post op appointment incredibly', 'prop surgery post op appointment incredibly please', 'surgery', 'surgery post', 'surgery post op', 'surgery post op appointment', 'surgery post op appointment incredibly', 'surgery post op appointment incredibly please', 'post', 'post op', 'post op appointment', 'post op appointment incredibly', 'post op appointment incredibly please', 'op', 'op appointment', 'op appointment incredibly', 'op appointment incredibly please', 'appointment', 'appointment incredibly', 'appointment incredibly please', 'incredibly', 'incredibly please', 'please']",0,1,0.3846153846153846
170711,"They use a needle-less lidocaine injection first, which was super neat.",0,use needle lidocaine injection super neat,"['use', 'use needle', 'use needle lidocaine', 'use needle lidocaine injection', 'use needle lidocaine injection super', 'use needle lidocaine injection super neat', 'needle', 'needle lidocaine', 'needle lidocaine injection', 'needle lidocaine injection super', 'needle lidocaine injection super neat', 'lidocaine', 'lidocaine injection', 'lidocaine injection super', 'lidocaine injection super neat', 'injection', 'injection super', 'injection super neat', 'super', 'super neat', 'neat']",1,0,0.3846153846153846
101414,I was able to make an informed and confident decision and I am beyond pleased with the results of the surgery.,0,able inform confident decision please result surgery,"['able', 'able inform', 'able inform confident', 'able inform confident decision', 'able inform confident decision please', 'able inform confident decision please result', 'able inform confident decision please result surgery', 'inform', 'inform confident', 'inform confident decision', 'inform confident decision please', 'inform confident decision please result', 'inform confident decision please result surgery', 'confident', 'confident decision', 'confident decision please', 'confident decision please result', 'confident decision please result surgery', 'decision', 'decision please', 'decision please result', 'decision please result surgery', 'please', 'please result', 'please result surgery', 'result', 'result surgery', 'surgery']",0,1,0.3846153846153846
173792,Very pleased with my results and would recommend the Caniglia Center to others!,0,please result recommend ganglion center,"['please', 'please result', 'please result recommend', 'please result recommend ganglion', 'please result recommend ganglion center', 'result', 'result recommend', 'result recommend ganglion', 'result recommend ganglion center', 'recommend', 'recommend ganglion', 'recommend ganglion center', 'ganglion', 'ganglion center', 'center']",0,1,0.3846153846153846
173007,"Short wait time, X-ray tech was nice, PA and nurses were excellent, very pleased",0,short wait time gray teach nice pa nurse excellent please,"['short', 'short wait', 'short wait time', 'short wait time gray', 'short wait time gray teach', 'short wait time gray teach nice', 'short wait time gray teach nice pa', 'short wait time gray teach nice pa nurse', 'short wait time gray teach nice pa nurse excellent', 'short wait time gray teach nice pa nurse excellent please', 'wait', 'wait time', 'wait time gray', 'wait time gray teach', 'wait time gray teach nice', 'wait time gray teach nice pa', 'wait time gray teach nice pa nurse', 'wait time gray teach nice pa nurse excellent', 'wait time gray teach nice pa nurse excellent please', 'time', 'time gray', 'time gray teach', 'time gray teach nice', 'time gray teach nice pa', 'time gray teach nice pa nurse', 'time gray teach nice pa nurse excellent', 'time gray teach nice pa nurse excellent please', 'gray', 'gray teach', 'gray teach nice', 'gray teach nice pa', 'gray teach nice pa nurse', 'gray teach nice pa nurse excellent', 'gray teach nice pa nurse excellent please', 'teach', 'teach nice', 'teach nice pa', 'teach nice pa nurse', 'teach nice pa nurse excellent', 'teach nice pa nurse excellent please', 'nice', 'nice pa', 'nice pa nurse', 'nice pa nurse excellent', 'nice pa nurse excellent please', 'pa', 'pa nurse', 'pa nurse excellent', 'pa nurse excellent please', 'nurse', 'nurse excellent', 'nurse excellent please', 'excellent', 'excellent please', 'please']",0,1,0.3846153846153846
135842,so happy and pleased with my breast surgery,0,happy please breast surgery,"['happy', 'happy please', 'happy please breast', 'happy please breast surgery', 'please', 'please breast', 'please breast surgery', 'breast', 'breast surgery', 'surgery']",0,1,0.3846153846153846
129313,"I was not offered PT, shock wave therapy, or needle aspiration/cortisone injection.",1,offer shock wave therapy needle aspirationcortisone injection,"['offer', 'offer shock', 'offer shock wave', 'offer shock wave therapy', 'offer shock wave therapy needle', 'offer shock wave therapy needle aspirationcortisone', 'offer shock wave therapy needle aspirationcortisone injection', 'shock', 'shock wave', 'shock wave therapy', 'shock wave therapy needle', 'shock wave therapy needle aspirationcortisone', 'shock wave therapy needle aspirationcortisone injection', 'wave', 'wave therapy', 'wave therapy needle', 'wave therapy needle aspirationcortisone', 'wave therapy needle aspirationcortisone injection', 'therapy', 'therapy needle', 'therapy needle aspirationcortisone', 'therapy needle aspirationcortisone injection', 'needle', 'needle aspirationcortisone', 'needle aspirationcortisone injection', 'aspirationcortisone', 'aspirationcortisone injection', 'injection']",1,0,0.3846153846153846
85618,The lido (numbing meds just the needle hurt) dr singer is super nice!,0,lid rubbing bed needle hurt dr singer super nice,"['lid', 'lid rubbing', 'lid rubbing bed', 'lid rubbing bed needle', 'lid rubbing bed needle hurt', 'lid rubbing bed needle hurt dr', 'lid rubbing bed needle hurt dr singer', 'lid rubbing bed needle hurt dr singer super', 'lid rubbing bed needle hurt dr singer super nice', 'rubbing', 'rubbing bed', 'rubbing bed needle', 'rubbing bed needle hurt', 'rubbing bed needle hurt dr', 'rubbing bed needle hurt dr singer', 'rubbing bed needle hurt dr singer super', 'rubbing bed needle hurt dr singer super nice', 'bed', 'bed needle', 'bed needle hurt', 'bed needle hurt dr', 'bed needle hurt dr singer', 'bed needle hurt dr singer super', 'bed needle hurt dr singer super nice', 'needle', 'needle hurt', 'needle hurt dr', 'needle hurt dr singer', 'needle hurt dr singer super', 'needle hurt dr singer super nice', 'hurt', 'hurt dr', 'hurt dr singer', 'hurt dr singer super', 'hurt dr singer super nice', 'dr', 'dr singer', 'dr singer super', 'dr singer super nice', 'singer', 'singer super', 'singer super nice', 'super', 'super nice', 'nice']",1,0,0.3846153846153846
114111,Every one is lovely here very pleased with the service.,0,lovely please service,"['lovely', 'lovely please', 'lovely please service', 'please', 'please service', 'service']",0,1,0.3846153846153846
122107,I was yelled at by staff to be quiet while they repeatedly poked me with needles because they couldn't find a vein.,1,yell staff quiet repeatedly poker needle find vein,"['yell', 'yell staff', 'yell staff quiet', 'yell staff quiet repeatedly', 'yell staff quiet repeatedly poker', 'yell staff quiet repeatedly poker needle', 'yell staff quiet repeatedly poker needle find', 'yell staff quiet repeatedly poker needle find vein', 'staff', 'staff quiet', 'staff quiet repeatedly', 'staff quiet repeatedly poker', 'staff quiet repeatedly poker needle', 'staff quiet repeatedly poker needle find', 'staff quiet repeatedly poker needle find vein', 'quiet', 'quiet repeatedly', 'quiet repeatedly poker', 'quiet repeatedly poker needle', 'quiet repeatedly poker needle find', 'quiet repeatedly poker needle find vein', 'repeatedly', 'repeatedly poker', 'repeatedly poker needle', 'repeatedly poker needle find', 'repeatedly poker needle find vein', 'poker', 'poker needle', 'poker needle find', 'poker needle find vein', 'needle', 'needle find', 'needle find vein', 'find', 'find vein', 'vein']",1,0,0.3846153846153846
168149,This is my second surgery with Dr Adams and i have been very pleased with both.,0,surgery please,"['surgery', 'surgery please', 'please']",0,1,0.3846153846153846
92650,Super pleased with my investment and final results.,0,super please investment final result,"['super', 'super please', 'super please investment', 'super please investment final', 'super please investment final result', 'please', 'please investment', 'please investment final', 'please investment final result', 'investment', 'investment final', 'investment final result', 'final', 'final result', 'result']",0,1,0.3846153846153846
142161,I trust their advice and have been so very pleased with my results!,0,trust advice please result,"['trust', 'trust advice', 'trust advice please', 'trust advice please result', 'advice', 'advice please', 'advice please result', 'please', 'please result', 'result']",0,1,0.3846153846153846
141891,My son and i both go therewe are pleased becaused we got the help we needed to live a productive life.,0,son please get help need live productive life,"['son', 'son please', 'son please get', 'son please get help', 'son please get help need', 'son please get help need live', 'son please get help need live productive', 'son please get help need live productive life', 'please', 'please get', 'please get help', 'please get help need', 'please get help need live', 'please get help need live productive', 'please get help need live productive life', 'get', 'get help', 'get help need', 'get help need live', 'get help need live productive', 'get help need live productive life', 'help', 'help need', 'help need live', 'help need live productive', 'help need live productive life', 'need', 'need live', 'need live productive', 'need live productive life', 'live', 'live productive', 'live productive life', 'productive', 'productive life', 'life']",0,1,0.3846153846153846
66931,I'm pleased with his work,0,m please work,"['m', 'm please', 'm please work', 'please', 'please work', 'work']",0,1,0.3846153846153846
131187,Needless to say I am elated with the results!,0,needle elated result,"['needle', 'needle elated', 'needle elated result', 'elated', 'elated result', 'result']",1,0,0.3846153846153846
127678,"I was very pleased with my initial consultation, which isn't surprising because I already knew how amazing Dr. DeJoseph was.",0,please initial consultation surprise know amaze,"['please', 'please initial', 'please initial consultation', 'please initial consultation surprise', 'please initial consultation surprise know', 'please initial consultation surprise know amaze', 'initial', 'initial consultation', 'initial consultation surprise', 'initial consultation surprise know', 'initial consultation surprise know amaze', 'consultation', 'consultation surprise', 'consultation surprise know', 'consultation surprise know amaze', 'surprise', 'surprise know', 'surprise know amaze', 'know', 'know amaze', 'amaze']",0,1,0.3846153846153846
148125,Had two (2) different surgeries with Dr. Knight and I couldn't be more pleased.,0,different forgery please,"['different', 'different forgery', 'different forgery please', 'forgery', 'forgery please', 'please']",0,1,0.3846153846153846
152940,"I was a little shocked and at the same time, pleased that once it came down to Performance Time;",0,little shock time please come performance time,"['little', 'little shock', 'little shock time', 'little shock time please', 'little shock time please come', 'little shock time please come performance', 'little shock time please come performance time', 'shock', 'shock time', 'shock time please', 'shock time please come', 'shock time please come performance', 'shock time please come performance time', 'time', 'time please', 'time please come', 'time please come performance', 'time please come performance time', 'please', 'please come', 'please come performance', 'please come performance time', 'come', 'come performance', 'come performance time', 'performance', 'performance time', 'time']",0,1,0.3846153846153846
114244,I had my procedure done roughly a month ago at the Parker center and I am extremely pleased with the results.,0,procedure parker center extremely please result,"['procedure', 'procedure parker', 'procedure parker center', 'procedure parker center extremely', 'procedure parker center extremely please', 'procedure parker center extremely please result', 'parker', 'parker center', 'parker center extremely', 'parker center extremely please', 'parker center extremely please result', 'center', 'center extremely', 'center extremely please', 'center extremely please result', 'extremely', 'extremely please', 'extremely please result', 'please', 'please result', 'result']",0,1,0.3846153846153846
98545,"First, let me say I was so pleased with today's visit that I may change my current dermatolog.",0,let please today visit change current dermatolog,"['let', 'let please', 'let please today', 'let please today visit', 'let please today visit change', 'let please today visit change current', 'let please today visit change current dermatolog', 'please', 'please today', 'please today visit', 'please today visit change', 'please today visit change current', 'please today visit change current dermatolog', 'today', 'today visit', 'today visit change', 'today visit change current', 'today visit change current dermatolog', 'visit', 'visit change', 'visit change current', 'visit change current dermatolog', 'change', 'change current', 'change current dermatolog', 'current', 'current dermatolog', 'dermatolog']",0,1,0.3846153846153846
