commentId,comment,classification,comment_processed,word_phrase_list,needle,please,similarity_score
123857,"FYI, to indicate how very pleased I am, I am willing to commute 2 - 2 1/2 hours each way, to specifically see these gentlemen.",0,foi indicate please willing commune way specifically gentleman,"['foi', 'foi indicate', 'foi indicate please', 'foi indicate please willing', 'foi indicate please willing commune', 'foi indicate please willing commune way', 'foi indicate please willing commune way specifically', 'foi indicate please willing commune way specifically gentleman', 'indicate', 'indicate please', 'indicate please willing', 'indicate please willing commune', 'indicate please willing commune way', 'indicate please willing commune way specifically', 'indicate please willing commune way specifically gentleman', 'please', 'please willing', 'please willing commune', 'please willing commune way', 'please willing commune way specifically', 'please willing commune way specifically gentleman', 'willing', 'willing commune', 'willing commune way', 'willing commune way specifically', 'willing commune way specifically gentleman', 'commune', 'commune way', 'commune way specifically', 'commune way specifically gentleman', 'way', 'way specifically', 'way specifically gentleman', 'specifically', 'specifically gentleman', 'gentleman']",0,1,0.3846153846153846
176731,Needless to say that I happily left the clinic that day with a firm date for my surgery.,0,needle happily leave clinic firm date surgery,"['needle', 'needle happily', 'needle happily leave', 'needle happily leave clinic', 'needle happily leave clinic firm', 'needle happily leave clinic firm date', 'needle happily leave clinic firm date surgery', 'happily', 'happily leave', 'happily leave clinic', 'happily leave clinic firm', 'happily leave clinic firm date', 'happily leave clinic firm date surgery', 'leave', 'leave clinic', 'leave clinic firm', 'leave clinic firm date', 'leave clinic firm date surgery', 'clinic', 'clinic firm', 'clinic firm date', 'clinic firm date surgery', 'firm', 'firm date', 'firm date surgery', 'date', 'date surgery', 'surgery']",1,0,0.3846153846153846
154648,Not pleased with either.,1,please,['please'],0,1,0.3846153846153846
150026,"She said she hit a nerve and kept the needle in searching, I said that really hurts.",1,say hit nerve keep needle search say hurt,"['say', 'say hit', 'say hit nerve', 'say hit nerve keep', 'say hit nerve keep needle', 'say hit nerve keep needle search', 'say hit nerve keep needle search say', 'say hit nerve keep needle search say hurt', 'hit', 'hit nerve', 'hit nerve keep', 'hit nerve keep needle', 'hit nerve keep needle search', 'hit nerve keep needle search say', 'hit nerve keep needle search say hurt', 'nerve', 'nerve keep', 'nerve keep needle', 'nerve keep needle search', 'nerve keep needle search say', 'nerve keep needle search say hurt', 'keep', 'keep needle', 'keep needle search', 'keep needle search say', 'keep needle search say hurt', 'needle', 'needle search', 'needle search say', 'needle search say hurt', 'search', 'search say', 'search say hurt', 'say', 'say hurt', 'hurt']",1,0,0.3846153846153846
142895,Needless to say I?m very happy.,0,needle m happy,"['needle', 'needle m', 'needle m happy', 'm', 'm happy', 'happy']",1,0,0.3846153846153846
105043,I couldn't be more pleased with my care and the quality of work he performed!!,0,please care quality work perform,"['please', 'please care', 'please care quality', 'please care quality work', 'please care quality work perform', 'care', 'care quality', 'care quality work', 'care quality work perform', 'quality', 'quality work', 'quality work perform', 'work', 'work perform', 'perform']",0,1,0.3846153846153846
57695,I was very pleased with my visit.,0,please visit,"['please', 'please visit', 'visit']",0,1,0.3846153846153846
91398,Pleased with Result. 10 weeks pregnancy check up with doctor Kelly.,0,please result pregnancy check doctor,"['please', 'please result', 'please result pregnancy', 'please result pregnancy check', 'please result pregnancy check doctor', 'result', 'result pregnancy', 'result pregnancy check', 'result pregnancy check doctor', 'pregnancy', 'pregnancy check', 'pregnancy check doctor', 'check', 'check doctor', 'doctor']",0,1,0.3846153846153846
136192,I could not be more pleased with my experience here.,0,please experience,"['please', 'please experience', 'experience']",0,1,0.3846153846153846
66487,I was pleased with his job.,0,please job,"['please', 'please job', 'job']",0,1,0.3846153846153846
156401,From my first appointment to final appointment I have been extremely pleased.,0,appointment final appointment extremely please,"['appointment', 'appointment final', 'appointment final appointment', 'appointment final appointment extremely', 'appointment final appointment extremely please', 'final', 'final appointment', 'final appointment extremely', 'final appointment extremely please', 'appointment', 'appointment extremely', 'appointment extremely please', 'extremely', 'extremely please', 'please']",0,1,0.3846153846153846
92606,Very pleased with the front staff.,0,please staff,"['please', 'please staff', 'staff']",0,1,0.3846153846153846
161431,I have been extremely pleased with the customer service at this facility.,0,extremely please customer service facility,"['extremely', 'extremely please', 'extremely please customer', 'extremely please customer service', 'extremely please customer service facility', 'please', 'please customer', 'please customer service', 'please customer service facility', 'customer', 'customer service', 'customer service facility', 'service', 'service facility', 'facility']",0,1,0.3846153846153846
116295,"So, it was like having tiny needles injected into your veins every 8 hours.",1,like have bantam needle inject vein,"['like', 'like have', 'like have bantam', 'like have bantam needle', 'like have bantam needle inject', 'like have bantam needle inject vein', 'have', 'have bantam', 'have bantam needle', 'have bantam needle inject', 'have bantam needle inject vein', 'bantam', 'bantam needle', 'bantam needle inject', 'bantam needle inject vein', 'needle', 'needle inject', 'needle inject vein', 'inject', 'inject vein', 'vein']",1,0,0.3846153846153846
100639,I am so pleased with my entire experience.,0,please entire experience,"['please', 'please entire', 'please entire experience', 'entire', 'entire experience', 'experience']",0,1,0.3846153846153846
130421,Surgery went well with no complications and I'm very pleased with the entire experience.,0,surgery go complication m please entire experience,"['surgery', 'surgery go', 'surgery go complication', 'surgery go complication m', 'surgery go complication m please', 'surgery go complication m please entire', 'surgery go complication m please entire experience', 'go', 'go complication', 'go complication m', 'go complication m please', 'go complication m please entire', 'go complication m please entire experience', 'complication', 'complication m', 'complication m please', 'complication m please entire', 'complication m please entire experience', 'm', 'm please', 'm please entire', 'm please entire experience', 'please', 'please entire', 'please entire experience', 'entire', 'entire experience', 'experience']",0,1,0.3846153846153846
97981,I most pleased with Dr.Boon's personal updates via cellular phone.,0,please dragoon personal update cellular phone,"['please', 'please dragoon', 'please dragoon personal', 'please dragoon personal update', 'please dragoon personal update cellular', 'please dragoon personal update cellular phone', 'dragoon', 'dragoon personal', 'dragoon personal update', 'dragoon personal update cellular', 'dragoon personal update cellular phone', 'personal', 'personal update', 'personal update cellular', 'personal update cellular phone', 'update', 'update cellular', 'update cellular phone', 'cellular', 'cellular phone', 'phone']",0,1,0.3846153846153846
96396,"I had surgery about 7 months ago, and I am pleased with outcome",0,surgery please result,"['surgery', 'surgery please', 'surgery please result', 'please', 'please result', 'result']",0,1,0.3846153846153846
160017,Yoko is an artist with her tiny needle.,0,artist bantam needle,"['artist', 'artist bantam', 'artist bantam needle', 'bantam', 'bantam needle', 'needle']",1,0,0.3846153846153846
122579,My wife and I are very pleased with our choice of physician we chose for the specific procedures.,0,wife please choice doctor choose specific procedure,"['wife', 'wife please', 'wife please choice', 'wife please choice doctor', 'wife please choice doctor choose', 'wife please choice doctor choose specific', 'wife please choice doctor choose specific procedure', 'please', 'please choice', 'please choice doctor', 'please choice doctor choose', 'please choice doctor choose specific', 'please choice doctor choose specific procedure', 'choice', 'choice doctor', 'choice doctor choose', 'choice doctor choose specific', 'choice doctor choose specific procedure', 'doctor', 'doctor choose', 'doctor choose specific', 'doctor choose specific procedure', 'choose', 'choose specific', 'choose specific procedure', 'specific', 'specific procedure', 'procedure']",0,1,0.3846153846153846
142773,I have been extremely pleased since I started coming here a couple years ago.,0,extremely please start come,"['extremely', 'extremely please', 'extremely please start', 'extremely please start come', 'please', 'please start', 'please start come', 'start', 'start come', 'come']",0,1,0.3846153846153846
164857,We are not finished with all the work I need but I know that I will be pleased.,0,finish work need know please,"['finish', 'finish work', 'finish work need', 'finish work need know', 'finish work need know please', 'work', 'work need', 'work need know', 'work need know please', 'need', 'need know', 'need know please', 'know', 'know please', 'please']",0,1,0.3846153846153846
155814,I had Lynn and she was so sweet and handled my fear of needles like a pro!,0,sweet handle fear needle like pro,"['sweet', 'sweet handle', 'sweet handle fear', 'sweet handle fear needle', 'sweet handle fear needle like', 'sweet handle fear needle like pro', 'handle', 'handle fear', 'handle fear needle', 'handle fear needle like', 'handle fear needle like pro', 'fear', 'fear needle', 'fear needle like', 'fear needle like pro', 'needle', 'needle like', 'needle like pro', 'like', 'like pro', 'pro']",1,0,0.3846153846153846
118281,Plus she keeps dropping everything and the needles.,1,plus keep drop needle,"['plus', 'plus keep', 'plus keep drop', 'plus keep drop needle', 'keep', 'keep drop', 'keep drop needle', 'drop', 'drop needle', 'needle']",1,0,0.3846153846153846
58979,I was pleased with the overall experience.,0,please overall experience,"['please', 'please overall', 'please overall experience', 'overall', 'overall experience', 'experience']",0,1,0.3846153846153846
160864,I trusted Dr. Parekattil and his staff and could not be more pleased.,0,trust dr parekattil staff please,"['trust', 'trust dr', 'trust dr parekattil', 'trust dr parekattil staff', 'trust dr parekattil staff please', 'dr', 'dr parekattil', 'dr parekattil staff', 'dr parekattil staff please', 'parekattil', 'parekattil staff', 'parekattil staff please', 'staff', 'staff please', 'please']",0,1,0.3846153846153846
114355,"Although still swollen, I am so pleased with the results already!",0,swell please result,"['swell', 'swell please', 'swell please result', 'please', 'please result', 'result']",0,1,0.3846153846153846
60276,I was pleased at what he had to tell me,0,please tell,"['please', 'please tell', 'tell']",0,1,0.3846153846153846
170854,I got the IV drip therapy and it was really a pleasant experience for someone who isn't used to needles.,0,get four drip therapy pleasant experience needle,"['get', 'get four', 'get four drip', 'get four drip therapy', 'get four drip therapy pleasant', 'get four drip therapy pleasant experience', 'get four drip therapy pleasant experience needle', 'four', 'four drip', 'four drip therapy', 'four drip therapy pleasant', 'four drip therapy pleasant experience', 'four drip therapy pleasant experience needle', 'drip', 'drip therapy', 'drip therapy pleasant', 'drip therapy pleasant experience', 'drip therapy pleasant experience needle', 'therapy', 'therapy pleasant', 'therapy pleasant experience', 'therapy pleasant experience needle', 'pleasant', 'pleasant experience', 'pleasant experience needle', 'experience', 'experience needle', 'needle']",1,0,0.3846153846153846
112478,I've had variety of services done with Cindy and have been more than pleased with all them.,0,ve variety service windy please,"['ve', 've variety', 've variety service', 've variety service windy', 've variety service windy please', 'variety', 'variety service', 'variety service windy', 'variety service windy please', 'service', 'service windy', 'service windy please', 'windy', 'windy please', 'please']",0,1,0.3846153846153846
66667,We are extremely pleased as a family.,0,extremely please family,"['extremely', 'extremely please', 'extremely please family', 'please', 'please family', 'family']",0,1,0.3846153846153846
59356,He explained everything carefully and I have been extremely pleased with everything concerning this doctor.,0,explain carefully extremely please concern doctor,"['explain', 'explain carefully', 'explain carefully extremely', 'explain carefully extremely please', 'explain carefully extremely please concern', 'explain carefully extremely please concern doctor', 'carefully', 'carefully extremely', 'carefully extremely please', 'carefully extremely please concern', 'carefully extremely please concern doctor', 'extremely', 'extremely please', 'extremely please concern', 'extremely please concern doctor', 'please', 'please concern', 'please concern doctor', 'concern', 'concern doctor', 'doctor']",0,1,0.3846153846153846
117057,"I get 2 surgery with dr wise and I?m pleased with he?s job,he?s a wonderful doctor",0,surgery dr wise m please s jones fantastic doctor,"['surgery', 'surgery dr', 'surgery dr wise', 'surgery dr wise m', 'surgery dr wise m please', 'surgery dr wise m please s', 'surgery dr wise m please s jones', 'surgery dr wise m please s jones fantastic', 'surgery dr wise m please s jones fantastic doctor', 'dr', 'dr wise', 'dr wise m', 'dr wise m please', 'dr wise m please s', 'dr wise m please s jones', 'dr wise m please s jones fantastic', 'dr wise m please s jones fantastic doctor', 'wise', 'wise m', 'wise m please', 'wise m please s', 'wise m please s jones', 'wise m please s jones fantastic', 'wise m please s jones fantastic doctor', 'm', 'm please', 'm please s', 'm please s jones', 'm please s jones fantastic', 'm please s jones fantastic doctor', 'please', 'please s', 'please s jones', 'please s jones fantastic', 'please s jones fantastic doctor', 's', 's jones', 's jones fantastic', 's jones fantastic doctor', 'jones', 'jones fantastic', 'jones fantastic doctor', 'fantastic', 'fantastic doctor', 'doctor']",0,1,0.3846153846153846
59524,I was very pleased with his knowledge of my situation and how to make it better,0,please cognition situation good,"['please', 'please cognition', 'please cognition situation', 'please cognition situation good', 'cognition', 'cognition situation', 'cognition situation good', 'situation', 'situation good', 'good']",0,1,0.3846153846153846
85319,"I'm absolutely pleased, even years later with my procedure.",0,m absolutely please procedure,"['m', 'm absolutely', 'm absolutely please', 'm absolutely please procedure', 'absolutely', 'absolutely please', 'absolutely please procedure', 'please', 'please procedure', 'procedure']",0,1,0.3846153846153846
89376,"Needless to say, I'm going to have to find another doctor.",1,needle m go find doctor,"['needle', 'needle m', 'needle m go', 'needle m go find', 'needle m go find doctor', 'm', 'm go', 'm go find', 'm go find doctor', 'go', 'go find', 'go find doctor', 'find', 'find doctor', 'doctor']",1,0,0.3846153846153846
130796,"and the xray machine to guide the needle through the nerves, was not seen during the first injection;",1,gray machine guide needle nerve see injection,"['gray', 'gray machine', 'gray machine guide', 'gray machine guide needle', 'gray machine guide needle nerve', 'gray machine guide needle nerve see', 'gray machine guide needle nerve see injection', 'machine', 'machine guide', 'machine guide needle', 'machine guide needle nerve', 'machine guide needle nerve see', 'machine guide needle nerve see injection', 'guide', 'guide needle', 'guide needle nerve', 'guide needle nerve see', 'guide needle nerve see injection', 'needle', 'needle nerve', 'needle nerve see', 'needle nerve see injection', 'nerve', 'nerve see', 'nerve see injection', 'see', 'see injection', 'injection']",1,0,0.3846153846153846
120732,"Excellent bedside manner, very pleased.",0,excellent bedside manner please,"['excellent', 'excellent bedside', 'excellent bedside manner', 'excellent bedside manner please', 'bedside', 'bedside manner', 'bedside manner please', 'manner', 'manner please', 'please']",0,1,0.3846153846153846
176970,"I'm really pleased with my surgery, and the outcomes are perfect.",0,m please surgery result perfect,"['m', 'm please', 'm please surgery', 'm please surgery result', 'm please surgery result perfect', 'please', 'please surgery', 'please surgery result', 'please surgery result perfect', 'surgery', 'surgery result', 'surgery result perfect', 'result', 'result perfect', 'perfect']",0,1,0.3846153846153846
61701,I'm very pleased with this doctor,0,m please doctor,"['m', 'm please', 'm please doctor', 'please', 'please doctor', 'doctor']",0,1,0.3846153846153846
66404,I've been extremely pleased with her.,0,ve extremely please,"['ve', 've extremely', 've extremely please', 'extremely', 'extremely please', 'please']",0,1,0.3846153846153846
94644,"Dr. White's botox techniques made my experience with needles quick, painless",0,technique experience needle quick painless,"['technique', 'technique experience', 'technique experience needle', 'technique experience needle quick', 'technique experience needle quick painless', 'experience', 'experience needle', 'experience needle quick', 'experience needle quick painless', 'needle', 'needle quick', 'needle quick painless', 'quick', 'quick painless', 'painless']",1,0,0.3846153846153846
127607,"Everyone was very pleasant, and I was pleased that I saw the doctor at the exact time of my appointment.",0,pleasant please see doctor exact time appointment,"['pleasant', 'pleasant please', 'pleasant please see', 'pleasant please see doctor', 'pleasant please see doctor exact', 'pleasant please see doctor exact time', 'pleasant please see doctor exact time appointment', 'please', 'please see', 'please see doctor', 'please see doctor exact', 'please see doctor exact time', 'please see doctor exact time appointment', 'see', 'see doctor', 'see doctor exact', 'see doctor exact time', 'see doctor exact time appointment', 'doctor', 'doctor exact', 'doctor exact time', 'doctor exact time appointment', 'exact', 'exact time', 'exact time appointment', 'time', 'time appointment', 'appointment']",0,1,0.3846153846153846
104044,They handled my aversion to needles very well and the doctor was sensitive to my pregnancy situation.,0,handle aversion needle doctor sensitive pregnancy situation,"['handle', 'handle aversion', 'handle aversion needle', 'handle aversion needle doctor', 'handle aversion needle doctor sensitive', 'handle aversion needle doctor sensitive pregnancy', 'handle aversion needle doctor sensitive pregnancy situation', 'aversion', 'aversion needle', 'aversion needle doctor', 'aversion needle doctor sensitive', 'aversion needle doctor sensitive pregnancy', 'aversion needle doctor sensitive pregnancy situation', 'needle', 'needle doctor', 'needle doctor sensitive', 'needle doctor sensitive pregnancy', 'needle doctor sensitive pregnancy situation', 'doctor', 'doctor sensitive', 'doctor sensitive pregnancy', 'doctor sensitive pregnancy situation', 'sensitive', 'sensitive pregnancy', 'sensitive pregnancy situation', 'pregnancy', 'pregnancy situation', 'situation']",1,0,0.3846153846153846
131130,I am very pleased with the professional treatment by Dr. Alvarez and the complete attending staff.,0,please professional treatment complete attend staff,"['please', 'please professional', 'please professional treatment', 'please professional treatment complete', 'please professional treatment complete attend', 'please professional treatment complete attend staff', 'professional', 'professional treatment', 'professional treatment complete', 'professional treatment complete attend', 'professional treatment complete attend staff', 'treatment', 'treatment complete', 'treatment complete attend', 'treatment complete attend staff', 'complete', 'complete attend', 'complete attend staff', 'attend', 'attend staff', 'staff']",0,1,0.3846153846153846
140499,We are very pleased that Dr. Barry has become our vet!,0,please dr meet,"['please', 'please dr', 'please dr meet', 'dr', 'dr meet', 'meet']",0,1,0.3846153846153846
100097,I could not be more pleased with the results.,0,please result,"['please', 'please result', 'result']",0,1,0.3846153846153846
130329,Three weeks out of surgery and I?m beyond pleased with my results.,0,surgery m please result,"['surgery', 'surgery m', 'surgery m please', 'surgery m please result', 'm', 'm please', 'm please result', 'please', 'please result', 'result']",0,1,0.3846153846153846
123059,I am pleased with the entire program.,0,please entire program,"['please', 'please entire', 'please entire program', 'entire', 'entire program', 'program']",0,1,0.3846153846153846
81947,"58 Yr Old Professional Male, Very Pleased.",0,old professional male please,"['old', 'old professional', 'old professional male', 'old professional male please', 'professional', 'professional male', 'professional male please', 'male', 'male please', 'please']",0,1,0.3846153846153846
100371,Very pleased.,0,please,['please'],0,1,0.3846153846153846
188260,I was very pleased with dr Wong.,0,please dr long,"['please', 'please dr', 'please dr long', 'dr', 'dr long', 'long']",0,1,0.3846153846153846
152150,I've had a BBL done and I am less than pleased with how it turned out.,1,ve bal please turn,"['ve', 've bal', 've bal please', 've bal please turn', 'bal', 'bal please', 'bal please turn', 'please', 'please turn', 'turn']",0,1,0.3846153846153846
169137,I was very pleased and happy with my treatment that I received today.,0,please happy treatment receive,"['please', 'please happy', 'please happy treatment', 'please happy treatment receive', 'happy', 'happy treatment', 'happy treatment receive', 'treatment', 'treatment receive', 'receive']",0,1,0.3846153846153846
110376,I had no bruising and I was pleased with my appearance afterwards.,0,bruise please appearance,"['bruise', 'bruise please', 'bruise please appearance', 'please', 'please appearance', 'appearance']",0,1,0.3846153846153846
132982,I've received care for 3 weeks now and I am very pleased and happy with my improvements.,0,ve receive care please happy improvement,"['ve', 've receive', 've receive care', 've receive care please', 've receive care please happy', 've receive care please happy improvement', 'receive', 'receive care', 'receive care please', 'receive care please happy', 'receive care please happy improvement', 'care', 'care please', 'care please happy', 'care please happy improvement', 'please', 'please happy', 'please happy improvement', 'happy', 'happy improvement', 'improvement']",0,1,0.3846153846153846
128348,I've waited almost 30 years for this and I couldn't be more pleased.,0,ve wait please,"['ve', 've wait', 've wait please', 'wait', 'wait please', 'please']",0,1,0.3846153846153846
144477,As a new patient I could not be any more pleased with my experience with this practice.,0,new patient please experience practice,"['new', 'new patient', 'new patient please', 'new patient please experience', 'new patient please experience practice', 'patient', 'patient please', 'patient please experience', 'patient please experience practice', 'please', 'please experience', 'please experience practice', 'experience', 'experience practice', 'practice']",0,1,0.3846153846153846
97766,"Laser used, NO NEEDLE needed!!!",0,laser needle need,"['laser', 'laser needle', 'laser needle need', 'needle', 'needle need', 'need']",1,0,0.3846153846153846
140090,"I am very pleased that I still look like myself, minus 5 years or so!",0,please look like minus,"['please', 'please look', 'please look like', 'please look like minus', 'look', 'look like', 'look like minus', 'like', 'like minus', 'minus']",0,1,0.3846153846153846
130327,Three weeks out of surgery and I'm beyond pleased with my results.,0,surgery m please result,"['surgery', 'surgery m', 'surgery m please', 'surgery m please result', 'm', 'm please', 'm please result', 'please', 'please result', 'result']",0,1,0.3846153846153846
82118,"and Listed to all my complaints, very pleased with her caring.",0,list complaint please dare,"['list', 'list complaint', 'list complaint please', 'list complaint please dare', 'complaint', 'complaint please', 'complaint please dare', 'please', 'please dare', 'dare']",0,1,0.3846153846153846
97547,I am pleased with the quality of service I have received here,0,please quality service receive,"['please', 'please quality', 'please quality service', 'please quality service receive', 'quality', 'quality service', 'quality service receive', 'service', 'service receive', 'receive']",0,1,0.3846153846153846
82972,so far I could not be more pleased.,0,far please,"['far', 'far please', 'please']",0,1,0.3846153846153846
