commentId,comment,classification,comment_processed,word_phrase_list,clinic,cold,invite,similarity_score
104673,"Friendly, informative, happy I selected this clinic.",0,friendly information happy choose clinic,"['friendly', 'friendly information', 'friendly information happy', 'friendly information happy choose', 'friendly information happy choose clinic', 'information', 'information happy', 'information happy choose', 'information happy choose clinic', 'happy', 'happy choose', 'happy choose clinic', 'choose', 'choose clinic', 'clinic']",1,0,0,0.5
91662,and not feel like a monster :) The clinic is impeccable - I'm a neat freak/ germaphobe OCD person.,0,feel like monster clinic implacable m neat freak germaphobe old person,"['feel', 'feel like', 'feel like monster', 'feel like monster clinic', 'feel like monster clinic implacable', 'feel like monster clinic implacable m', 'feel like monster clinic implacable m neat', 'feel like monster clinic implacable m neat freak', 'feel like monster clinic implacable m neat freak germaphobe', 'feel like monster clinic implacable m neat freak germaphobe old', 'feel like monster clinic implacable m neat freak germaphobe old person', 'like', 'like monster', 'like monster clinic', 'like monster clinic implacable', 'like monster clinic implacable m', 'like monster clinic implacable m neat', 'like monster clinic implacable m neat freak', 'like monster clinic implacable m neat freak germaphobe', 'like monster clinic implacable m neat freak germaphobe old', 'like monster clinic implacable m neat freak germaphobe old person', 'monster', 'monster clinic', 'monster clinic implacable', 'monster clinic implacable m', 'monster clinic implacable m neat', 'monster clinic implacable m neat freak', 'monster clinic implacable m neat freak germaphobe', 'monster clinic implacable m neat freak germaphobe old', 'monster clinic implacable m neat freak germaphobe old person', 'clinic', 'clinic implacable', 'clinic implacable m', 'clinic implacable m neat', 'clinic implacable m neat freak', 'clinic implacable m neat freak germaphobe', 'clinic implacable m neat freak germaphobe old', 'clinic implacable m neat freak germaphobe old person', 'implacable', 'implacable m', 'implacable m neat', 'implacable m neat freak', 'implacable m neat freak germaphobe', 'implacable m neat freak germaphobe old', 'implacable m neat freak germaphobe old person', 'm', 'm neat', 'm neat freak', 'm neat freak germaphobe', 'm neat freak germaphobe old', 'm neat freak germaphobe old person', 'neat', 'neat freak', 'neat freak germaphobe', 'neat freak germaphobe old', 'neat freak germaphobe old person', 'freak', 'freak germaphobe', 'freak germaphobe old', 'freak germaphobe old person', 'germaphobe', 'germaphobe old', 'germaphobe old person', 'old', 'old person', 'person']",1,0,0,0.5
176731,Needless to say that I happily left the clinic that day with a firm date for my surgery.,0,needle happily leave clinic firm date surgery,"['needle', 'needle happily', 'needle happily leave', 'needle happily leave clinic', 'needle happily leave clinic firm', 'needle happily leave clinic firm date', 'needle happily leave clinic firm date surgery', 'happily', 'happily leave', 'happily leave clinic', 'happily leave clinic firm', 'happily leave clinic firm date', 'happily leave clinic firm date surgery', 'leave', 'leave clinic', 'leave clinic firm', 'leave clinic firm date', 'leave clinic firm date surgery', 'clinic', 'clinic firm', 'clinic firm date', 'clinic firm date surgery', 'firm', 'firm date', 'firm date surgery', 'date', 'date surgery', 'surgery']",1,0,0,0.5
156211,and assess my health are a true testament to the level of care The Clinic for Plastic Surgery provides for patients.,0,ass health true testament level care clinic plastic surgery provide patient,"['ass', 'ass health', 'ass health true', 'ass health true testament', 'ass health true testament level', 'ass health true testament level care', 'ass health true testament level care clinic', 'ass health true testament level care clinic plastic', 'ass health true testament level care clinic plastic surgery', 'ass health true testament level care clinic plastic surgery provide', 'ass health true testament level care clinic plastic surgery provide patient', 'health', 'health true', 'health true testament', 'health true testament level', 'health true testament level care', 'health true testament level care clinic', 'health true testament level care clinic plastic', 'health true testament level care clinic plastic surgery', 'health true testament level care clinic plastic surgery provide', 'health true testament level care clinic plastic surgery provide patient', 'true', 'true testament', 'true testament level', 'true testament level care', 'true testament level care clinic', 'true testament level care clinic plastic', 'true testament level care clinic plastic surgery', 'true testament level care clinic plastic surgery provide', 'true testament level care clinic plastic surgery provide patient', 'testament', 'testament level', 'testament level care', 'testament level care clinic', 'testament level care clinic plastic', 'testament level care clinic plastic surgery', 'testament level care clinic plastic surgery provide', 'testament level care clinic plastic surgery provide patient', 'level', 'level care', 'level care clinic', 'level care clinic plastic', 'level care clinic plastic surgery', 'level care clinic plastic surgery provide', 'level care clinic plastic surgery provide patient', 'care', 'care clinic', 'care clinic plastic', 'care clinic plastic surgery', 'care clinic plastic surgery provide', 'care clinic plastic surgery provide patient', 'clinic', 'clinic plastic', 'clinic plastic surgery', 'clinic plastic surgery provide', 'clinic plastic surgery provide patient', 'plastic', 'plastic surgery', 'plastic surgery provide', 'plastic surgery provide patient', 'surgery', 'surgery provide', 'surgery provide patient', 'provide', 'provide patient', 'patient']",1,0,0,0.5
139459,"this clinic is a rude busy clinic ,they ll tell you they are busy",1,clinic rude busy clinic ll tell busy,"['clinic', 'clinic rude', 'clinic rude busy', 'clinic rude busy clinic', 'clinic rude busy clinic ll', 'clinic rude busy clinic ll tell', 'clinic rude busy clinic ll tell busy', 'rude', 'rude busy', 'rude busy clinic', 'rude busy clinic ll', 'rude busy clinic ll tell', 'rude busy clinic ll tell busy', 'busy', 'busy clinic', 'busy clinic ll', 'busy clinic ll tell', 'busy clinic ll tell busy', 'clinic', 'clinic ll', 'clinic ll tell', 'clinic ll tell busy', 'll', 'll tell', 'll tell busy', 'tell', 'tell busy', 'busy']",1,0,0,0.5
126138,and they left me without help and unable to speak to anyone at the clinic.,1,leave help unable speak clinic,"['leave', 'leave help', 'leave help unable', 'leave help unable speak', 'leave help unable speak clinic', 'help', 'help unable', 'help unable speak', 'help unable speak clinic', 'unable', 'unable speak', 'unable speak clinic', 'speak', 'speak clinic', 'clinic']",1,0,0,0.5
122577,The clinic was super clean and everyone was friendly and understanding to the fact that I was late and the weather sucked.,0,clinic super clean friendly understanding fact late weather suck,"['clinic', 'clinic super', 'clinic super clean', 'clinic super clean friendly', 'clinic super clean friendly understanding', 'clinic super clean friendly understanding fact', 'clinic super clean friendly understanding fact late', 'clinic super clean friendly understanding fact late weather', 'clinic super clean friendly understanding fact late weather suck', 'super', 'super clean', 'super clean friendly', 'super clean friendly understanding', 'super clean friendly understanding fact', 'super clean friendly understanding fact late', 'super clean friendly understanding fact late weather', 'super clean friendly understanding fact late weather suck', 'clean', 'clean friendly', 'clean friendly understanding', 'clean friendly understanding fact', 'clean friendly understanding fact late', 'clean friendly understanding fact late weather', 'clean friendly understanding fact late weather suck', 'friendly', 'friendly understanding', 'friendly understanding fact', 'friendly understanding fact late', 'friendly understanding fact late weather', 'friendly understanding fact late weather suck', 'understanding', 'understanding fact', 'understanding fact late', 'understanding fact late weather', 'understanding fact late weather suck', 'fact', 'fact late', 'fact late weather', 'fact late weather suck', 'late', 'late weather', 'late weather suck', 'weather', 'weather suck', 'suck']",1,0,0,0.5
92157,Having the surgery center right in his office was great not having to go to a big hospital or clinic made the procedure very convenient,0,have surgery center right office great have big hospital clinic procedure convenient,"['have', 'have surgery', 'have surgery center', 'have surgery center right', 'have surgery center right office', 'have surgery center right office great', 'have surgery center right office great have', 'have surgery center right office great have big', 'have surgery center right office great have big hospital', 'have surgery center right office great have big hospital clinic', 'have surgery center right office great have big hospital clinic procedure', 'have surgery center right office great have big hospital clinic procedure convenient', 'surgery', 'surgery center', 'surgery center right', 'surgery center right office', 'surgery center right office great', 'surgery center right office great have', 'surgery center right office great have big', 'surgery center right office great have big hospital', 'surgery center right office great have big hospital clinic', 'surgery center right office great have big hospital clinic procedure', 'surgery center right office great have big hospital clinic procedure convenient', 'center', 'center right', 'center right office', 'center right office great', 'center right office great have', 'center right office great have big', 'center right office great have big hospital', 'center right office great have big hospital clinic', 'center right office great have big hospital clinic procedure', 'center right office great have big hospital clinic procedure convenient', 'right', 'right office', 'right office great', 'right office great have', 'right office great have big', 'right office great have big hospital', 'right office great have big hospital clinic', 'right office great have big hospital clinic procedure', 'right office great have big hospital clinic procedure convenient', 'office', 'office great', 'office great have', 'office great have big', 'office great have big hospital', 'office great have big hospital clinic', 'office great have big hospital clinic procedure', 'office great have big hospital clinic procedure convenient', 'great', 'great have', 'great have big', 'great have big hospital', 'great have big hospital clinic', 'great have big hospital clinic procedure', 'great have big hospital clinic procedure convenient', 'have', 'have big', 'have big hospital', 'have big hospital clinic', 'have big hospital clinic procedure', 'have big hospital clinic procedure convenient', 'big', 'big hospital', 'big hospital clinic', 'big hospital clinic procedure', 'big hospital clinic procedure convenient', 'hospital', 'hospital clinic', 'hospital clinic procedure', 'hospital clinic procedure convenient', 'clinic', 'clinic procedure', 'clinic procedure convenient', 'procedure', 'procedure convenient', 'convenient']",1,0,0,0.5
153612,"and he is very cold and defensive when you approach him in a ""how do we fix this?""",1,cold defensive approach fix,"['cold', 'cold defensive', 'cold defensive approach', 'cold defensive approach fix', 'defensive', 'defensive approach', 'defensive approach fix', 'approach', 'approach fix', 'fix']",0,1,0,0.5
173455,"and you live on the Peninsula or even in the city, I highly recommend that you visit the Allergy and Asthma Clinic.",0,live peninsula city highly recommend visit clergy asthma clinic,"['live', 'live peninsula', 'live peninsula city', 'live peninsula city highly', 'live peninsula city highly recommend', 'live peninsula city highly recommend visit', 'live peninsula city highly recommend visit clergy', 'live peninsula city highly recommend visit clergy asthma', 'live peninsula city highly recommend visit clergy asthma clinic', 'peninsula', 'peninsula city', 'peninsula city highly', 'peninsula city highly recommend', 'peninsula city highly recommend visit', 'peninsula city highly recommend visit clergy', 'peninsula city highly recommend visit clergy asthma', 'peninsula city highly recommend visit clergy asthma clinic', 'city', 'city highly', 'city highly recommend', 'city highly recommend visit', 'city highly recommend visit clergy', 'city highly recommend visit clergy asthma', 'city highly recommend visit clergy asthma clinic', 'highly', 'highly recommend', 'highly recommend visit', 'highly recommend visit clergy', 'highly recommend visit clergy asthma', 'highly recommend visit clergy asthma clinic', 'recommend', 'recommend visit', 'recommend visit clergy', 'recommend visit clergy asthma', 'recommend visit clergy asthma clinic', 'visit', 'visit clergy', 'visit clergy asthma', 'visit clergy asthma clinic', 'clergy', 'clergy asthma', 'clergy asthma clinic', 'asthma', 'asthma clinic', 'clinic']",1,0,0,0.5
172754,Clinic could do a better job just updating patients waiting if there will be a delay beyond 15-20 minutes .,1,clinic good job date patient wait delay minute,"['clinic', 'clinic good', 'clinic good job', 'clinic good job date', 'clinic good job date patient', 'clinic good job date patient wait', 'clinic good job date patient wait delay', 'clinic good job date patient wait delay minute', 'good', 'good job', 'good job date', 'good job date patient', 'good job date patient wait', 'good job date patient wait delay', 'good job date patient wait delay minute', 'job', 'job date', 'job date patient', 'job date patient wait', 'job date patient wait delay', 'job date patient wait delay minute', 'date', 'date patient', 'date patient wait', 'date patient wait delay', 'date patient wait delay minute', 'patient', 'patient wait', 'patient wait delay', 'patient wait delay minute', 'wait', 'wait delay', 'wait delay minute', 'delay', 'delay minute', 'minute']",1,0,0,0.5
91220,However I have not found a clinic on par with this so it's been worth the time and expense,0,find clinic par worth time expense,"['find', 'find clinic', 'find clinic par', 'find clinic par worth', 'find clinic par worth time', 'find clinic par worth time expense', 'clinic', 'clinic par', 'clinic par worth', 'clinic par worth time', 'clinic par worth time expense', 'par', 'par worth', 'par worth time', 'par worth time expense', 'worth', 'worth time', 'worth time expense', 'time', 'time expense', 'expense']",1,0,0,0.5
160552,because we were waiting on the clinic to provide us with the documentation that needed signatures in order to proceed.,1,wait clinic provide documentation need signature order proceed,"['wait', 'wait clinic', 'wait clinic provide', 'wait clinic provide documentation', 'wait clinic provide documentation need', 'wait clinic provide documentation need signature', 'wait clinic provide documentation need signature order', 'wait clinic provide documentation need signature order proceed', 'clinic', 'clinic provide', 'clinic provide documentation', 'clinic provide documentation need', 'clinic provide documentation need signature', 'clinic provide documentation need signature order', 'clinic provide documentation need signature order proceed', 'provide', 'provide documentation', 'provide documentation need', 'provide documentation need signature', 'provide documentation need signature order', 'provide documentation need signature order proceed', 'documentation', 'documentation need', 'documentation need signature', 'documentation need signature order', 'documentation need signature order proceed', 'need', 'need signature', 'need signature order', 'need signature order proceed', 'signature', 'signature order', 'signature order proceed', 'order', 'order proceed', 'proceed']",1,0,0,0.5
160230,"Don't trust these roadside ""clinics"" PLEASE invest in your skin and the doctor you choose.",1,trust wayside clinic invest skin doctor choose,"['trust', 'trust wayside', 'trust wayside clinic', 'trust wayside clinic invest', 'trust wayside clinic invest skin', 'trust wayside clinic invest skin doctor', 'trust wayside clinic invest skin doctor choose', 'wayside', 'wayside clinic', 'wayside clinic invest', 'wayside clinic invest skin', 'wayside clinic invest skin doctor', 'wayside clinic invest skin doctor choose', 'clinic', 'clinic invest', 'clinic invest skin', 'clinic invest skin doctor', 'clinic invest skin doctor choose', 'invest', 'invest skin', 'invest skin doctor', 'invest skin doctor choose', 'skin', 'skin doctor', 'skin doctor choose', 'doctor', 'doctor choose', 'choose']",1,0,0,0.5
110241,I walked in and out of his clinic in about an hour then went to work the next day.,0,walk clinic go work,"['walk', 'walk clinic', 'walk clinic go', 'walk clinic go work', 'clinic', 'clinic go', 'clinic go work', 'go', 'go work', 'work']",1,0,0,0.5
171533,I'll absolutely keep going to this clinic for my cosmetic treatments.,0,ill absolutely go clinic cosmetic treatment,"['ill', 'ill absolutely', 'ill absolutely go', 'ill absolutely go clinic', 'ill absolutely go clinic cosmetic', 'ill absolutely go clinic cosmetic treatment', 'absolutely', 'absolutely go', 'absolutely go clinic', 'absolutely go clinic cosmetic', 'absolutely go clinic cosmetic treatment', 'go', 'go clinic', 'go clinic cosmetic', 'go clinic cosmetic treatment', 'clinic', 'clinic cosmetic', 'clinic cosmetic treatment', 'cosmetic', 'cosmetic treatment', 'treatment']",1,0,0,0.5
133222,voice mail Or transferred 5 times  How is this place even open such an injustice I was vulnerable and Wish I had never come To this clinic,1,voice mail transfer time place open injustice vulnerable wish come clinic,"['voice', 'voice mail', 'voice mail transfer', 'voice mail transfer time', 'voice mail transfer time place', 'voice mail transfer time place open', 'voice mail transfer time place open injustice', 'voice mail transfer time place open injustice vulnerable', 'voice mail transfer time place open injustice vulnerable wish', 'voice mail transfer time place open injustice vulnerable wish come', 'voice mail transfer time place open injustice vulnerable wish come clinic', 'mail', 'mail transfer', 'mail transfer time', 'mail transfer time place', 'mail transfer time place open', 'mail transfer time place open injustice', 'mail transfer time place open injustice vulnerable', 'mail transfer time place open injustice vulnerable wish', 'mail transfer time place open injustice vulnerable wish come', 'mail transfer time place open injustice vulnerable wish come clinic', 'transfer', 'transfer time', 'transfer time place', 'transfer time place open', 'transfer time place open injustice', 'transfer time place open injustice vulnerable', 'transfer time place open injustice vulnerable wish', 'transfer time place open injustice vulnerable wish come', 'transfer time place open injustice vulnerable wish come clinic', 'time', 'time place', 'time place open', 'time place open injustice', 'time place open injustice vulnerable', 'time place open injustice vulnerable wish', 'time place open injustice vulnerable wish come', 'time place open injustice vulnerable wish come clinic', 'place', 'place open', 'place open injustice', 'place open injustice vulnerable', 'place open injustice vulnerable wish', 'place open injustice vulnerable wish come', 'place open injustice vulnerable wish come clinic', 'open', 'open injustice', 'open injustice vulnerable', 'open injustice vulnerable wish', 'open injustice vulnerable wish come', 'open injustice vulnerable wish come clinic', 'injustice', 'injustice vulnerable', 'injustice vulnerable wish', 'injustice vulnerable wish come', 'injustice vulnerable wish come clinic', 'vulnerable', 'vulnerable wish', 'vulnerable wish come', 'vulnerable wish come clinic', 'wish', 'wish come', 'wish come clinic', 'come', 'come clinic', 'clinic']",1,0,0,0.5
144104,yet - this clinic was not willing to provide a service and than charge.,1,clinic willing provide service charge,"['clinic', 'clinic willing', 'clinic willing provide', 'clinic willing provide service', 'clinic willing provide service charge', 'willing', 'willing provide', 'willing provide service', 'willing provide service charge', 'provide', 'provide service', 'provide service charge', 'service', 'service charge', 'charge']",1,0,0,0.5
181568,Entering I also notice the lack of care the clinic has on sanitation in the lobby..,1,enter notice lack care clinic sanitation lobby,"['enter', 'enter notice', 'enter notice lack', 'enter notice lack care', 'enter notice lack care clinic', 'enter notice lack care clinic sanitation', 'enter notice lack care clinic sanitation lobby', 'notice', 'notice lack', 'notice lack care', 'notice lack care clinic', 'notice lack care clinic sanitation', 'notice lack care clinic sanitation lobby', 'lack', 'lack care', 'lack care clinic', 'lack care clinic sanitation', 'lack care clinic sanitation lobby', 'care', 'care clinic', 'care clinic sanitation', 'care clinic sanitation lobby', 'clinic', 'clinic sanitation', 'clinic sanitation lobby', 'sanitation', 'sanitation lobby', 'lobby']",1,0,0,0.5
179954,"and get out with disfiguration Save your self from this clinic and runaway before it is too late, if you",1,disfigurement save self clinic runaway late,"['disfigurement', 'disfigurement save', 'disfigurement save self', 'disfigurement save self clinic', 'disfigurement save self clinic runaway', 'disfigurement save self clinic runaway late', 'save', 'save self', 'save self clinic', 'save self clinic runaway', 'save self clinic runaway late', 'self', 'self clinic', 'self clinic runaway', 'self clinic runaway late', 'clinic', 'clinic runaway', 'clinic runaway late', 'runaway', 'runaway late', 'late']",1,0,0,0.5
145516,and a broken back ended up in Campbell clinic two years later never got a diagnosis from him If he,1,break end campbell clinic get diagnosis,"['break', 'break end', 'break end campbell', 'break end campbell clinic', 'break end campbell clinic get', 'break end campbell clinic get diagnosis', 'end', 'end campbell', 'end campbell clinic', 'end campbell clinic get', 'end campbell clinic get diagnosis', 'campbell', 'campbell clinic', 'campbell clinic get', 'campbell clinic get diagnosis', 'clinic', 'clinic get', 'clinic get diagnosis', 'get', 'get diagnosis', 'diagnosis']",1,0,0,0.5
150981,clinic started out good and i got very good care from dr rob who would follow up closely after my visits,0,clinic start good get good care dr rob follow closely visit,"['clinic', 'clinic start', 'clinic start good', 'clinic start good get', 'clinic start good get good', 'clinic start good get good care', 'clinic start good get good care dr', 'clinic start good get good care dr rob', 'clinic start good get good care dr rob follow', 'clinic start good get good care dr rob follow closely', 'clinic start good get good care dr rob follow closely visit', 'start', 'start good', 'start good get', 'start good get good', 'start good get good care', 'start good get good care dr', 'start good get good care dr rob', 'start good get good care dr rob follow', 'start good get good care dr rob follow closely', 'start good get good care dr rob follow closely visit', 'good', 'good get', 'good get good', 'good get good care', 'good get good care dr', 'good get good care dr rob', 'good get good care dr rob follow', 'good get good care dr rob follow closely', 'good get good care dr rob follow closely visit', 'get', 'get good', 'get good care', 'get good care dr', 'get good care dr rob', 'get good care dr rob follow', 'get good care dr rob follow closely', 'get good care dr rob follow closely visit', 'good', 'good care', 'good care dr', 'good care dr rob', 'good care dr rob follow', 'good care dr rob follow closely', 'good care dr rob follow closely visit', 'care', 'care dr', 'care dr rob', 'care dr rob follow', 'care dr rob follow closely', 'care dr rob follow closely visit', 'dr', 'dr rob', 'dr rob follow', 'dr rob follow closely', 'dr rob follow closely visit', 'rob', 'rob follow', 'rob follow closely', 'rob follow closely visit', 'follow', 'follow closely', 'follow closely visit', 'closely', 'closely visit', 'visit']",1,0,0,0.5
151744,The irony is truly that he wasn't even able to attend treatment to this clinic.,1,irony truly able attend treatment clinic,"['irony', 'irony truly', 'irony truly able', 'irony truly able attend', 'irony truly able attend treatment', 'irony truly able attend treatment clinic', 'truly', 'truly able', 'truly able attend', 'truly able attend treatment', 'truly able attend treatment clinic', 'able', 'able attend', 'able attend treatment', 'able attend treatment clinic', 'attend', 'attend treatment', 'attend treatment clinic', 'treatment', 'treatment clinic', 'clinic']",1,0,0,0.5
122449,It?s been by far the best clinic for helping out.,0,far good clinic help,"['far', 'far good', 'far good clinic', 'far good clinic help', 'good', 'good clinic', 'good clinic help', 'clinic', 'clinic help', 'help']",1,0,0,0.5
146146,She stayed with me all night and kept a cold compress on my face each hour.,0,stay keep cold compress face,"['stay', 'stay keep', 'stay keep cold', 'stay keep cold compress', 'stay keep cold compress face', 'keep', 'keep cold', 'keep cold compress', 'keep cold compress face', 'cold', 'cold compress', 'cold compress face', 'compress', 'compress face', 'face']",0,1,0,0.5
69188,The clinic location is easy to get to.,0,clinic location easy,"['clinic', 'clinic location', 'clinic location easy', 'location', 'location easy', 'easy']",1,0,0,0.5
