commentId,comment,classification,comment_processed,word_phrase_list,clinic,cold,invite,similarity_score
59670,He invited a group of residents in to watch and he did it while they were right there and I would have felt uncomfortable in the way he did this.,1,invite group resident watch right feel uncomfortable way,"['invite', 'invite group', 'invite group resident', 'invite group resident watch', 'invite group resident watch right', 'invite group resident watch right feel', 'invite group resident watch right feel uncomfortable', 'invite group resident watch right feel uncomfortable way', 'group', 'group resident', 'group resident watch', 'group resident watch right', 'group resident watch right feel', 'group resident watch right feel uncomfortable', 'group resident watch right feel uncomfortable way', 'resident', 'resident watch', 'resident watch right', 'resident watch right feel', 'resident watch right feel uncomfortable', 'resident watch right feel uncomfortable way', 'watch', 'watch right', 'watch right feel', 'watch right feel uncomfortable', 'watch right feel uncomfortable way', 'right', 'right feel', 'right feel uncomfortable', 'right feel uncomfortable way', 'feel', 'feel uncomfortable', 'feel uncomfortable way', 'uncomfortable', 'uncomfortable way', 'way']",0,0,1,0.5
123241,when I actually drove 10 miles to the clinic and had to wait till next week for the procedure.,1,actually drive mile clinic wait till procedure,"['actually', 'actually drive', 'actually drive mile', 'actually drive mile clinic', 'actually drive mile clinic wait', 'actually drive mile clinic wait till', 'actually drive mile clinic wait till procedure', 'drive', 'drive mile', 'drive mile clinic', 'drive mile clinic wait', 'drive mile clinic wait till', 'drive mile clinic wait till procedure', 'mile', 'mile clinic', 'mile clinic wait', 'mile clinic wait till', 'mile clinic wait till procedure', 'clinic', 'clinic wait', 'clinic wait till', 'clinic wait till procedure', 'wait', 'wait till', 'wait till procedure', 'till', 'till procedure', 'procedure']",1,0,0,0.5
179805,The Aspire Clinic has been a Godsend for us during our IVF journey.,0,steeple clinic godson journey,"['steeple', 'steeple clinic', 'steeple clinic godson', 'steeple clinic godson journey', 'clinic', 'clinic godson', 'clinic godson journey', 'godson', 'godson journey', 'journey']",1,0,0,0.5
115320,"which my own neurologist at their clinic agrees with, the big wig owner takes offense to.",1,neurologist clinic agree big wig owner take offense,"['neurologist', 'neurologist clinic', 'neurologist clinic agree', 'neurologist clinic agree big', 'neurologist clinic agree big wig', 'neurologist clinic agree big wig owner', 'neurologist clinic agree big wig owner take', 'neurologist clinic agree big wig owner take offense', 'clinic', 'clinic agree', 'clinic agree big', 'clinic agree big wig', 'clinic agree big wig owner', 'clinic agree big wig owner take', 'clinic agree big wig owner take offense', 'agree', 'agree big', 'agree big wig', 'agree big wig owner', 'agree big wig owner take', 'agree big wig owner take offense', 'big', 'big wig', 'big wig owner', 'big wig owner take', 'big wig owner take offense', 'wig', 'wig owner', 'wig owner take', 'wig owner take offense', 'owner', 'owner take', 'owner take offense', 'take', 'take offense', 'offense']",1,0,0,0.5
166140,but I was so devastated a year ago when I was looking for a new clinic.,1,devastate look new clinic,"['devastate', 'devastate look', 'devastate look new', 'devastate look new clinic', 'look', 'look new', 'look new clinic', 'new', 'new clinic', 'clinic']",1,0,0,0.5
157935,"The nurse said no (!). That they were not allowed, by clinic policy, to render any physical help to their patients.",1,nurse say allow clinic policy render physical help patient,"['nurse', 'nurse say', 'nurse say allow', 'nurse say allow clinic', 'nurse say allow clinic policy', 'nurse say allow clinic policy render', 'nurse say allow clinic policy render physical', 'nurse say allow clinic policy render physical help', 'nurse say allow clinic policy render physical help patient', 'say', 'say allow', 'say allow clinic', 'say allow clinic policy', 'say allow clinic policy render', 'say allow clinic policy render physical', 'say allow clinic policy render physical help', 'say allow clinic policy render physical help patient', 'allow', 'allow clinic', 'allow clinic policy', 'allow clinic policy render', 'allow clinic policy render physical', 'allow clinic policy render physical help', 'allow clinic policy render physical help patient', 'clinic', 'clinic policy', 'clinic policy render', 'clinic policy render physical', 'clinic policy render physical help', 'clinic policy render physical help patient', 'policy', 'policy render', 'policy render physical', 'policy render physical help', 'policy render physical help patient', 'render', 'render physical', 'render physical help', 'render physical help patient', 'physical', 'physical help', 'physical help patient', 'help', 'help patient', 'patient']",1,0,0,0.5
151483,but we will be going to a different clinic if we need services again in the future.,1,go different clinic need service future,"['go', 'go different', 'go different clinic', 'go different clinic need', 'go different clinic need service', 'go different clinic need service future', 'different', 'different clinic', 'different clinic need', 'different clinic need service', 'different clinic need service future', 'clinic', 'clinic need', 'clinic need service', 'clinic need service future', 'need', 'need service', 'need service future', 'service', 'service future', 'future']",1,0,0,0.5
126240,She has cold hands but a very warm heart.,0,cold hand warm heart,"['cold', 'cold hand', 'cold hand warm', 'cold hand warm heart', 'hand', 'hand warm', 'hand warm heart', 'warm', 'warm heart', 'heart']",0,1,0,0.5
142050,Portland Pain and Spine is in my opinion the BEST PAIN CLINIC in the Pacific Northwest period!I have had i,0,poland pain spine opinion good pain clinic northwest period,"['poland', 'poland pain', 'poland pain spine', 'poland pain spine opinion', 'poland pain spine opinion good', 'poland pain spine opinion good pain', 'poland pain spine opinion good pain clinic', 'poland pain spine opinion good pain clinic northwest', 'poland pain spine opinion good pain clinic northwest period', 'pain', 'pain spine', 'pain spine opinion', 'pain spine opinion good', 'pain spine opinion good pain', 'pain spine opinion good pain clinic', 'pain spine opinion good pain clinic northwest', 'pain spine opinion good pain clinic northwest period', 'spine', 'spine opinion', 'spine opinion good', 'spine opinion good pain', 'spine opinion good pain clinic', 'spine opinion good pain clinic northwest', 'spine opinion good pain clinic northwest period', 'opinion', 'opinion good', 'opinion good pain', 'opinion good pain clinic', 'opinion good pain clinic northwest', 'opinion good pain clinic northwest period', 'good', 'good pain', 'good pain clinic', 'good pain clinic northwest', 'good pain clinic northwest period', 'pain', 'pain clinic', 'pain clinic northwest', 'pain clinic northwest period', 'clinic', 'clinic northwest', 'clinic northwest period', 'northwest', 'northwest period', 'period']",1,0,0,0.5
112690,"Even though I have to drive over an hour to his clinic, it is worth it .",0,drive clinic worth,"['drive', 'drive clinic', 'drive clinic worth', 'clinic', 'clinic worth', 'worth']",1,0,0,0.5
148069,I have been using the clinic for plastic surgery since 2012,0,clinic plastic surgery,"['clinic', 'clinic plastic', 'clinic plastic surgery', 'plastic', 'plastic surgery', 'surgery']",1,0,0,0.5
170351,Having been to a few other clinics with positive experiences I can honestly say I have never been treated this badly in a clinic,1,have clinic positive experience honestly treat badly clinic,"['have', 'have clinic', 'have clinic positive', 'have clinic positive experience', 'have clinic positive experience honestly', 'have clinic positive experience honestly treat', 'have clinic positive experience honestly treat badly', 'have clinic positive experience honestly treat badly clinic', 'clinic', 'clinic positive', 'clinic positive experience', 'clinic positive experience honestly', 'clinic positive experience honestly treat', 'clinic positive experience honestly treat badly', 'clinic positive experience honestly treat badly clinic', 'positive', 'positive experience', 'positive experience honestly', 'positive experience honestly treat', 'positive experience honestly treat badly', 'positive experience honestly treat badly clinic', 'experience', 'experience honestly', 'experience honestly treat', 'experience honestly treat badly', 'experience honestly treat badly clinic', 'honestly', 'honestly treat', 'honestly treat badly', 'honestly treat badly clinic', 'treat', 'treat badly', 'treat badly clinic', 'badly', 'badly clinic', 'clinic']",1,0,0,0.5
69536,Very inviting place.,0,invite place,"['invite', 'invite place', 'place']",0,0,1,0.5
123004,Clarity Clinic is a great practice for all of your psych needs!,0,clarity clinic great practice need,"['clarity', 'clarity clinic', 'clarity clinic great', 'clarity clinic great practice', 'clarity clinic great practice need', 'clinic', 'clinic great', 'clinic great practice', 'clinic great practice need', 'great', 'great practice', 'great practice need', 'practice', 'practice need', 'need']",1,0,0,0.5
161821,Absolute worst walk in clinic - so unprofessional- prescribed Rx with ingredient I told PA I was allergic to - horrible patient care -,1,absolute bad walk clinic professional prescribed ingredient tell pa allergic atrocious patient care,"['absolute', 'absolute bad', 'absolute bad walk', 'absolute bad walk clinic', 'absolute bad walk clinic professional', 'absolute bad walk clinic professional prescribed', 'absolute bad walk clinic professional prescribed ingredient', 'absolute bad walk clinic professional prescribed ingredient tell', 'absolute bad walk clinic professional prescribed ingredient tell pa', 'absolute bad walk clinic professional prescribed ingredient tell pa allergic', 'absolute bad walk clinic professional prescribed ingredient tell pa allergic atrocious', 'absolute bad walk clinic professional prescribed ingredient tell pa allergic atrocious patient', 'absolute bad walk clinic professional prescribed ingredient tell pa allergic atrocious patient care', 'bad', 'bad walk', 'bad walk clinic', 'bad walk clinic professional', 'bad walk clinic professional prescribed', 'bad walk clinic professional prescribed ingredient', 'bad walk clinic professional prescribed ingredient tell', 'bad walk clinic professional prescribed ingredient tell pa', 'bad walk clinic professional prescribed ingredient tell pa allergic', 'bad walk clinic professional prescribed ingredient tell pa allergic atrocious', 'bad walk clinic professional prescribed ingredient tell pa allergic atrocious patient', 'bad walk clinic professional prescribed ingredient tell pa allergic atrocious patient care', 'walk', 'walk clinic', 'walk clinic professional', 'walk clinic professional prescribed', 'walk clinic professional prescribed ingredient', 'walk clinic professional prescribed ingredient tell', 'walk clinic professional prescribed ingredient tell pa', 'walk clinic professional prescribed ingredient tell pa allergic', 'walk clinic professional prescribed ingredient tell pa allergic atrocious', 'walk clinic professional prescribed ingredient tell pa allergic atrocious patient', 'walk clinic professional prescribed ingredient tell pa allergic atrocious patient care', 'clinic', 'clinic professional', 'clinic professional prescribed', 'clinic professional prescribed ingredient', 'clinic professional prescribed ingredient tell', 'clinic professional prescribed ingredient tell pa', 'clinic professional prescribed ingredient tell pa allergic', 'clinic professional prescribed ingredient tell pa allergic atrocious', 'clinic professional prescribed ingredient tell pa allergic atrocious patient', 'clinic professional prescribed ingredient tell pa allergic atrocious patient care', 'professional', 'professional prescribed', 'professional prescribed ingredient', 'professional prescribed ingredient tell', 'professional prescribed ingredient tell pa', 'professional prescribed ingredient tell pa allergic', 'professional prescribed ingredient tell pa allergic atrocious', 'professional prescribed ingredient tell pa allergic atrocious patient', 'professional prescribed ingredient tell pa allergic atrocious patient care', 'prescribed', 'prescribed ingredient', 'prescribed ingredient tell', 'prescribed ingredient tell pa', 'prescribed ingredient tell pa allergic', 'prescribed ingredient tell pa allergic atrocious', 'prescribed ingredient tell pa allergic atrocious patient', 'prescribed ingredient tell pa allergic atrocious patient care', 'ingredient', 'ingredient tell', 'ingredient tell pa', 'ingredient tell pa allergic', 'ingredient tell pa allergic atrocious', 'ingredient tell pa allergic atrocious patient', 'ingredient tell pa allergic atrocious patient care', 'tell', 'tell pa', 'tell pa allergic', 'tell pa allergic atrocious', 'tell pa allergic atrocious patient', 'tell pa allergic atrocious patient care', 'pa', 'pa allergic', 'pa allergic atrocious', 'pa allergic atrocious patient', 'pa allergic atrocious patient care', 'allergic', 'allergic atrocious', 'allergic atrocious patient', 'allergic atrocious patient care', 'atrocious', 'atrocious patient', 'atrocious patient care', 'patient', 'patient care', 'care']",1,0,0,0.5
114646,The office is inviting and the service is great.,0,office invite service great,"['office', 'office invite', 'office invite service', 'office invite service great', 'invite', 'invite service', 'invite service great', 'service', 'service great', 'great']",0,0,1,0.5
115315,which is pretty awful for a fertility clinic dealing with people who are going through an already emotional experience.,1,pretty awful fertility clinic deal people go emotional experience,"['pretty', 'pretty awful', 'pretty awful fertility', 'pretty awful fertility clinic', 'pretty awful fertility clinic deal', 'pretty awful fertility clinic deal people', 'pretty awful fertility clinic deal people go', 'pretty awful fertility clinic deal people go emotional', 'pretty awful fertility clinic deal people go emotional experience', 'awful', 'awful fertility', 'awful fertility clinic', 'awful fertility clinic deal', 'awful fertility clinic deal people', 'awful fertility clinic deal people go', 'awful fertility clinic deal people go emotional', 'awful fertility clinic deal people go emotional experience', 'fertility', 'fertility clinic', 'fertility clinic deal', 'fertility clinic deal people', 'fertility clinic deal people go', 'fertility clinic deal people go emotional', 'fertility clinic deal people go emotional experience', 'clinic', 'clinic deal', 'clinic deal people', 'clinic deal people go', 'clinic deal people go emotional', 'clinic deal people go emotional experience', 'deal', 'deal people', 'deal people go', 'deal people go emotional', 'deal people go emotional experience', 'people', 'people go', 'people go emotional', 'people go emotional experience', 'go', 'go emotional', 'go emotional experience', 'emotional', 'emotional experience', 'experience']",1,0,0,0.5
121604,Clarity Clinic helps me. ?I've learned new coping skills. ?I feel connected and heard. ?I go for both Rx treatment,0,clarity clinic help ve learn new come skill feel connect hear treatment,"['clarity', 'clarity clinic', 'clarity clinic help', 'clarity clinic help ve', 'clarity clinic help ve learn', 'clarity clinic help ve learn new', 'clarity clinic help ve learn new come', 'clarity clinic help ve learn new come skill', 'clarity clinic help ve learn new come skill feel', 'clarity clinic help ve learn new come skill feel connect', 'clarity clinic help ve learn new come skill feel connect hear', 'clarity clinic help ve learn new come skill feel connect hear treatment', 'clinic', 'clinic help', 'clinic help ve', 'clinic help ve learn', 'clinic help ve learn new', 'clinic help ve learn new come', 'clinic help ve learn new come skill', 'clinic help ve learn new come skill feel', 'clinic help ve learn new come skill feel connect', 'clinic help ve learn new come skill feel connect hear', 'clinic help ve learn new come skill feel connect hear treatment', 'help', 'help ve', 'help ve learn', 'help ve learn new', 'help ve learn new come', 'help ve learn new come skill', 'help ve learn new come skill feel', 'help ve learn new come skill feel connect', 'help ve learn new come skill feel connect hear', 'help ve learn new come skill feel connect hear treatment', 've', 've learn', 've learn new', 've learn new come', 've learn new come skill', 've learn new come skill feel', 've learn new come skill feel connect', 've learn new come skill feel connect hear', 've learn new come skill feel connect hear treatment', 'learn', 'learn new', 'learn new come', 'learn new come skill', 'learn new come skill feel', 'learn new come skill feel connect', 'learn new come skill feel connect hear', 'learn new come skill feel connect hear treatment', 'new', 'new come', 'new come skill', 'new come skill feel', 'new come skill feel connect', 'new come skill feel connect hear', 'new come skill feel connect hear treatment', 'come', 'come skill', 'come skill feel', 'come skill feel connect', 'come skill feel connect hear', 'come skill feel connect hear treatment', 'skill', 'skill feel', 'skill feel connect', 'skill feel connect hear', 'skill feel connect hear treatment', 'feel', 'feel connect', 'feel connect hear', 'feel connect hear treatment', 'connect', 'connect hear', 'connect hear treatment', 'hear', 'hear treatment', 'treatment']",1,0,0,0.5
189022,"I'm very satisfied with the treatment .would highly recommend.""excellent clinic-",0,m satisfy treatment highly recommendexcellent clinic,"['m', 'm satisfy', 'm satisfy treatment', 'm satisfy treatment highly', 'm satisfy treatment highly recommendexcellent', 'm satisfy treatment highly recommendexcellent clinic', 'satisfy', 'satisfy treatment', 'satisfy treatment highly', 'satisfy treatment highly recommendexcellent', 'satisfy treatment highly recommendexcellent clinic', 'treatment', 'treatment highly', 'treatment highly recommendexcellent', 'treatment highly recommendexcellent clinic', 'highly', 'highly recommendexcellent', 'highly recommendexcellent clinic', 'recommendexcellent', 'recommendexcellent clinic', 'clinic']",1,0,0,0.5
178318,I get it every single time I feel like a cold coming on and it makes a huge difference.,0,single time feel like cold come make huge difference,"['single', 'single time', 'single time feel', 'single time feel like', 'single time feel like cold', 'single time feel like cold come', 'single time feel like cold come make', 'single time feel like cold come make huge', 'single time feel like cold come make huge difference', 'time', 'time feel', 'time feel like', 'time feel like cold', 'time feel like cold come', 'time feel like cold come make', 'time feel like cold come make huge', 'time feel like cold come make huge difference', 'feel', 'feel like', 'feel like cold', 'feel like cold come', 'feel like cold come make', 'feel like cold come make huge', 'feel like cold come make huge difference', 'like', 'like cold', 'like cold come', 'like cold come make', 'like cold come make huge', 'like cold come make huge difference', 'cold', 'cold come', 'cold come make', 'cold come make huge', 'cold come make huge difference', 'come', 'come make', 'come make huge', 'come make huge difference', 'make', 'make huge', 'make huge difference', 'huge', 'huge difference', 'difference']",0,1,0,0.5
137328,"This was our third clinic and we knew we found our home as soon as we had our consult.Also, Jenna is exceptional",0,clinic know find home soon consultalso exceptional,"['clinic', 'clinic know', 'clinic know find', 'clinic know find home', 'clinic know find home soon', 'clinic know find home soon consultalso', 'clinic know find home soon consultalso exceptional', 'know', 'know find', 'know find home', 'know find home soon', 'know find home soon consultalso', 'know find home soon consultalso exceptional', 'find', 'find home', 'find home soon', 'find home soon consultalso', 'find home soon consultalso exceptional', 'home', 'home soon', 'home soon consultalso', 'home soon consultalso exceptional', 'soon', 'soon consultalso', 'soon consultalso exceptional', 'consultalso', 'consultalso exceptional', 'exceptional']",1,0,0,0.5
105571,I will not be receiving any further treatment or advice with this clinic as a result of my experience with Dr. Heiner.,1,receive treatment advice clinic result experience dr hinder,"['receive', 'receive treatment', 'receive treatment advice', 'receive treatment advice clinic', 'receive treatment advice clinic result', 'receive treatment advice clinic result experience', 'receive treatment advice clinic result experience dr', 'receive treatment advice clinic result experience dr hinder', 'treatment', 'treatment advice', 'treatment advice clinic', 'treatment advice clinic result', 'treatment advice clinic result experience', 'treatment advice clinic result experience dr', 'treatment advice clinic result experience dr hinder', 'advice', 'advice clinic', 'advice clinic result', 'advice clinic result experience', 'advice clinic result experience dr', 'advice clinic result experience dr hinder', 'clinic', 'clinic result', 'clinic result experience', 'clinic result experience dr', 'clinic result experience dr hinder', 'result', 'result experience', 'result experience dr', 'result experience dr hinder', 'experience', 'experience dr', 'experience dr hinder', 'dr', 'dr hinder', 'hinder']",1,0,0,0.5
103407,I can't recall any sadder situation in a medical clinic than the one I had at Prasad's.,1,recall sad situation medical clinic prasads,"['recall', 'recall sad', 'recall sad situation', 'recall sad situation medical', 'recall sad situation medical clinic', 'recall sad situation medical clinic prasads', 'sad', 'sad situation', 'sad situation medical', 'sad situation medical clinic', 'sad situation medical clinic prasads', 'situation', 'situation medical', 'situation medical clinic', 'situation medical clinic prasads', 'medical', 'medical clinic', 'medical clinic prasads', 'clinic', 'clinic prasads', 'prasads']",1,0,0,0.5
189561,but as a whole human in this clinic!,0,human clinic,"['human', 'human clinic', 'clinic']",1,0,0,0.5
71189,"I have been a patient here at the Southern Humboldt Community Clinic, in Garberville now for 20 years.",0,patient southern humboldt community clinic garberville,"['patient', 'patient southern', 'patient southern humboldt', 'patient southern humboldt community', 'patient southern humboldt community clinic', 'patient southern humboldt community clinic garberville', 'southern', 'southern humboldt', 'southern humboldt community', 'southern humboldt community clinic', 'southern humboldt community clinic garberville', 'humboldt', 'humboldt community', 'humboldt community clinic', 'humboldt community clinic garberville', 'community', 'community clinic', 'community clinic garberville', 'clinic', 'clinic garberville', 'garberville']",1,0,0,0.5
133941,I will keep going to this clinic.,0,go clinic,"['go', 'go clinic', 'clinic']",1,0,0,0.5
150098,but to see how you feel after they get their money they don?t care So disappointed of this clinic and their stuff ...,1,feel money care disappoint clinic stuff,"['feel', 'feel money', 'feel money care', 'feel money care disappoint', 'feel money care disappoint clinic', 'feel money care disappoint clinic stuff', 'money', 'money care', 'money care disappoint', 'money care disappoint clinic', 'money care disappoint clinic stuff', 'care', 'care disappoint', 'care disappoint clinic', 'care disappoint clinic stuff', 'disappoint', 'disappoint clinic', 'disappoint clinic stuff', 'clinic', 'clinic stuff', 'stuff']",1,0,0,0.5
