commentId,comment,classification,comment_processed,word_phrase_list,clinic,cold,invite,similarity_score
141172,Very pleased with my association with this clinic and Dr. Bonatz.,0,please association clinic dr donate,"['please', 'please association', 'please association clinic', 'please association clinic dr', 'please association clinic dr donate', 'association', 'association clinic', 'association clinic dr', 'association clinic dr donate', 'clinic', 'clinic dr', 'clinic dr donate', 'dr', 'dr donate', 'donate']",1,0,0,0.5
111653,This was our 3rd delivery and like every time we feel home in the clinic / hospital.,0,rd delivery like time feel home clinic hospital,"['rd', 'rd delivery', 'rd delivery like', 'rd delivery like time', 'rd delivery like time feel', 'rd delivery like time feel home', 'rd delivery like time feel home clinic', 'rd delivery like time feel home clinic hospital', 'delivery', 'delivery like', 'delivery like time', 'delivery like time feel', 'delivery like time feel home', 'delivery like time feel home clinic', 'delivery like time feel home clinic hospital', 'like', 'like time', 'like time feel', 'like time feel home', 'like time feel home clinic', 'like time feel home clinic hospital', 'time', 'time feel', 'time feel home', 'time feel home clinic', 'time feel home clinic hospital', 'feel', 'feel home', 'feel home clinic', 'feel home clinic hospital', 'home', 'home clinic', 'home clinic hospital', 'clinic', 'clinic hospital', 'hospital']",1,0,0,0.5
99899,"My daughter and I love coming to see Jessica and her staff, they are always so nice and inviting.",0,daughter love come staff nice invite,"['daughter', 'daughter love', 'daughter love come', 'daughter love come staff', 'daughter love come staff nice', 'daughter love come staff nice invite', 'love', 'love come', 'love come staff', 'love come staff nice', 'love come staff nice invite', 'come', 'come staff', 'come staff nice', 'come staff nice invite', 'staff', 'staff nice', 'staff nice invite', 'nice', 'nice invite', 'invite']",0,0,1,0.5
164906,I highly encourage anyone looking for that boost of self esteem to visit his clinic.,0,highly encourage look boost self esteem visit clinic,"['highly', 'highly encourage', 'highly encourage look', 'highly encourage look boost', 'highly encourage look boost self', 'highly encourage look boost self esteem', 'highly encourage look boost self esteem visit', 'highly encourage look boost self esteem visit clinic', 'encourage', 'encourage look', 'encourage look boost', 'encourage look boost self', 'encourage look boost self esteem', 'encourage look boost self esteem visit', 'encourage look boost self esteem visit clinic', 'look', 'look boost', 'look boost self', 'look boost self esteem', 'look boost self esteem visit', 'look boost self esteem visit clinic', 'boost', 'boost self', 'boost self esteem', 'boost self esteem visit', 'boost self esteem visit clinic', 'self', 'self esteem', 'self esteem visit', 'self esteem visit clinic', 'esteem', 'esteem visit', 'esteem visit clinic', 'visit', 'visit clinic', 'clinic']",1,0,0,0.5
94291,There are plenty of other fertility clinics in Houston,1,plenty fertility clinic,"['plenty', 'plenty fertility', 'plenty fertility clinic', 'fertility', 'fertility clinic', 'clinic']",1,0,0,0.5
131273,He prescribed therapy in their clinic with their hand therapist who is great.,0,prescribed therapy clinic hand therapist great,"['prescribed', 'prescribed therapy', 'prescribed therapy clinic', 'prescribed therapy clinic hand', 'prescribed therapy clinic hand therapist', 'prescribed therapy clinic hand therapist great', 'therapy', 'therapy clinic', 'therapy clinic hand', 'therapy clinic hand therapist', 'therapy clinic hand therapist great', 'clinic', 'clinic hand', 'clinic hand therapist', 'clinic hand therapist great', 'hand', 'hand therapist', 'hand therapist great', 'therapist', 'therapist great', 'great']",1,0,0,0.5
109140,"The wait times are short, the atmosphere is so warm and inviting.",0,wait time short atmosphere warm invite,"['wait', 'wait time', 'wait time short', 'wait time short atmosphere', 'wait time short atmosphere warm', 'wait time short atmosphere warm invite', 'time', 'time short', 'time short atmosphere', 'time short atmosphere warm', 'time short atmosphere warm invite', 'short', 'short atmosphere', 'short atmosphere warm', 'short atmosphere warm invite', 'atmosphere', 'atmosphere warm', 'atmosphere warm invite', 'warm', 'warm invite', 'invite']",0,0,1,0.5
142438,to the friendly staff it's hands down the most inviting office I've been in.,0,friendly staff hand invite office ve,"['friendly', 'friendly staff', 'friendly staff hand', 'friendly staff hand invite', 'friendly staff hand invite office', 'friendly staff hand invite office ve', 'staff', 'staff hand', 'staff hand invite', 'staff hand invite office', 'staff hand invite office ve', 'hand', 'hand invite', 'hand invite office', 'hand invite office ve', 'invite', 'invite office', 'invite office ve', 'office', 'office ve', 've']",0,0,1,0.5
169060,Kept trying to send us to pain clinic.,1,keep try send pain clinic,"['keep', 'keep try', 'keep try send', 'keep try send pain', 'keep try send pain clinic', 'try', 'try send', 'try send pain', 'try send pain clinic', 'send', 'send pain', 'send pain clinic', 'pain', 'pain clinic', 'clinic']",1,0,0,0.5
131033,Beautiful clinic !!,0,beautiful clinic,"['beautiful', 'beautiful clinic', 'clinic']",1,0,0,0.5
165128,"Clinic was pretty cold, wish I wore an extra layer.",1,clinic pretty cold wish wear extra layer,"['clinic', 'clinic pretty', 'clinic pretty cold', 'clinic pretty cold wish', 'clinic pretty cold wish wear', 'clinic pretty cold wish wear extra', 'clinic pretty cold wish wear extra layer', 'pretty', 'pretty cold', 'pretty cold wish', 'pretty cold wish wear', 'pretty cold wish wear extra', 'pretty cold wish wear extra layer', 'cold', 'cold wish', 'cold wish wear', 'cold wish wear extra', 'cold wish wear extra layer', 'wish', 'wish wear', 'wish wear extra', 'wish wear extra layer', 'wear', 'wear extra', 'wear extra layer', 'extra', 'extra layer', 'layer']",1,1,0,1.0000000000000002
123815,Clarity Clinic offers an integrated care approach which puts your doctor in contact with many talented therapists.,0,clarity clinic offer integrate care approach put doctor contact talented therapist,"['clarity', 'clarity clinic', 'clarity clinic offer', 'clarity clinic offer integrate', 'clarity clinic offer integrate care', 'clarity clinic offer integrate care approach', 'clarity clinic offer integrate care approach put', 'clarity clinic offer integrate care approach put doctor', 'clarity clinic offer integrate care approach put doctor contact', 'clarity clinic offer integrate care approach put doctor contact talented', 'clarity clinic offer integrate care approach put doctor contact talented therapist', 'clinic', 'clinic offer', 'clinic offer integrate', 'clinic offer integrate care', 'clinic offer integrate care approach', 'clinic offer integrate care approach put', 'clinic offer integrate care approach put doctor', 'clinic offer integrate care approach put doctor contact', 'clinic offer integrate care approach put doctor contact talented', 'clinic offer integrate care approach put doctor contact talented therapist', 'offer', 'offer integrate', 'offer integrate care', 'offer integrate care approach', 'offer integrate care approach put', 'offer integrate care approach put doctor', 'offer integrate care approach put doctor contact', 'offer integrate care approach put doctor contact talented', 'offer integrate care approach put doctor contact talented therapist', 'integrate', 'integrate care', 'integrate care approach', 'integrate care approach put', 'integrate care approach put doctor', 'integrate care approach put doctor contact', 'integrate care approach put doctor contact talented', 'integrate care approach put doctor contact talented therapist', 'care', 'care approach', 'care approach put', 'care approach put doctor', 'care approach put doctor contact', 'care approach put doctor contact talented', 'care approach put doctor contact talented therapist', 'approach', 'approach put', 'approach put doctor', 'approach put doctor contact', 'approach put doctor contact talented', 'approach put doctor contact talented therapist', 'put', 'put doctor', 'put doctor contact', 'put doctor contact talented', 'put doctor contact talented therapist', 'doctor', 'doctor contact', 'doctor contact talented', 'doctor contact talented therapist', 'contact', 'contact talented', 'contact talented therapist', 'talented', 'talented therapist', 'therapist']",1,0,0,0.5
85198,and inviting g throughout all my procedures.,0,invite g procedure,"['invite', 'invite g', 'invite g procedure', 'g', 'g procedure', 'procedure']",0,0,1,0.5
94570,I will recommend this clinic to everyone I know.,0,recommend clinic know,"['recommend', 'recommend clinic', 'recommend clinic know', 'clinic', 'clinic know', 'know']",1,0,0,0.5
69920,I have always had a great experience at the clinic.,0,great experience clinic,"['great', 'great experience', 'great experience clinic', 'experience', 'experience clinic', 'clinic']",1,0,0,0.5
117376,I do NOT support this clinic.,1,support clinic,"['support', 'support clinic', 'clinic']",1,0,0,0.5
76453,Clinic good.,0,clinic good,"['clinic', 'clinic good', 'good']",1,0,0,0.5
172995,Then they backed out of offering any type of financial help and even told me to find a new clinic.,1,back offer type fiscal help tell find new clinic,"['back', 'back offer', 'back offer type', 'back offer type fiscal', 'back offer type fiscal help', 'back offer type fiscal help tell', 'back offer type fiscal help tell find', 'back offer type fiscal help tell find new', 'back offer type fiscal help tell find new clinic', 'offer', 'offer type', 'offer type fiscal', 'offer type fiscal help', 'offer type fiscal help tell', 'offer type fiscal help tell find', 'offer type fiscal help tell find new', 'offer type fiscal help tell find new clinic', 'type', 'type fiscal', 'type fiscal help', 'type fiscal help tell', 'type fiscal help tell find', 'type fiscal help tell find new', 'type fiscal help tell find new clinic', 'fiscal', 'fiscal help', 'fiscal help tell', 'fiscal help tell find', 'fiscal help tell find new', 'fiscal help tell find new clinic', 'help', 'help tell', 'help tell find', 'help tell find new', 'help tell find new clinic', 'tell', 'tell find', 'tell find new', 'tell find new clinic', 'find', 'find new', 'find new clinic', 'new', 'new clinic', 'clinic']",1,0,0,0.5
127277,I had a great experience with Prestige Primary Clinic.,0,great experience prestige primary clinic,"['great', 'great experience', 'great experience prestige', 'great experience prestige primary', 'great experience prestige primary clinic', 'experience', 'experience prestige', 'experience prestige primary', 'experience prestige primary clinic', 'prestige', 'prestige primary', 'prestige primary clinic', 'primary', 'primary clinic', 'clinic']",1,0,0,0.5
151902,Artwork a little sexual for a women's clinic in my and nurse's opinion except body casts.,1,network little sexual woman clinic nurse opinion body cast,"['network', 'network little', 'network little sexual', 'network little sexual woman', 'network little sexual woman clinic', 'network little sexual woman clinic nurse', 'network little sexual woman clinic nurse opinion', 'network little sexual woman clinic nurse opinion body', 'network little sexual woman clinic nurse opinion body cast', 'little', 'little sexual', 'little sexual woman', 'little sexual woman clinic', 'little sexual woman clinic nurse', 'little sexual woman clinic nurse opinion', 'little sexual woman clinic nurse opinion body', 'little sexual woman clinic nurse opinion body cast', 'sexual', 'sexual woman', 'sexual woman clinic', 'sexual woman clinic nurse', 'sexual woman clinic nurse opinion', 'sexual woman clinic nurse opinion body', 'sexual woman clinic nurse opinion body cast', 'woman', 'woman clinic', 'woman clinic nurse', 'woman clinic nurse opinion', 'woman clinic nurse opinion body', 'woman clinic nurse opinion body cast', 'clinic', 'clinic nurse', 'clinic nurse opinion', 'clinic nurse opinion body', 'clinic nurse opinion body cast', 'nurse', 'nurse opinion', 'nurse opinion body', 'nurse opinion body cast', 'opinion', 'opinion body', 'opinion body cast', 'body', 'body cast', 'cast']",1,0,0,0.5
158338,You can tell the clinic was ran seamlessly with compassion and too care.,0,tell clinic run fearlessly compassion care,"['tell', 'tell clinic', 'tell clinic run', 'tell clinic run fearlessly', 'tell clinic run fearlessly compassion', 'tell clinic run fearlessly compassion care', 'clinic', 'clinic run', 'clinic run fearlessly', 'clinic run fearlessly compassion', 'clinic run fearlessly compassion care', 'run', 'run fearlessly', 'run fearlessly compassion', 'run fearlessly compassion care', 'fearlessly', 'fearlessly compassion', 'fearlessly compassion care', 'compassion', 'compassion care', 'care']",1,0,0,0.5
69422,Dr Chisholm and his staff made what cold have been a very unpleasant experience into a very pleasant one.,0,staff cold unpleasant experience pleasant,"['staff', 'staff cold', 'staff cold unpleasant', 'staff cold unpleasant experience', 'staff cold unpleasant experience pleasant', 'cold', 'cold unpleasant', 'cold unpleasant experience', 'cold unpleasant experience pleasant', 'unpleasant', 'unpleasant experience', 'unpleasant experience pleasant', 'experience', 'experience pleasant', 'pleasant']",0,1,0,0.5
68984,Improvement can be files from clinic available to ER 24/7 when needed.,1,improvement file clinic available erbium need,"['improvement', 'improvement file', 'improvement file clinic', 'improvement file clinic available', 'improvement file clinic available erbium', 'improvement file clinic available erbium need', 'file', 'file clinic', 'file clinic available', 'file clinic available erbium', 'file clinic available erbium need', 'clinic', 'clinic available', 'clinic available erbium', 'clinic available erbium need', 'available', 'available erbium', 'available erbium need', 'erbium', 'erbium need', 'need']",1,0,0,0.5
166822,"The Clinic forgets at times, to show compassion, takes a village to solve a problem.",1,clinic forget time compassion take village solve problem,"['clinic', 'clinic forget', 'clinic forget time', 'clinic forget time compassion', 'clinic forget time compassion take', 'clinic forget time compassion take village', 'clinic forget time compassion take village solve', 'clinic forget time compassion take village solve problem', 'forget', 'forget time', 'forget time compassion', 'forget time compassion take', 'forget time compassion take village', 'forget time compassion take village solve', 'forget time compassion take village solve problem', 'time', 'time compassion', 'time compassion take', 'time compassion take village', 'time compassion take village solve', 'time compassion take village solve problem', 'compassion', 'compassion take', 'compassion take village', 'compassion take village solve', 'compassion take village solve problem', 'take', 'take village', 'take village solve', 'take village solve problem', 'village', 'village solve', 'village solve problem', 'solve', 'solve problem', 'problem']",1,0,0,0.5
130110,"The second i stepped in the clinic, I was treated by kind and caring staff who all smiled!",0,step clinic treat kind dare staff smile,"['step', 'step clinic', 'step clinic treat', 'step clinic treat kind', 'step clinic treat kind dare', 'step clinic treat kind dare staff', 'step clinic treat kind dare staff smile', 'clinic', 'clinic treat', 'clinic treat kind', 'clinic treat kind dare', 'clinic treat kind dare staff', 'clinic treat kind dare staff smile', 'treat', 'treat kind', 'treat kind dare', 'treat kind dare staff', 'treat kind dare staff smile', 'kind', 'kind dare', 'kind dare staff', 'kind dare staff smile', 'dare', 'dare staff', 'dare staff smile', 'staff', 'staff smile', 'smile']",1,0,0,0.5
185243,I travel over an hour just to get to their clinic because I genuinely believe that they are the best in all of South Georgia.,0,travel clinic genuinely believe good,"['travel', 'travel clinic', 'travel clinic genuinely', 'travel clinic genuinely believe', 'travel clinic genuinely believe good', 'clinic', 'clinic genuinely', 'clinic genuinely believe', 'clinic genuinely believe good', 'genuinely', 'genuinely believe', 'genuinely believe good', 'believe', 'believe good', 'good']",1,0,0,0.5
188599,and concern for patient well-being even beyond the clinic's walls.,0,concern patient well clinic wall,"['concern', 'concern patient', 'concern patient well', 'concern patient well clinic', 'concern patient well clinic wall', 'patient', 'patient well', 'patient well clinic', 'patient well clinic wall', 'well', 'well clinic', 'well clinic wall', 'clinic', 'clinic wall', 'wall']",1,0,0,0.5
122202,I feel very fortunate that this eye care clinic is located near me.,0,feel fortunate eye care clinic locate near,"['feel', 'feel fortunate', 'feel fortunate eye', 'feel fortunate eye care', 'feel fortunate eye care clinic', 'feel fortunate eye care clinic locate', 'feel fortunate eye care clinic locate near', 'fortunate', 'fortunate eye', 'fortunate eye care', 'fortunate eye care clinic', 'fortunate eye care clinic locate', 'fortunate eye care clinic locate near', 'eye', 'eye care', 'eye care clinic', 'eye care clinic locate', 'eye care clinic locate near', 'care', 'care clinic', 'care clinic locate', 'care clinic locate near', 'clinic', 'clinic locate', 'clinic locate near', 'locate', 'locate near', 'near']",1,0,0,0.5
141415,They also have nice quilts in the exam rooms if you're cold.,0,nice quilt examination room cold,"['nice', 'nice quilt', 'nice quilt examination', 'nice quilt examination room', 'nice quilt examination room cold', 'quilt', 'quilt examination', 'quilt examination room', 'quilt examination room cold', 'examination', 'examination room', 'examination room cold', 'room', 'room cold', 'cold']",0,1,0,0.5
111838,It was mistake upon mistake and I will never recommend this clinic for free to any woman.,1,mistake mistake recommend clinic free woman,"['mistake', 'mistake mistake', 'mistake mistake recommend', 'mistake mistake recommend clinic', 'mistake mistake recommend clinic free', 'mistake mistake recommend clinic free woman', 'mistake', 'mistake recommend', 'mistake recommend clinic', 'mistake recommend clinic free', 'mistake recommend clinic free woman', 'recommend', 'recommend clinic', 'recommend clinic free', 'recommend clinic free woman', 'clinic', 'clinic free', 'clinic free woman', 'free', 'free woman', 'woman']",1,0,0,0.5
163771,This doctor has a very nonchalant cold demeanor with clients of older age.,1,doctor nonchalantly cold demeanor client old age,"['doctor', 'doctor nonchalantly', 'doctor nonchalantly cold', 'doctor nonchalantly cold demeanor', 'doctor nonchalantly cold demeanor client', 'doctor nonchalantly cold demeanor client old', 'doctor nonchalantly cold demeanor client old age', 'nonchalantly', 'nonchalantly cold', 'nonchalantly cold demeanor', 'nonchalantly cold demeanor client', 'nonchalantly cold demeanor client old', 'nonchalantly cold demeanor client old age', 'cold', 'cold demeanor', 'cold demeanor client', 'cold demeanor client old', 'cold demeanor client old age', 'demeanor', 'demeanor client', 'demeanor client old', 'demeanor client old age', 'client', 'client old', 'client old age', 'old', 'old age', 'age']",0,1,0,0.5
170825,"I zoomed through them because I felt this cold energy he was giving off, like he was in a rush.",1,loom feel cold energy give like rush,"['loom', 'loom feel', 'loom feel cold', 'loom feel cold energy', 'loom feel cold energy give', 'loom feel cold energy give like', 'loom feel cold energy give like rush', 'feel', 'feel cold', 'feel cold energy', 'feel cold energy give', 'feel cold energy give like', 'feel cold energy give like rush', 'cold', 'cold energy', 'cold energy give', 'cold energy give like', 'cold energy give like rush', 'energy', 'energy give', 'energy give like', 'energy give like rush', 'give', 'give like', 'give like rush', 'like', 'like rush', 'rush']",0,1,0,0.5
180483,The clinic made this process a breeze from the bloodwork to the injection instructions.,0,clinic process breeze woodwork injection instruction,"['clinic', 'clinic process', 'clinic process breeze', 'clinic process breeze woodwork', 'clinic process breeze woodwork injection', 'clinic process breeze woodwork injection instruction', 'process', 'process breeze', 'process breeze woodwork', 'process breeze woodwork injection', 'process breeze woodwork injection instruction', 'breeze', 'breeze woodwork', 'breeze woodwork injection', 'breeze woodwork injection instruction', 'woodwork', 'woodwork injection', 'woodwork injection instruction', 'injection', 'injection instruction', 'instruction']",1,0,0,0.5
114312,However there are only a few doctors actually working at this clinic.,1,doctor actually work clinic,"['doctor', 'doctor actually', 'doctor actually work', 'doctor actually work clinic', 'actually', 'actually work', 'actually work clinic', 'work', 'work clinic', 'clinic']",1,0,0,0.5
83113,I found out about Dr. Tartak from a friend at church who got surgery at her clinic,0,find dr tartar friend church get surgery clinic,"['find', 'find dr', 'find dr tartar', 'find dr tartar friend', 'find dr tartar friend church', 'find dr tartar friend church get', 'find dr tartar friend church get surgery', 'find dr tartar friend church get surgery clinic', 'dr', 'dr tartar', 'dr tartar friend', 'dr tartar friend church', 'dr tartar friend church get', 'dr tartar friend church get surgery', 'dr tartar friend church get surgery clinic', 'tartar', 'tartar friend', 'tartar friend church', 'tartar friend church get', 'tartar friend church get surgery', 'tartar friend church get surgery clinic', 'friend', 'friend church', 'friend church get', 'friend church get surgery', 'friend church get surgery clinic', 'church', 'church get', 'church get surgery', 'church get surgery clinic', 'get', 'get surgery', 'get surgery clinic', 'surgery', 'surgery clinic', 'clinic']",1,0,0,0.5
131168,"The girls at the desk, were so inviting and so sweet.",0,girl desk invite sweet,"['girl', 'girl desk', 'girl desk invite', 'girl desk invite sweet', 'desk', 'desk invite', 'desk invite sweet', 'invite', 'invite sweet', 'sweet']",0,0,1,0.5
107528,The clinic is very efficient.,0,clinic efficient,"['clinic', 'clinic efficient', 'efficient']",1,0,0,0.5
133174,I have been coming to this clinic for years and always get treated with such patience!!,0,come clinic treat patience,"['come', 'come clinic', 'come clinic treat', 'come clinic treat patience', 'clinic', 'clinic treat', 'clinic treat patience', 'treat', 'treat patience', 'patience']",1,0,0,0.5
103933,"I have been treated at euromed clinic for 6 months and feel much better, very little pain, not taking any more pain pills.",0,treat europe clinic feel good little pain take pain pill,"['treat', 'treat europe', 'treat europe clinic', 'treat europe clinic feel', 'treat europe clinic feel good', 'treat europe clinic feel good little', 'treat europe clinic feel good little pain', 'treat europe clinic feel good little pain take', 'treat europe clinic feel good little pain take pain', 'treat europe clinic feel good little pain take pain pill', 'europe', 'europe clinic', 'europe clinic feel', 'europe clinic feel good', 'europe clinic feel good little', 'europe clinic feel good little pain', 'europe clinic feel good little pain take', 'europe clinic feel good little pain take pain', 'europe clinic feel good little pain take pain pill', 'clinic', 'clinic feel', 'clinic feel good', 'clinic feel good little', 'clinic feel good little pain', 'clinic feel good little pain take', 'clinic feel good little pain take pain', 'clinic feel good little pain take pain pill', 'feel', 'feel good', 'feel good little', 'feel good little pain', 'feel good little pain take', 'feel good little pain take pain', 'feel good little pain take pain pill', 'good', 'good little', 'good little pain', 'good little pain take', 'good little pain take pain', 'good little pain take pain pill', 'little', 'little pain', 'little pain take', 'little pain take pain', 'little pain take pain pill', 'pain', 'pain take', 'pain take pain', 'pain take pain pill', 'take', 'take pain', 'take pain pill', 'pain', 'pain pill', 'pill']",1,0,0,0.5
67584,The clinic medical bills were so inflated,1,clinic medical bill inflate,"['clinic', 'clinic medical', 'clinic medical bill', 'clinic medical bill inflate', 'medical', 'medical bill', 'medical bill inflate', 'bill', 'bill inflate', 'inflate']",1,0,0,0.5
92461,do not waste your precious time and money and faith at this clinic.,1,waste precious time money faith clinic,"['waste', 'waste precious', 'waste precious time', 'waste precious time money', 'waste precious time money faith', 'waste precious time money faith clinic', 'precious', 'precious time', 'precious time money', 'precious time money faith', 'precious time money faith clinic', 'time', 'time money', 'time money faith', 'time money faith clinic', 'money', 'money faith', 'money faith clinic', 'faith', 'faith clinic', 'clinic']",1,0,0,0.5
