commentId,comment,classification,comment_processed,word_phrase_list,happen,map,pure,insanity,similarity_score
115813,"When I finally did decide, he made the whole thing easy by explaining exactly what would happen and what would be going on.",0,finally decide thing easy explain precisely happen go,"['finally', 'finally decide', 'finally decide thing', 'finally decide thing easy', 'finally decide thing easy explain', 'finally decide thing easy explain precisely', 'finally decide thing easy explain precisely happen', 'finally decide thing easy explain precisely happen go', 'decide', 'decide thing', 'decide thing easy', 'decide thing easy explain', 'decide thing easy explain precisely', 'decide thing easy explain precisely happen', 'decide thing easy explain precisely happen go', 'thing', 'thing easy', 'thing easy explain', 'thing easy explain precisely', 'thing easy explain precisely happen', 'thing easy explain precisely happen go', 'easy', 'easy explain', 'easy explain precisely', 'easy explain precisely happen', 'easy explain precisely happen go', 'explain', 'explain precisely', 'explain precisely happen', 'explain precisely happen go', 'precisely', 'precisely happen', 'precisely happen go', 'happen', 'happen go', 'go']",1,0,0,0,0.043478260869565216
161806,My procedure was to take place on a Tuesday but something happen at the hospital and it couldn't be done on that day.,1,procedure place happen hospital,"['procedure', 'procedure place', 'procedure place happen', 'procedure place happen hospital', 'place', 'place happen', 'place happen hospital', 'happen', 'happen hospital', 'hospital']",1,0,0,0,0.1
87121,If you happen to get a live person (apparently by accident) the staff will hang up.,1,happen live person apparently accident staff hang,"['happen', 'happen live', 'happen live person', 'happen live person apparently', 'happen live person apparently accident', 'happen live person apparently accident staff', 'happen live person apparently accident staff hang', 'live', 'live person', 'live person apparently', 'live person apparently accident', 'live person apparently accident staff', 'live person apparently accident staff hang', 'person', 'person apparently', 'person apparently accident', 'person apparently accident staff', 'person apparently accident staff hang', 'apparently', 'apparently accident', 'apparently accident staff', 'apparently accident staff hang', 'accident', 'accident staff', 'accident staff hang', 'staff', 'staff hang', 'hang']",1,0,0,0,0.05263157894736842
63894,She pretty much mapped out what I was going to do,0,pretty map go,"['pretty', 'pretty map', 'pretty map go', 'map', 'map go', 'go']",0,1,0,0,0.125
103249,I even had light spotting after the exam which has never happened before.I returned a month later to get an IUD insertion.,1,light sporting examination happen return mud insertion,"['light', 'light sporting', 'light sporting examination', 'light sporting examination happen', 'light sporting examination happen return', 'light sporting examination happen return mud', 'light sporting examination happen return mud insertion', 'sporting', 'sporting examination', 'sporting examination happen', 'sporting examination happen return', 'sporting examination happen return mud', 'sporting examination happen return mud insertion', 'examination', 'examination happen', 'examination happen return', 'examination happen return mud', 'examination happen return mud insertion', 'happen', 'happen return', 'happen return mud', 'happen return mud insertion', 'return', 'return mud', 'return mud insertion', 'mud', 'mud insertion', 'insertion']",1,0,0,0,0.05263157894736842
110044,When my first meeting finally happened Dr. Levy talked in a calming manner even though i was anxious from the waiting,0,meet finally happen talk calm manner anxious wait,"['meet', 'meet finally', 'meet finally happen', 'meet finally happen talk', 'meet finally happen talk calm', 'meet finally happen talk calm manner', 'meet finally happen talk calm manner anxious', 'meet finally happen talk calm manner anxious wait', 'finally', 'finally happen', 'finally happen talk', 'finally happen talk calm', 'finally happen talk calm manner', 'finally happen talk calm manner anxious', 'finally happen talk calm manner anxious wait', 'happen', 'happen talk', 'happen talk calm', 'happen talk calm manner', 'happen talk calm manner anxious', 'happen talk calm manner anxious wait', 'talk', 'talk calm', 'talk calm manner', 'talk calm manner anxious', 'talk calm manner anxious wait', 'calm', 'calm manner', 'calm manner anxious', 'calm manner anxious wait', 'manner', 'manner anxious', 'manner anxious wait', 'anxious', 'anxious wait', 'wait']",1,0,0,0,0.043478260869565216
69994,"During our consultation, dr. Went over everything that would happen during her procedure..which was very reassuring and appreciated..",0,consultation go happen procedurewhich reassure appreciate,"['consultation', 'consultation go', 'consultation go happen', 'consultation go happen procedurewhich', 'consultation go happen procedurewhich reassure', 'consultation go happen procedurewhich reassure appreciate', 'go', 'go happen', 'go happen procedurewhich', 'go happen procedurewhich reassure', 'go happen procedurewhich reassure appreciate', 'happen', 'happen procedurewhich', 'happen procedurewhich reassure', 'happen procedurewhich reassure appreciate', 'procedurewhich', 'procedurewhich reassure', 'procedurewhich reassure appreciate', 'reassure', 'reassure appreciate', 'appreciate']",1,0,0,0,0.06451612903225806
122166,They have always been transparent about costs and everything that is going to happen and they are usually available for questions or concerns.,0,transparent cost go happen normally available question concern,"['transparent', 'transparent cost', 'transparent cost go', 'transparent cost go happen', 'transparent cost go happen normally', 'transparent cost go happen normally available', 'transparent cost go happen normally available question', 'transparent cost go happen normally available question concern', 'cost', 'cost go', 'cost go happen', 'cost go happen normally', 'cost go happen normally available', 'cost go happen normally available question', 'cost go happen normally available question concern', 'go', 'go happen', 'go happen normally', 'go happen normally available', 'go happen normally available question', 'go happen normally available question concern', 'happen', 'happen normally', 'happen normally available', 'happen normally available question', 'happen normally available question concern', 'normally', 'normally available', 'normally available question', 'normally available question concern', 'available', 'available question', 'available question concern', 'question', 'question concern', 'concern']",1,0,0,0,0.043478260869565216
144103,"It is blasting all night this happens so often, people live next door, it?s torture.",1,blast happen people live door torture,"['blast', 'blast happen', 'blast happen people', 'blast happen people live', 'blast happen people live door', 'blast happen people live door torture', 'happen', 'happen people', 'happen people live', 'happen people live door', 'happen people live door torture', 'people', 'people live', 'people live door', 'people live door torture', 'live', 'live door', 'live door torture', 'door', 'door torture', 'torture']",1,0,0,0,0.06451612903225806
173122,A big issue that happened that ruined my post-op recovery,1,big issue happen ruin rostov recovery,"['big', 'big issue', 'big issue happen', 'big issue happen ruin', 'big issue happen ruin rostov', 'big issue happen ruin rostov recovery', 'issue', 'issue happen', 'issue happen ruin', 'issue happen ruin rostov', 'issue happen ruin rostov recovery', 'happen', 'happen ruin', 'happen ruin rostov', 'happen ruin rostov recovery', 'ruin', 'ruin rostov', 'ruin rostov recovery', 'rostov', 'rostov recovery', 'recovery']",1,0,0,0,0.06451612903225806
59597,"She has a very nice personality, she explains everything that is going on and the ramifications of what could happen if things don't go right.",0,nice personality explain go ratification happen thing right,"['nice', 'nice personality', 'nice personality explain', 'nice personality explain go', 'nice personality explain go ratification', 'nice personality explain go ratification happen', 'nice personality explain go ratification happen thing', 'nice personality explain go ratification happen thing right', 'personality', 'personality explain', 'personality explain go', 'personality explain go ratification', 'personality explain go ratification happen', 'personality explain go ratification happen thing', 'personality explain go ratification happen thing right', 'explain', 'explain go', 'explain go ratification', 'explain go ratification happen', 'explain go ratification happen thing', 'explain go ratification happen thing right', 'go', 'go ratification', 'go ratification happen', 'go ratification happen thing', 'go ratification happen thing right', 'ratification', 'ratification happen', 'ratification happen thing', 'ratification happen thing right', 'happen', 'happen thing', 'happen thing right', 'thing', 'thing right', 'right']",1,0,0,0,0.043478260869565216
165314,"Things happen as efficiently as they can for a busy doctor's office, which is pretty quickly if you ask me, considering circumstances.",0,thing happen efficiently busy doctor office pretty quickly ask consider circumstance,"['thing', 'thing happen', 'thing happen efficiently', 'thing happen efficiently busy', 'thing happen efficiently busy doctor', 'thing happen efficiently busy doctor office', 'thing happen efficiently busy doctor office pretty', 'thing happen efficiently busy doctor office pretty quickly', 'thing happen efficiently busy doctor office pretty quickly ask', 'thing happen efficiently busy doctor office pretty quickly ask consider', 'thing happen efficiently busy doctor office pretty quickly ask consider circumstance', 'happen', 'happen efficiently', 'happen efficiently busy', 'happen efficiently busy doctor', 'happen efficiently busy doctor office', 'happen efficiently busy doctor office pretty', 'happen efficiently busy doctor office pretty quickly', 'happen efficiently busy doctor office pretty quickly ask', 'happen efficiently busy doctor office pretty quickly ask consider', 'happen efficiently busy doctor office pretty quickly ask consider circumstance', 'efficiently', 'efficiently busy', 'efficiently busy doctor', 'efficiently busy doctor office', 'efficiently busy doctor office pretty', 'efficiently busy doctor office pretty quickly', 'efficiently busy doctor office pretty quickly ask', 'efficiently busy doctor office pretty quickly ask consider', 'efficiently busy doctor office pretty quickly ask consider circumstance', 'busy', 'busy doctor', 'busy doctor office', 'busy doctor office pretty', 'busy doctor office pretty quickly', 'busy doctor office pretty quickly ask', 'busy doctor office pretty quickly ask consider', 'busy doctor office pretty quickly ask consider circumstance', 'doctor', 'doctor office', 'doctor office pretty', 'doctor office pretty quickly', 'doctor office pretty quickly ask', 'doctor office pretty quickly ask consider', 'doctor office pretty quickly ask consider circumstance', 'office', 'office pretty', 'office pretty quickly', 'office pretty quickly ask', 'office pretty quickly ask consider', 'office pretty quickly ask consider circumstance', 'pretty', 'pretty quickly', 'pretty quickly ask', 'pretty quickly ask consider', 'pretty quickly ask consider circumstance', 'quickly', 'quickly ask', 'quickly ask consider', 'quickly ask consider circumstance', 'ask', 'ask consider', 'ask consider circumstance', 'consider', 'consider circumstance', 'circumstance']",1,0,0,0,0.02631578947368421
143230,I am impressed with the results and glad nothing bad happened.,0,impress result glad bad happen,"['impress', 'impress result', 'impress result glad', 'impress result glad bad', 'impress result glad bad happen', 'result', 'result glad', 'result glad bad', 'result glad bad happen', 'glad', 'glad bad', 'glad bad happen', 'bad', 'bad happen', 'happen']",1,0,0,0,0.08
141204,"When he came in and I explained what happened, his response was to question whether I actually had a brain bleed or died?",1,come explain happen response question actually brain bleed die,"['come', 'come explain', 'come explain happen', 'come explain happen response', 'come explain happen response question', 'come explain happen response question actually', 'come explain happen response question actually brain', 'come explain happen response question actually brain bleed', 'come explain happen response question actually brain bleed die', 'explain', 'explain happen', 'explain happen response', 'explain happen response question', 'explain happen response question actually', 'explain happen response question actually brain', 'explain happen response question actually brain bleed', 'explain happen response question actually brain bleed die', 'happen', 'happen response', 'happen response question', 'happen response question actually', 'happen response question actually brain', 'happen response question actually brain bleed', 'happen response question actually brain bleed die', 'response', 'response question', 'response question actually', 'response question actually brain', 'response question actually brain bleed', 'response question actually brain bleed die', 'question', 'question actually', 'question actually brain', 'question actually brain bleed', 'question actually brain bleed die', 'actually', 'actually brain', 'actually brain bleed', 'actually brain bleed die', 'brain', 'brain bleed', 'brain bleed die', 'bleed', 'bleed die', 'die']",1,0,0,0,0.03636363636363636
103252,I even had light spotting after the exam which has never happened before.I returned a month later to get an IUD insertion.,1,light sporting examination happen return mud insertion,"['light', 'light sporting', 'light sporting examination', 'light sporting examination happen', 'light sporting examination happen return', 'light sporting examination happen return mud', 'light sporting examination happen return mud insertion', 'sporting', 'sporting examination', 'sporting examination happen', 'sporting examination happen return', 'sporting examination happen return mud', 'sporting examination happen return mud insertion', 'examination', 'examination happen', 'examination happen return', 'examination happen return mud', 'examination happen return mud insertion', 'happen', 'happen return', 'happen return mud', 'happen return mud insertion', 'return', 'return mud', 'return mud insertion', 'mud', 'mud insertion', 'insertion']",1,0,0,0,0.05263157894736842
145517,I feel like my bruising was so bad the first time something happened they are not telling me...,1,feel like bruise bad time happen not tell,"['feel', 'feel like', 'feel like bruise', 'feel like bruise bad', 'feel like bruise bad time', 'feel like bruise bad time happen', 'feel like bruise bad time happen not', 'feel like bruise bad time happen not tell', 'like', 'like bruise', 'like bruise bad', 'like bruise bad time', 'like bruise bad time happen', 'like bruise bad time happen not', 'like bruise bad time happen not tell', 'bruise', 'bruise bad', 'bruise bad time', 'bruise bad time happen', 'bruise bad time happen not', 'bruise bad time happen not tell', 'bad', 'bad time', 'bad time happen', 'bad time happen not', 'bad time happen not tell', 'time', 'time happen', 'time happen not', 'time happen not tell', 'happen', 'happen not', 'happen not tell', 'not', 'not tell', 'tell']",1,0,0,0,0.043478260869565216
84714,also Donna her assistant is on top of what is happening,0,assistant happen,"['assistant', 'assistant happen', 'happen']",1,0,0,0,0.15384615384615385
156894,"He said...""don't worry we won't let that happen.""",0,saiddont worry wo let happen,"['saiddont', 'saiddont worry', 'saiddont worry wo', 'saiddont worry wo let', 'saiddont worry wo let happen', 'worry', 'worry wo', 'worry wo let', 'worry wo let happen', 'wo', 'wo let', 'wo let happen', 'let', 'let happen', 'happen']",1,0,0,0,0.08
155429,I found this odd as I was able to do a simple five minute google search and found out that this indeed does happen.,1,find odd able simple search find happen,"['find', 'find odd', 'find odd able', 'find odd able simple', 'find odd able simple search', 'find odd able simple search find', 'find odd able simple search find happen', 'odd', 'odd able', 'odd able simple', 'odd able simple search', 'odd able simple search find', 'odd able simple search find happen', 'able', 'able simple', 'able simple search', 'able simple search find', 'able simple search find happen', 'simple', 'simple search', 'simple search find', 'simple search find happen', 'search', 'search find', 'search find happen', 'find', 'find happen', 'happen']",1,0,0,0,0.05263157894736842
190039,Pure plastics was very professional and informational with the expectations needed in order to undergo the surgery.,0,pure plastic professional information expectation need order undergo surgery,"['pure', 'pure plastic', 'pure plastic professional', 'pure plastic professional information', 'pure plastic professional information expectation', 'pure plastic professional information expectation need', 'pure plastic professional information expectation need order', 'pure plastic professional information expectation need order undergo', 'pure plastic professional information expectation need order undergo surgery', 'plastic', 'plastic professional', 'plastic professional information', 'plastic professional information expectation', 'plastic professional information expectation need', 'plastic professional information expectation need order', 'plastic professional information expectation need order undergo', 'plastic professional information expectation need order undergo surgery', 'professional', 'professional information', 'professional information expectation', 'professional information expectation need', 'professional information expectation need order', 'professional information expectation need order undergo', 'professional information expectation need order undergo surgery', 'information', 'information expectation', 'information expectation need', 'information expectation need order', 'information expectation need order undergo', 'information expectation need order undergo surgery', 'expectation', 'expectation need', 'expectation need order', 'expectation need order undergo', 'expectation need order undergo surgery', 'need', 'need order', 'need order undergo', 'need order undergo surgery', 'order', 'order undergo', 'order undergo surgery', 'undergo', 'undergo surgery', 'surgery']",0,0,1,0,0.03636363636363636
139467,and worked to get me in and make my cruise happen...,0,work cruise happen,"['work', 'work cruise', 'work cruise happen', 'cruise', 'cruise happen', 'happen']",1,0,0,0,0.125
124189,I learned about FCI and Dr.Jacobs by pure luck but it was the best thing that could have happened to us.,0,learn focus drjacobs pure fortune good thing happen,"['learn', 'learn focus', 'learn focus drjacobs', 'learn focus drjacobs pure', 'learn focus drjacobs pure fortune', 'learn focus drjacobs pure fortune good', 'learn focus drjacobs pure fortune good thing', 'learn focus drjacobs pure fortune good thing happen', 'focus', 'focus drjacobs', 'focus drjacobs pure', 'focus drjacobs pure fortune', 'focus drjacobs pure fortune good', 'focus drjacobs pure fortune good thing', 'focus drjacobs pure fortune good thing happen', 'drjacobs', 'drjacobs pure', 'drjacobs pure fortune', 'drjacobs pure fortune good', 'drjacobs pure fortune good thing', 'drjacobs pure fortune good thing happen', 'pure', 'pure fortune', 'pure fortune good', 'pure fortune good thing', 'pure fortune good thing happen', 'fortune', 'fortune good', 'fortune good thing', 'fortune good thing happen', 'good', 'good thing', 'good thing happen', 'thing', 'thing happen', 'happen']",1,0,1,0,0.08695652173913043
111518,after surgery he gave us less than 10 min to explain what happened.,1,surgery give min explain happen,"['surgery', 'surgery give', 'surgery give min', 'surgery give min explain', 'surgery give min explain happen', 'give', 'give min', 'give min explain', 'give min explain happen', 'min', 'min explain', 'min explain happen', 'explain', 'explain happen', 'happen']",1,0,0,0,0.08
111170,Worst thing that's ever happened to me.,1,bad thing happen,"['bad', 'bad thing', 'bad thing happen', 'thing', 'thing happen', 'happen']",1,0,0,0,0.125
167984,She hears what you wish for and truly makes it happen.,0,hear wish truly make happen,"['hear', 'hear wish', 'hear wish truly', 'hear wish truly make', 'hear wish truly make happen', 'wish', 'wish truly', 'wish truly make', 'wish truly make happen', 'truly', 'truly make', 'truly make happen', 'make', 'make happen', 'happen']",1,0,0,0,0.08
103921,After the surgery I was able to get back on my feet and about my daily routines like nothing ever happened.,0,surgery able foot daily routine like happen,"['surgery', 'surgery able', 'surgery able foot', 'surgery able foot daily', 'surgery able foot daily routine', 'surgery able foot daily routine like', 'surgery able foot daily routine like happen', 'able', 'able foot', 'able foot daily', 'able foot daily routine', 'able foot daily routine like', 'able foot daily routine like happen', 'foot', 'foot daily', 'foot daily routine', 'foot daily routine like', 'foot daily routine like happen', 'daily', 'daily routine', 'daily routine like', 'daily routine like happen', 'routine', 'routine like', 'routine like happen', 'like', 'like happen', 'happen']",1,0,0,0,0.05263157894736842
153130,"At this point, Mofid has been paid for about $24,000 worth of work that didn't happen.",1,point move pay worth work happen,"['point', 'point move', 'point move pay', 'point move pay worth', 'point move pay worth work', 'point move pay worth work happen', 'move', 'move pay', 'move pay worth', 'move pay worth work', 'move pay worth work happen', 'pay', 'pay worth', 'pay worth work', 'pay worth work happen', 'worth', 'worth work', 'worth work happen', 'work', 'work happen', 'happen']",1,0,0,0,0.06451612903225806
88849,She is very thorough and was able to figure out what was happening with me,0,thorough able figure happen,"['thorough', 'thorough able', 'thorough able figure', 'thorough able figure happen', 'able', 'able figure', 'able figure happen', 'figure', 'figure happen', 'happen']",1,0,0,0,0.1
184716,Our big red flag happened when he wanted to pull my husbands 2 front teeth as he said he had an infection.,1,big red flag happen want pull husband tooth say infection,"['big', 'big red', 'big red flag', 'big red flag happen', 'big red flag happen want', 'big red flag happen want pull', 'big red flag happen want pull husband', 'big red flag happen want pull husband tooth', 'big red flag happen want pull husband tooth say', 'big red flag happen want pull husband tooth say infection', 'red', 'red flag', 'red flag happen', 'red flag happen want', 'red flag happen want pull', 'red flag happen want pull husband', 'red flag happen want pull husband tooth', 'red flag happen want pull husband tooth say', 'red flag happen want pull husband tooth say infection', 'flag', 'flag happen', 'flag happen want', 'flag happen want pull', 'flag happen want pull husband', 'flag happen want pull husband tooth', 'flag happen want pull husband tooth say', 'flag happen want pull husband tooth say infection', 'happen', 'happen want', 'happen want pull', 'happen want pull husband', 'happen want pull husband tooth', 'happen want pull husband tooth say', 'happen want pull husband tooth say infection', 'want', 'want pull', 'want pull husband', 'want pull husband tooth', 'want pull husband tooth say', 'want pull husband tooth say infection', 'pull', 'pull husband', 'pull husband tooth', 'pull husband tooth say', 'pull husband tooth say infection', 'husband', 'husband tooth', 'husband tooth say', 'husband tooth say infection', 'tooth', 'tooth say', 'tooth say infection', 'say', 'say infection', 'infection']",1,0,0,0,0.03076923076923077
96065,I will never forget 4 months later that everything he said happened,0,forget say happen,"['forget', 'forget say', 'forget say happen', 'say', 'say happen', 'happen']",1,0,0,0,0.125
112576,"They saw me right away, knew right off hand what had happened.",0,see right away know right hand happen,"['see', 'see right', 'see right away', 'see right away know', 'see right away know right', 'see right away know right hand', 'see right away know right hand happen', 'right', 'right away', 'right away know', 'right away know right', 'right away know right hand', 'right away know right hand happen', 'away', 'away know', 'away know right', 'away know right hand', 'away know right hand happen', 'know', 'know right', 'know right hand', 'know right hand happen', 'right', 'right hand', 'right hand happen', 'hand', 'hand happen', 'happen']",1,0,0,0,0.05263157894736842
