commentId,comment,classification,comment_processed,word_phrase_list,happen,map,pure,insanity,similarity_score
171396,"Casey Ferguson was the approving upper staff cc'd party in letter with no call to me to ask about what happened, extremely unprofessional office.",1,case ferguson approving upper staff cod party letter no ask happen extremely professional office,"['case', 'case ferguson', 'case ferguson approving', 'case ferguson approving upper', 'case ferguson approving upper staff', 'case ferguson approving upper staff cod', 'case ferguson approving upper staff cod party', 'case ferguson approving upper staff cod party letter', 'case ferguson approving upper staff cod party letter no', 'case ferguson approving upper staff cod party letter no ask', 'case ferguson approving upper staff cod party letter no ask happen', 'case ferguson approving upper staff cod party letter no ask happen extremely', 'case ferguson approving upper staff cod party letter no ask happen extremely professional', 'case ferguson approving upper staff cod party letter no ask happen extremely professional office', 'ferguson', 'ferguson approving', 'ferguson approving upper', 'ferguson approving upper staff', 'ferguson approving upper staff cod', 'ferguson approving upper staff cod party', 'ferguson approving upper staff cod party letter', 'ferguson approving upper staff cod party letter no', 'ferguson approving upper staff cod party letter no ask', 'ferguson approving upper staff cod party letter no ask happen', 'ferguson approving upper staff cod party letter no ask happen extremely', 'ferguson approving upper staff cod party letter no ask happen extremely professional', 'ferguson approving upper staff cod party letter no ask happen extremely professional office', 'approving', 'approving upper', 'approving upper staff', 'approving upper staff cod', 'approving upper staff cod party', 'approving upper staff cod party letter', 'approving upper staff cod party letter no', 'approving upper staff cod party letter no ask', 'approving upper staff cod party letter no ask happen', 'approving upper staff cod party letter no ask happen extremely', 'approving upper staff cod party letter no ask happen extremely professional', 'approving upper staff cod party letter no ask happen extremely professional office', 'upper', 'upper staff', 'upper staff cod', 'upper staff cod party', 'upper staff cod party letter', 'upper staff cod party letter no', 'upper staff cod party letter no ask', 'upper staff cod party letter no ask happen', 'upper staff cod party letter no ask happen extremely', 'upper staff cod party letter no ask happen extremely professional', 'upper staff cod party letter no ask happen extremely professional office', 'staff', 'staff cod', 'staff cod party', 'staff cod party letter', 'staff cod party letter no', 'staff cod party letter no ask', 'staff cod party letter no ask happen', 'staff cod party letter no ask happen extremely', 'staff cod party letter no ask happen extremely professional', 'staff cod party letter no ask happen extremely professional office', 'cod', 'cod party', 'cod party letter', 'cod party letter no', 'cod party letter no ask', 'cod party letter no ask happen', 'cod party letter no ask happen extremely', 'cod party letter no ask happen extremely professional', 'cod party letter no ask happen extremely professional office', 'party', 'party letter', 'party letter no', 'party letter no ask', 'party letter no ask happen', 'party letter no ask happen extremely', 'party letter no ask happen extremely professional', 'party letter no ask happen extremely professional office', 'letter', 'letter no', 'letter no ask', 'letter no ask happen', 'letter no ask happen extremely', 'letter no ask happen extremely professional', 'letter no ask happen extremely professional office', 'no', 'no ask', 'no ask happen', 'no ask happen extremely', 'no ask happen extremely professional', 'no ask happen extremely professional office', 'ask', 'ask happen', 'ask happen extremely', 'ask happen extremely professional', 'ask happen extremely professional office', 'happen', 'happen extremely', 'happen extremely professional', 'happen extremely professional office', 'extremely', 'extremely professional', 'extremely professional office', 'professional', 'professional office', 'office']",1,0,0,0,0.017391304347826087
133354,The team really prepared me for everything that happened along the way so far.,0,team prepare happen way far,"['team', 'team prepare', 'team prepare happen', 'team prepare happen way', 'team prepare happen way far', 'prepare', 'prepare happen', 'prepare happen way', 'prepare happen way far', 'happen', 'happen way', 'happen way far', 'way', 'way far', 'far']",1,0,0,0,0.08
147993,The nurse mentioned I would be getting a pelvic exam but that did not even happen so I am so confused.,1,nurse mention get pelvic examination not happen confuse,"['nurse', 'nurse mention', 'nurse mention get', 'nurse mention get pelvic', 'nurse mention get pelvic examination', 'nurse mention get pelvic examination not', 'nurse mention get pelvic examination not happen', 'nurse mention get pelvic examination not happen confuse', 'mention', 'mention get', 'mention get pelvic', 'mention get pelvic examination', 'mention get pelvic examination not', 'mention get pelvic examination not happen', 'mention get pelvic examination not happen confuse', 'get', 'get pelvic', 'get pelvic examination', 'get pelvic examination not', 'get pelvic examination not happen', 'get pelvic examination not happen confuse', 'pelvic', 'pelvic examination', 'pelvic examination not', 'pelvic examination not happen', 'pelvic examination not happen confuse', 'examination', 'examination not', 'examination not happen', 'examination not happen confuse', 'not', 'not happen', 'not happen confuse', 'happen', 'happen confuse', 'confuse']",1,0,0,0,0.043478260869565216
188828,We come there to get out of pain and like I said accidents happen but not a good look on him.,1,come pain like say accident happen not good look,"['come', 'come pain', 'come pain like', 'come pain like say', 'come pain like say accident', 'come pain like say accident happen', 'come pain like say accident happen not', 'come pain like say accident happen not good', 'come pain like say accident happen not good look', 'pain', 'pain like', 'pain like say', 'pain like say accident', 'pain like say accident happen', 'pain like say accident happen not', 'pain like say accident happen not good', 'pain like say accident happen not good look', 'like', 'like say', 'like say accident', 'like say accident happen', 'like say accident happen not', 'like say accident happen not good', 'like say accident happen not good look', 'say', 'say accident', 'say accident happen', 'say accident happen not', 'say accident happen not good', 'say accident happen not good look', 'accident', 'accident happen', 'accident happen not', 'accident happen not good', 'accident happen not good look', 'happen', 'happen not', 'happen not good', 'happen not good look', 'not', 'not good', 'not good look', 'good', 'good look', 'look']",1,0,0,0,0.03636363636363636
102331,I was informed of everything happening during my entire procedure.,0,inform happen entire procedure,"['inform', 'inform happen', 'inform happen entire', 'inform happen entire procedure', 'happen', 'happen entire', 'happen entire procedure', 'entire', 'entire procedure', 'procedure']",1,0,0,0,0.1
85031,"The wait was brief, the nurses were courteous and welcoming, updated me on what's going to happen and made sure I feel comfortable",0,wait brief nurse courteous welcome update go happen sure feel comfortable,"['wait', 'wait brief', 'wait brief nurse', 'wait brief nurse courteous', 'wait brief nurse courteous welcome', 'wait brief nurse courteous welcome update', 'wait brief nurse courteous welcome update go', 'wait brief nurse courteous welcome update go happen', 'wait brief nurse courteous welcome update go happen sure', 'wait brief nurse courteous welcome update go happen sure feel', 'wait brief nurse courteous welcome update go happen sure feel comfortable', 'brief', 'brief nurse', 'brief nurse courteous', 'brief nurse courteous welcome', 'brief nurse courteous welcome update', 'brief nurse courteous welcome update go', 'brief nurse courteous welcome update go happen', 'brief nurse courteous welcome update go happen sure', 'brief nurse courteous welcome update go happen sure feel', 'brief nurse courteous welcome update go happen sure feel comfortable', 'nurse', 'nurse courteous', 'nurse courteous welcome', 'nurse courteous welcome update', 'nurse courteous welcome update go', 'nurse courteous welcome update go happen', 'nurse courteous welcome update go happen sure', 'nurse courteous welcome update go happen sure feel', 'nurse courteous welcome update go happen sure feel comfortable', 'courteous', 'courteous welcome', 'courteous welcome update', 'courteous welcome update go', 'courteous welcome update go happen', 'courteous welcome update go happen sure', 'courteous welcome update go happen sure feel', 'courteous welcome update go happen sure feel comfortable', 'welcome', 'welcome update', 'welcome update go', 'welcome update go happen', 'welcome update go happen sure', 'welcome update go happen sure feel', 'welcome update go happen sure feel comfortable', 'update', 'update go', 'update go happen', 'update go happen sure', 'update go happen sure feel', 'update go happen sure feel comfortable', 'go', 'go happen', 'go happen sure', 'go happen sure feel', 'go happen sure feel comfortable', 'happen', 'happen sure', 'happen sure feel', 'happen sure feel comfortable', 'sure', 'sure feel', 'sure feel comfortable', 'feel', 'feel comfortable', 'comfortable']",1,0,0,0,0.02631578947368421
148989,BUT HE WILL NOT BOTHER IF ANYTHING HAPPENS TO THEM.,1,not bother happen,"['not', 'not bother', 'not bother happen', 'bother', 'bother happen', 'happen']",1,0,0,0,0.125
131226,She is the greatest thing that has happened to my skin!,0,great thing happen skin,"['great', 'great thing', 'great thing happen', 'great thing happen skin', 'thing', 'thing happen', 'thing happen skin', 'happen', 'happen skin', 'skin']",1,0,0,0,0.1
161954,and that the situation would be handled and prevented from happening in the future.,0,situation handle prevent happen future,"['situation', 'situation handle', 'situation handle prevent', 'situation handle prevent happen', 'situation handle prevent happen future', 'handle', 'handle prevent', 'handle prevent happen', 'handle prevent happen future', 'prevent', 'prevent happen', 'prevent happen future', 'happen', 'happen future', 'future']",1,0,0,0,0.08
133830,They kept me well informed about what was going to happen and what I needed to do after surgery.,0,keep inform go happen need surgery,"['keep', 'keep inform', 'keep inform go', 'keep inform go happen', 'keep inform go happen need', 'keep inform go happen need surgery', 'inform', 'inform go', 'inform go happen', 'inform go happen need', 'inform go happen need surgery', 'go', 'go happen', 'go happen need', 'go happen need surgery', 'happen', 'happen need', 'happen need surgery', 'need', 'need surgery', 'surgery']",1,0,0,0,0.06451612903225806
169249,"and grace in all that they do, things happen for all those who are involved.",0,grace thing happen involve,"['grace', 'grace thing', 'grace thing happen', 'grace thing happen involve', 'thing', 'thing happen', 'thing happen involve', 'happen', 'happen involve', 'involve']",1,0,0,0,0.1
147703,"Unfortunately since covid has happened they have stopped serving iui patients,",1,unfortunately happen stop serve three patient,"['unfortunately', 'unfortunately happen', 'unfortunately happen stop', 'unfortunately happen stop serve', 'unfortunately happen stop serve three', 'unfortunately happen stop serve three patient', 'happen', 'happen stop', 'happen stop serve', 'happen stop serve three', 'happen stop serve three patient', 'stop', 'stop serve', 'stop serve three', 'stop serve three patient', 'serve', 'serve three', 'serve three patient', 'three', 'three patient', 'patient']",1,0,0,0,0.06451612903225806
161588,"Even though Dr. Snyder promised phone follow up since my daughter was away at school, this never happened.",1,promise phone follow daughter away school happen,"['promise', 'promise phone', 'promise phone follow', 'promise phone follow daughter', 'promise phone follow daughter away', 'promise phone follow daughter away school', 'promise phone follow daughter away school happen', 'phone', 'phone follow', 'phone follow daughter', 'phone follow daughter away', 'phone follow daughter away school', 'phone follow daughter away school happen', 'follow', 'follow daughter', 'follow daughter away', 'follow daughter away school', 'follow daughter away school happen', 'daughter', 'daughter away', 'daughter away school', 'daughter away school happen', 'away', 'away school', 'away school happen', 'school', 'school happen', 'happen']",1,0,0,0,0.05263157894736842
152794,"""Athena"" who told me to use google maps to find a physical therapy location (I don't know what to look",1,tell use map find physical therapy location know look,"['tell', 'tell use', 'tell use map', 'tell use map find', 'tell use map find physical', 'tell use map find physical therapy', 'tell use map find physical therapy location', 'tell use map find physical therapy location know', 'tell use map find physical therapy location know look', 'use', 'use map', 'use map find', 'use map find physical', 'use map find physical therapy', 'use map find physical therapy location', 'use map find physical therapy location know', 'use map find physical therapy location know look', 'map', 'map find', 'map find physical', 'map find physical therapy', 'map find physical therapy location', 'map find physical therapy location know', 'map find physical therapy location know look', 'find', 'find physical', 'find physical therapy', 'find physical therapy location', 'find physical therapy location know', 'find physical therapy location know look', 'physical', 'physical therapy', 'physical therapy location', 'physical therapy location know', 'physical therapy location know look', 'therapy', 'therapy location', 'therapy location know', 'therapy location know look', 'location', 'location know', 'location know look', 'know', 'know look', 'look']",0,1,0,0,0.03636363636363636
127604,Appreciated the staff explaining everything that was going to happen so I knew what to expect.,0,appreciate staff explain go happen know expect,"['appreciate', 'appreciate staff', 'appreciate staff explain', 'appreciate staff explain go', 'appreciate staff explain go happen', 'appreciate staff explain go happen know', 'appreciate staff explain go happen know expect', 'staff', 'staff explain', 'staff explain go', 'staff explain go happen', 'staff explain go happen know', 'staff explain go happen know expect', 'explain', 'explain go', 'explain go happen', 'explain go happen know', 'explain go happen know expect', 'go', 'go happen', 'go happen know', 'go happen know expect', 'happen', 'happen know', 'happen know expect', 'know', 'know expect', 'expect']",1,0,0,0,0.05263157894736842
148639,matter what happened before I came to your office you should take care me that's what most medical professionals do,1,matter happen come office care medical professional,"['matter', 'matter happen', 'matter happen come', 'matter happen come office', 'matter happen come office care', 'matter happen come office care medical', 'matter happen come office care medical professional', 'happen', 'happen come', 'happen come office', 'happen come office care', 'happen come office care medical', 'happen come office care medical professional', 'come', 'come office', 'come office care', 'come office care medical', 'come office care medical professional', 'office', 'office care', 'office care medical', 'office care medical professional', 'care', 'care medical', 'care medical professional', 'medical', 'medical professional', 'professional']",1,0,0,0,0.05263157894736842
128541,He makes sure he truly explains the diagnosis and takes measures for preventive so future issues do not happen again.,0,make sure truly explain diagnosis take measure preventive future issue not happen,"['make', 'make sure', 'make sure truly', 'make sure truly explain', 'make sure truly explain diagnosis', 'make sure truly explain diagnosis take', 'make sure truly explain diagnosis take measure', 'make sure truly explain diagnosis take measure preventive', 'make sure truly explain diagnosis take measure preventive future', 'make sure truly explain diagnosis take measure preventive future issue', 'make sure truly explain diagnosis take measure preventive future issue not', 'make sure truly explain diagnosis take measure preventive future issue not happen', 'sure', 'sure truly', 'sure truly explain', 'sure truly explain diagnosis', 'sure truly explain diagnosis take', 'sure truly explain diagnosis take measure', 'sure truly explain diagnosis take measure preventive', 'sure truly explain diagnosis take measure preventive future', 'sure truly explain diagnosis take measure preventive future issue', 'sure truly explain diagnosis take measure preventive future issue not', 'sure truly explain diagnosis take measure preventive future issue not happen', 'truly', 'truly explain', 'truly explain diagnosis', 'truly explain diagnosis take', 'truly explain diagnosis take measure', 'truly explain diagnosis take measure preventive', 'truly explain diagnosis take measure preventive future', 'truly explain diagnosis take measure preventive future issue', 'truly explain diagnosis take measure preventive future issue not', 'truly explain diagnosis take measure preventive future issue not happen', 'explain', 'explain diagnosis', 'explain diagnosis take', 'explain diagnosis take measure', 'explain diagnosis take measure preventive', 'explain diagnosis take measure preventive future', 'explain diagnosis take measure preventive future issue', 'explain diagnosis take measure preventive future issue not', 'explain diagnosis take measure preventive future issue not happen', 'diagnosis', 'diagnosis take', 'diagnosis take measure', 'diagnosis take measure preventive', 'diagnosis take measure preventive future', 'diagnosis take measure preventive future issue', 'diagnosis take measure preventive future issue not', 'diagnosis take measure preventive future issue not happen', 'take', 'take measure', 'take measure preventive', 'take measure preventive future', 'take measure preventive future issue', 'take measure preventive future issue not', 'take measure preventive future issue not happen', 'measure', 'measure preventive', 'measure preventive future', 'measure preventive future issue', 'measure preventive future issue not', 'measure preventive future issue not happen', 'preventive', 'preventive future', 'preventive future issue', 'preventive future issue not', 'preventive future issue not happen', 'future', 'future issue', 'future issue not', 'future issue not happen', 'issue', 'issue not', 'issue not happen', 'not', 'not happen', 'happen']",1,0,0,0,0.022727272727272728
158340,They cover things up and act like nothing happens.,1,cover thing act like happen,"['cover', 'cover thing', 'cover thing act', 'cover thing act like', 'cover thing act like happen', 'thing', 'thing act', 'thing act like', 'thing act like happen', 'act', 'act like', 'act like happen', 'like', 'like happen', 'happen']",1,0,0,0,0.08
184633,"I hope no one needs his services haha but if u happen to need surgery unfortunately, HE IS THE BEST!",0,hope no need service hata u happen need surgery unfortunately good,"['hope', 'hope no', 'hope no need', 'hope no need service', 'hope no need service hata', 'hope no need service hata u', 'hope no need service hata u happen', 'hope no need service hata u happen need', 'hope no need service hata u happen need surgery', 'hope no need service hata u happen need surgery unfortunately', 'hope no need service hata u happen need surgery unfortunately good', 'no', 'no need', 'no need service', 'no need service hata', 'no need service hata u', 'no need service hata u happen', 'no need service hata u happen need', 'no need service hata u happen need surgery', 'no need service hata u happen need surgery unfortunately', 'no need service hata u happen need surgery unfortunately good', 'need', 'need service', 'need service hata', 'need service hata u', 'need service hata u happen', 'need service hata u happen need', 'need service hata u happen need surgery', 'need service hata u happen need surgery unfortunately', 'need service hata u happen need surgery unfortunately good', 'service', 'service hata', 'service hata u', 'service hata u happen', 'service hata u happen need', 'service hata u happen need surgery', 'service hata u happen need surgery unfortunately', 'service hata u happen need surgery unfortunately good', 'hata', 'hata u', 'hata u happen', 'hata u happen need', 'hata u happen need surgery', 'hata u happen need surgery unfortunately', 'hata u happen need surgery unfortunately good', 'u', 'u happen', 'u happen need', 'u happen need surgery', 'u happen need surgery unfortunately', 'u happen need surgery unfortunately good', 'happen', 'happen need', 'happen need surgery', 'happen need surgery unfortunately', 'happen need surgery unfortunately good', 'need', 'need surgery', 'need surgery unfortunately', 'need surgery unfortunately good', 'surgery', 'surgery unfortunately', 'surgery unfortunately good', 'unfortunately', 'unfortunately good', 'good']",1,0,0,0,0.02631578947368421
159005,and squishing my skin around kinda of showing him what I wanted he was able to digitally make it happen on the screen!,0,lap skin kind show want able digital happen screen,"['lap', 'lap skin', 'lap skin kind', 'lap skin kind show', 'lap skin kind show want', 'lap skin kind show want able', 'lap skin kind show want able digital', 'lap skin kind show want able digital happen', 'lap skin kind show want able digital happen screen', 'skin', 'skin kind', 'skin kind show', 'skin kind show want', 'skin kind show want able', 'skin kind show want able digital', 'skin kind show want able digital happen', 'skin kind show want able digital happen screen', 'kind', 'kind show', 'kind show want', 'kind show want able', 'kind show want able digital', 'kind show want able digital happen', 'kind show want able digital happen screen', 'show', 'show want', 'show want able', 'show want able digital', 'show want able digital happen', 'show want able digital happen screen', 'want', 'want able', 'want able digital', 'want able digital happen', 'want able digital happen screen', 'able', 'able digital', 'able digital happen', 'able digital happen screen', 'digital', 'digital happen', 'digital happen screen', 'happen', 'happen screen', 'screen']",1,0,0,0,0.03636363636363636
177553,This happened to me In 2019 and was embraced to talk about it then.,1,happen embrace talk,"['happen', 'happen embrace', 'happen embrace talk', 'embrace', 'embrace talk', 'talk']",1,0,0,0,0.125
103545,"Carrie is amazing and explained everything as she went along, and that has never happened in the past!",0,carry amaze explain go happen past,"['carry', 'carry amaze', 'carry amaze explain', 'carry amaze explain go', 'carry amaze explain go happen', 'carry amaze explain go happen past', 'amaze', 'amaze explain', 'amaze explain go', 'amaze explain go happen', 'amaze explain go happen past', 'explain', 'explain go', 'explain go happen', 'explain go happen past', 'go', 'go happen', 'go happen past', 'happen', 'happen past', 'past']",1,0,0,0,0.06451612903225806
127408,"This woman was so rude to my family member and so unnecessarily rude Twice now that if it happens again, I will go there myself",1,woman rude family member unnecessarily rude twice happen,"['woman', 'woman rude', 'woman rude family', 'woman rude family member', 'woman rude family member unnecessarily', 'woman rude family member unnecessarily rude', 'woman rude family member unnecessarily rude twice', 'woman rude family member unnecessarily rude twice happen', 'rude', 'rude family', 'rude family member', 'rude family member unnecessarily', 'rude family member unnecessarily rude', 'rude family member unnecessarily rude twice', 'rude family member unnecessarily rude twice happen', 'family', 'family member', 'family member unnecessarily', 'family member unnecessarily rude', 'family member unnecessarily rude twice', 'family member unnecessarily rude twice happen', 'member', 'member unnecessarily', 'member unnecessarily rude', 'member unnecessarily rude twice', 'member unnecessarily rude twice happen', 'unnecessarily', 'unnecessarily rude', 'unnecessarily rude twice', 'unnecessarily rude twice happen', 'rude', 'rude twice', 'rude twice happen', 'twice', 'twice happen', 'happen']",1,0,0,0,0.043478260869565216
168844,"Whatever he tells you believe it, follow it, and he's going to make it happen.",0,tell believe follow go happen,"['tell', 'tell believe', 'tell believe follow', 'tell believe follow go', 'tell believe follow go happen', 'believe', 'believe follow', 'believe follow go', 'believe follow go happen', 'follow', 'follow go', 'follow go happen', 'go', 'go happen', 'happen']",1,0,0,0,0.08
