commentId,comment,classification,comment_processed,word_phrase_list,ultrasound,pleasant,pleasant expect,expect,similarity_score
111707,The results were exactly what I expected cannot ask for anything else.,0,result precisely expect not ask,"['result', 'result precisely', 'result precisely expect', 'result precisely expect not', 'result precisely expect not ask', 'precisely', 'precisely expect', 'precisely expect not', 'precisely expect not ask', 'expect', 'expect not', 'expect not ask', 'not', 'not ask', 'ask']",0,0,0,1,0.09523809523809523
135722,One of the most pleasant Doctor experience I Have ever had.,0,pleasant experience,"['pleasant', 'pleasant experience', 'experience']",0,1,0,0,0.2222222222222222
61067,"He's very nice, very knowledgeable and very pleasant.",0,nice knowledgeable pleasant,"['nice', 'nice knowledgeable', 'nice knowledgeable pleasant', 'knowledgeable', 'knowledgeable pleasant', 'pleasant']",0,1,0,0,0.16666666666666666
152197,Again I was told what to expect.,0,tell expect,"['tell', 'tell expect', 'expect']",0,0,0,1,0.2222222222222222
121135,His support staff both in the sleep lab and in office are very pleasant to deal.,0,support staff sleep lab office pleasant deal,"['support', 'support staff', 'support staff sleep', 'support staff sleep lab', 'support staff sleep lab office', 'support staff sleep lab office pleasant', 'support staff sleep lab office pleasant deal', 'staff', 'staff sleep', 'staff sleep lab', 'staff sleep lab office', 'staff sleep lab office pleasant', 'staff sleep lab office pleasant deal', 'sleep', 'sleep lab', 'sleep lab office', 'sleep lab office pleasant', 'sleep lab office pleasant deal', 'lab', 'lab office', 'lab office pleasant', 'lab office pleasant deal', 'office', 'office pleasant', 'office pleasant deal', 'pleasant', 'pleasant deal', 'deal']",0,1,0,0,0.058823529411764705
65246,"He's always very concerned about my well-being, he's very friendly and he makes the visit a pleasant visit.",0,concerned well friendly make visit pleasant visit,"['concerned', 'concerned well', 'concerned well friendly', 'concerned well friendly make', 'concerned well friendly make visit', 'concerned well friendly make visit pleasant', 'concerned well friendly make visit pleasant visit', 'well', 'well friendly', 'well friendly make', 'well friendly make visit', 'well friendly make visit pleasant', 'well friendly make visit pleasant visit', 'friendly', 'friendly make', 'friendly make visit', 'friendly make visit pleasant', 'friendly make visit pleasant visit', 'make', 'make visit', 'make visit pleasant', 'make visit pleasant visit', 'visit', 'visit pleasant', 'visit pleasant visit', 'pleasant', 'pleasant visit', 'visit']",0,1,0,0,0.058823529411764705
98724,"the most pleasant experience ive had in a dentists office,.",0,pleasant experience dentist office,"['pleasant', 'pleasant experience', 'pleasant experience dentist', 'pleasant experience dentist office', 'experience', 'experience dentist', 'experience dentist office', 'dentist', 'dentist office', 'office']",0,1,0,0,0.125
187804,"The staff is so kind and pleasant, it's not hard to get in to see the doctor",0,staff kind pleasant not hard,"['staff', 'staff kind', 'staff kind pleasant', 'staff kind pleasant not', 'staff kind pleasant not hard', 'kind', 'kind pleasant', 'kind pleasant not', 'kind pleasant not hard', 'pleasant', 'pleasant not', 'pleasant not hard', 'not', 'not hard', 'hard']",0,1,0,0,0.09523809523809523
58284,"I was not aware that when the ultrasound of my breast was scheduled, that I would also need a diagnostic mammogram.  ",1,not aware ultrasound breast schedule need diagnostic mammogram,"['not', 'not aware', 'not aware ultrasound', 'not aware ultrasound breast', 'not aware ultrasound breast schedule', 'not aware ultrasound breast schedule need', 'not aware ultrasound breast schedule need diagnostic', 'not aware ultrasound breast schedule need diagnostic mammogram', 'aware', 'aware ultrasound', 'aware ultrasound breast', 'aware ultrasound breast schedule', 'aware ultrasound breast schedule need', 'aware ultrasound breast schedule need diagnostic', 'aware ultrasound breast schedule need diagnostic mammogram', 'ultrasound', 'ultrasound breast', 'ultrasound breast schedule', 'ultrasound breast schedule need', 'ultrasound breast schedule need diagnostic', 'ultrasound breast schedule need diagnostic mammogram', 'breast', 'breast schedule', 'breast schedule need', 'breast schedule need diagnostic', 'breast schedule need diagnostic mammogram', 'schedule', 'schedule need', 'schedule need diagnostic', 'schedule need diagnostic mammogram', 'need', 'need diagnostic', 'need diagnostic mammogram', 'diagnostic', 'diagnostic mammogram', 'mammogram']",1,0,0,0,0.047619047619047616
59564,I thought the doctor was very professional and was always pleasant to deal with and took care of my needs,0,think professional pleasant deal take care need,"['think', 'think professional', 'think professional pleasant', 'think professional pleasant deal', 'think professional pleasant deal take', 'think professional pleasant deal take care', 'think professional pleasant deal take care need', 'professional', 'professional pleasant', 'professional pleasant deal', 'professional pleasant deal take', 'professional pleasant deal take care', 'professional pleasant deal take care need', 'pleasant', 'pleasant deal', 'pleasant deal take', 'pleasant deal take care', 'pleasant deal take care need', 'deal', 'deal take', 'deal take care', 'deal take care need', 'take', 'take care', 'take care need', 'care', 'care need', 'need']",0,1,0,0,0.058823529411764705
62017,"It was very pleasant, very precise, very business like.",0,pleasant precise business like,"['pleasant', 'pleasant precise', 'pleasant precise business', 'pleasant precise business like', 'precise', 'precise business', 'precise business like', 'business', 'business like', 'like']",0,1,0,0,0.125
105740,He is very knowledgable and lets you know what to expect.,0,knowledgable let know expect,"['knowledgable', 'knowledgable let', 'knowledgable let know', 'knowledgable let know expect', 'let', 'let know', 'let know expect', 'know', 'know expect', 'expect']",0,0,0,1,0.125
88805,for multiple visits in order to bill my insurance company on several ultrasounds.,1,multiple visit order bill insurance company ultrasound,"['multiple', 'multiple visit', 'multiple visit order', 'multiple visit order bill', 'multiple visit order bill insurance', 'multiple visit order bill insurance company', 'multiple visit order bill insurance company ultrasound', 'visit', 'visit order', 'visit order bill', 'visit order bill insurance', 'visit order bill insurance company', 'visit order bill insurance company ultrasound', 'order', 'order bill', 'order bill insurance', 'order bill insurance company', 'order bill insurance company ultrasound', 'bill', 'bill insurance', 'bill insurance company', 'bill insurance company ultrasound', 'insurance', 'insurance company', 'insurance company ultrasound', 'company', 'company ultrasound', 'ultrasound']",1,0,0,0,0.058823529411764705
107455,Everyone in the office is always pleasant and courteous even when I've had to bring my children in to my appointments with me.,0,office pleasant courteous bring child appointment,"['office', 'office pleasant', 'office pleasant courteous', 'office pleasant courteous bring', 'office pleasant courteous bring child', 'office pleasant courteous bring child appointment', 'pleasant', 'pleasant courteous', 'pleasant courteous bring', 'pleasant courteous bring child', 'pleasant courteous bring child appointment', 'courteous', 'courteous bring', 'courteous bring child', 'courteous bring child appointment', 'bring', 'bring child', 'bring child appointment', 'child', 'child appointment', 'appointment']",0,1,0,0,0.07407407407407407
85120,I feel much better than expected.,0,feel good expect,"['feel', 'feel good', 'feel good expect', 'good', 'good expect', 'expect']",0,0,0,1,0.16666666666666666
63402,Very good to come in and talk to us and was very pleasant,0,good come talk pleasant,"['good', 'good come', 'good come talk', 'good come talk pleasant', 'come', 'come talk', 'come talk pleasant', 'talk', 'talk pleasant', 'pleasant']",0,1,0,0,0.125
190263,Personally all these little things are a pleasant surprise these days as it's kind of like finding a,0,personally little thing pleasant surprise kind like find,"['personally', 'personally little', 'personally little thing', 'personally little thing pleasant', 'personally little thing pleasant surprise', 'personally little thing pleasant surprise kind', 'personally little thing pleasant surprise kind like', 'personally little thing pleasant surprise kind like find', 'little', 'little thing', 'little thing pleasant', 'little thing pleasant surprise', 'little thing pleasant surprise kind', 'little thing pleasant surprise kind like', 'little thing pleasant surprise kind like find', 'thing', 'thing pleasant', 'thing pleasant surprise', 'thing pleasant surprise kind', 'thing pleasant surprise kind like', 'thing pleasant surprise kind like find', 'pleasant', 'pleasant surprise', 'pleasant surprise kind', 'pleasant surprise kind like', 'pleasant surprise kind like find', 'surprise', 'surprise kind', 'surprise kind like', 'surprise kind like find', 'kind', 'kind like', 'kind like find', 'like', 'like find', 'find']",0,1,0,0,0.047619047619047616
191622,"That's something I didn't know to ask about, and expect my Dr. to bring up.",1,know ask expect bring,"['know', 'know ask', 'know ask expect', 'know ask expect bring', 'ask', 'ask expect', 'ask expect bring', 'expect', 'expect bring', 'bring']",0,0,0,1,0.125
95809,Absolutely pleasant experience.,0,absolutely pleasant experience,"['absolutely', 'absolutely pleasant', 'absolutely pleasant experience', 'pleasant', 'pleasant experience', 'experience']",0,1,0,0,0.16666666666666666
71242,I came on board skeptical and not expecting them to live up to what they claimed to be.,1,come board sceptically not expect live claim,"['come', 'come board', 'come board sceptically', 'come board sceptically not', 'come board sceptically not expect', 'come board sceptically not expect live', 'come board sceptically not expect live claim', 'board', 'board sceptically', 'board sceptically not', 'board sceptically not expect', 'board sceptically not expect live', 'board sceptically not expect live claim', 'sceptically', 'sceptically not', 'sceptically not expect', 'sceptically not expect live', 'sceptically not expect live claim', 'not', 'not expect', 'not expect live', 'not expect live claim', 'expect', 'expect live', 'expect live claim', 'live', 'live claim', 'claim']",0,0,0,1,0.058823529411764705
164896,and Dr Neinstein was very honest with me from the very start in what was obtainable and what to expect.,0,honest start gettable expect,"['honest', 'honest start', 'honest start gettable', 'honest start gettable expect', 'start', 'start gettable', 'start gettable expect', 'gettable', 'gettable expect', 'expect']",0,0,0,1,0.125
105969,A few weeks ago I had a cleaning and found the visit to be just as pleasant,0,clean find visit pleasant,"['clean', 'clean find', 'clean find visit', 'clean find visit pleasant', 'find', 'find visit', 'find visit pleasant', 'visit', 'visit pleasant', 'pleasant']",0,1,0,0,0.125
99115,I wished the staff would explain more about the IVF process and what I could expect to experience.,1,wish staff explain process expect experience,"['wish', 'wish staff', 'wish staff explain', 'wish staff explain process', 'wish staff explain process expect', 'wish staff explain process expect experience', 'staff', 'staff explain', 'staff explain process', 'staff explain process expect', 'staff explain process expect experience', 'explain', 'explain process', 'explain process expect', 'explain process expect experience', 'process', 'process expect', 'process expect experience', 'expect', 'expect experience', 'experience']",0,0,0,1,0.07407407407407407
108973,"Excellent service, I was seen in a timely manner and had a pleasant consultation.",0,excellent service see timely manner pleasant consultation,"['excellent', 'excellent service', 'excellent service see', 'excellent service see timely', 'excellent service see timely manner', 'excellent service see timely manner pleasant', 'excellent service see timely manner pleasant consultation', 'service', 'service see', 'service see timely', 'service see timely manner', 'service see timely manner pleasant', 'service see timely manner pleasant consultation', 'see', 'see timely', 'see timely manner', 'see timely manner pleasant', 'see timely manner pleasant consultation', 'timely', 'timely manner', 'timely manner pleasant', 'timely manner pleasant consultation', 'manner', 'manner pleasant', 'manner pleasant consultation', 'pleasant', 'pleasant consultation', 'consultation']",0,1,0,0,0.058823529411764705
128507,"The staff is eaqually good, and always pleasant, and obviously love their boss.",0,staff equally good pleasant obviously love bos,"['staff', 'staff equally', 'staff equally good', 'staff equally good pleasant', 'staff equally good pleasant obviously', 'staff equally good pleasant obviously love', 'staff equally good pleasant obviously love bos', 'equally', 'equally good', 'equally good pleasant', 'equally good pleasant obviously', 'equally good pleasant obviously love', 'equally good pleasant obviously love bos', 'good', 'good pleasant', 'good pleasant obviously', 'good pleasant obviously love', 'good pleasant obviously love bos', 'pleasant', 'pleasant obviously', 'pleasant obviously love', 'pleasant obviously love bos', 'obviously', 'obviously love', 'obviously love bos', 'love', 'love bos', 'bos']",0,1,0,0,0.058823529411764705
63266,"She's very pleasant, very agreeable, easy to talk to, and very caring.",0,pleasant agreeable easy talk dare,"['pleasant', 'pleasant agreeable', 'pleasant agreeable easy', 'pleasant agreeable easy talk', 'pleasant agreeable easy talk dare', 'agreeable', 'agreeable easy', 'agreeable easy talk', 'agreeable easy talk dare', 'easy', 'easy talk', 'easy talk dare', 'talk', 'talk dare', 'dare']",0,1,0,0,0.09523809523809523
107360,After care explained on what to expect .explained in detail.,0,care explain expect explain detail,"['care', 'care explain', 'care explain expect', 'care explain expect explain', 'care explain expect explain detail', 'explain', 'explain expect', 'explain expect explain', 'explain expect explain detail', 'expect', 'expect explain', 'expect explain detail', 'explain', 'explain detail', 'detail']",0,0,0,1,0.09523809523809523
82347,for less than explained and that was a pleasant surprise.,0,explain pleasant surprise,"['explain', 'explain pleasant', 'explain pleasant surprise', 'pleasant', 'pleasant surprise', 'surprise']",0,1,0,0,0.16666666666666666
113459,"more than i expected, much more. ?MoreSince my surgery the world is now a brighter",0,expect moresince surgery world bright,"['expect', 'expect moresince', 'expect moresince surgery', 'expect moresince surgery world', 'expect moresince surgery world bright', 'moresince', 'moresince surgery', 'moresince surgery world', 'moresince surgery world bright', 'surgery', 'surgery world', 'surgery world bright', 'world', 'world bright', 'bright']",0,0,0,1,0.09523809523809523
140837,My procedure went smooth and the staff were very informative about what to expect while going through the process.,0,procedure go smooth staff information expect go process,"['procedure', 'procedure go', 'procedure go smooth', 'procedure go smooth staff', 'procedure go smooth staff information', 'procedure go smooth staff information expect', 'procedure go smooth staff information expect go', 'procedure go smooth staff information expect go process', 'go', 'go smooth', 'go smooth staff', 'go smooth staff information', 'go smooth staff information expect', 'go smooth staff information expect go', 'go smooth staff information expect go process', 'smooth', 'smooth staff', 'smooth staff information', 'smooth staff information expect', 'smooth staff information expect go', 'smooth staff information expect go process', 'staff', 'staff information', 'staff information expect', 'staff information expect go', 'staff information expect go process', 'information', 'information expect', 'information expect go', 'information expect go process', 'expect', 'expect go', 'expect go process', 'go', 'go process', 'process']",0,0,0,1,0.047619047619047616
135724,Even though I am done having more kids I keep coming for my routine checkups because it is always a pleasant experience.,0,have kiss come routine check pleasant experience,"['have', 'have kiss', 'have kiss come', 'have kiss come routine', 'have kiss come routine check', 'have kiss come routine check pleasant', 'have kiss come routine check pleasant experience', 'kiss', 'kiss come', 'kiss come routine', 'kiss come routine check', 'kiss come routine check pleasant', 'kiss come routine check pleasant experience', 'come', 'come routine', 'come routine check', 'come routine check pleasant', 'come routine check pleasant experience', 'routine', 'routine check', 'routine check pleasant', 'routine check pleasant experience', 'check', 'check pleasant', 'check pleasant experience', 'pleasant', 'pleasant experience', 'experience']",0,1,0,0,0.058823529411764705
111733,My experience with Dr. Davila was a very pleasant one...,0,experience devil pleasant,"['experience', 'experience devil', 'experience devil pleasant', 'devil', 'devil pleasant', 'pleasant']",0,1,0,0,0.16666666666666666
59807,"Also, the gentelmen that checked us in were very nice and funny, which helped the situation since I have never been in a hospital before and did not know what to expect.",0,gentleman check nice funny help situation hospital not know expect,"['gentleman', 'gentleman check', 'gentleman check nice', 'gentleman check nice funny', 'gentleman check nice funny help', 'gentleman check nice funny help situation', 'gentleman check nice funny help situation hospital', 'gentleman check nice funny help situation hospital not', 'gentleman check nice funny help situation hospital not know', 'gentleman check nice funny help situation hospital not know expect', 'check', 'check nice', 'check nice funny', 'check nice funny help', 'check nice funny help situation', 'check nice funny help situation hospital', 'check nice funny help situation hospital not', 'check nice funny help situation hospital not know', 'check nice funny help situation hospital not know expect', 'nice', 'nice funny', 'nice funny help', 'nice funny help situation', 'nice funny help situation hospital', 'nice funny help situation hospital not', 'nice funny help situation hospital not know', 'nice funny help situation hospital not know expect', 'funny', 'funny help', 'funny help situation', 'funny help situation hospital', 'funny help situation hospital not', 'funny help situation hospital not know', 'funny help situation hospital not know expect', 'help', 'help situation', 'help situation hospital', 'help situation hospital not', 'help situation hospital not know', 'help situation hospital not know expect', 'situation', 'situation hospital', 'situation hospital not', 'situation hospital not know', 'situation hospital not know expect', 'hospital', 'hospital not', 'hospital not know', 'hospital not know expect', 'not', 'not know', 'not know expect', 'know', 'know expect', 'expect']",0,0,0,1,0.03278688524590164
112206,I found him to be extremely Pleasant professional and caring.,0,find extremely pleasant professional dare,"['find', 'find extremely', 'find extremely pleasant', 'find extremely pleasant professional', 'find extremely pleasant professional dare', 'extremely', 'extremely pleasant', 'extremely pleasant professional', 'extremely pleasant professional dare', 'pleasant', 'pleasant professional', 'pleasant professional dare', 'professional', 'professional dare', 'dare']",0,1,0,0,0.09523809523809523
95309,The keloid removal procedure went better than expected,0,keloid removal procedure go good expect,"['keloid', 'keloid removal', 'keloid removal procedure', 'keloid removal procedure go', 'keloid removal procedure go good', 'keloid removal procedure go good expect', 'removal', 'removal procedure', 'removal procedure go', 'removal procedure go good', 'removal procedure go good expect', 'procedure', 'procedure go', 'procedure go good', 'procedure go good expect', 'go', 'go good', 'go good expect', 'good', 'good expect', 'expect']",0,0,0,1,0.07407407407407407
163127,"Not knowing what to expect, he confidently communicated what he felt would be best",0,not know expect confidently communicate feel good,"['not', 'not know', 'not know expect', 'not know expect confidently', 'not know expect confidently communicate', 'not know expect confidently communicate feel', 'not know expect confidently communicate feel good', 'know', 'know expect', 'know expect confidently', 'know expect confidently communicate', 'know expect confidently communicate feel', 'know expect confidently communicate feel good', 'expect', 'expect confidently', 'expect confidently communicate', 'expect confidently communicate feel', 'expect confidently communicate feel good', 'confidently', 'confidently communicate', 'confidently communicate feel', 'confidently communicate feel good', 'communicate', 'communicate feel', 'communicate feel good', 'feel', 'feel good', 'good']",0,0,0,1,0.058823529411764705
143787,"so patient, and explained every step of the process to me so I knew what to expect.",0,patient explain step process know expect,"['patient', 'patient explain', 'patient explain step', 'patient explain step process', 'patient explain step process know', 'patient explain step process know expect', 'explain', 'explain step', 'explain step process', 'explain step process know', 'explain step process know expect', 'step', 'step process', 'step process know', 'step process know expect', 'process', 'process know', 'process know expect', 'know', 'know expect', 'expect']",0,0,0,1,0.07407407407407407
171451,"also more rushed then I expected, they were trying to get everyone from",1,rush expect try,"['rush', 'rush expect', 'rush expect try', 'expect', 'expect try', 'try']",0,0,0,1,0.16666666666666666
138821,My experience all began with Kristin whos very pleasant from the minutes walked in.,0,experience begin pleasant minute walk,"['experience', 'experience begin', 'experience begin pleasant', 'experience begin pleasant minute', 'experience begin pleasant minute walk', 'begin', 'begin pleasant', 'begin pleasant minute', 'begin pleasant minute walk', 'pleasant', 'pleasant minute', 'pleasant minute walk', 'minute', 'minute walk', 'walk']",0,1,0,0,0.09523809523809523
133911,"I look, more or less, like what I had expected, based on the images he",0,look like expect base image,"['look', 'look like', 'look like expect', 'look like expect base', 'look like expect base image', 'like', 'like expect', 'like expect base', 'like expect base image', 'expect', 'expect base', 'expect base image', 'base', 'base image', 'image']",0,0,0,1,0.09523809523809523
159874,for your injury but don?t expect any kind of surgery to help you with,1,injury expect kind surgery help,"['injury', 'injury expect', 'injury expect kind', 'injury expect kind surgery', 'injury expect kind surgery help', 'expect', 'expect kind', 'expect kind surgery', 'expect kind surgery help', 'kind', 'kind surgery', 'kind surgery help', 'surgery', 'surgery help', 'help']",0,0,0,1,0.09523809523809523
151505,I was greeted with a very pleasant nurse when I was called back to the examining room.,0,greet pleasant nurse call examine room,"['greet', 'greet pleasant', 'greet pleasant nurse', 'greet pleasant nurse call', 'greet pleasant nurse call examine', 'greet pleasant nurse call examine room', 'pleasant', 'pleasant nurse', 'pleasant nurse call', 'pleasant nurse call examine', 'pleasant nurse call examine room', 'nurse', 'nurse call', 'nurse call examine', 'nurse call examine room', 'call', 'call examine', 'call examine room', 'examine', 'examine room', 'room']",0,1,0,0,0.07407407407407407
167393,"From our first zoom call to a follow-up about an hour ago, I experienced everything I expected from a top plastic surgeon.",0,room follow experience expect plastic surgeon,"['room', 'room follow', 'room follow experience', 'room follow experience expect', 'room follow experience expect plastic', 'room follow experience expect plastic surgeon', 'follow', 'follow experience', 'follow experience expect', 'follow experience expect plastic', 'follow experience expect plastic surgeon', 'experience', 'experience expect', 'experience expect plastic', 'experience expect plastic surgeon', 'expect', 'expect plastic', 'expect plastic surgeon', 'plastic', 'plastic surgeon', 'surgeon']",0,0,0,1,0.07407407407407407
73087,"However, we finally got there and are expecting twins.",0,finally get expect twin,"['finally', 'finally get', 'finally get expect', 'finally get expect twin', 'get', 'get expect', 'get expect twin', 'expect', 'expect twin', 'twin']",0,0,0,1,0.125
87124,"As a potential patient, I expected to be treated with courtesy",1,potential patient expect treat courtesy,"['potential', 'potential patient', 'potential patient expect', 'potential patient expect treat', 'potential patient expect treat courtesy', 'patient', 'patient expect', 'patient expect treat', 'patient expect treat courtesy', 'expect', 'expect treat', 'expect treat courtesy', 'treat', 'treat courtesy', 'courtesy']",0,0,0,1,0.09523809523809523
