commentId,comment,classification,comment_processed,word_phrase_list,ultrasound,pleasant,pleasant expect,expect,similarity_score
164288,"and follow-up visit, the total experience has been one of interacting with an extremely pleasant group of professionals.",0,follow visit total experience interest extremely pleasant group professional,"['follow', 'follow visit', 'follow visit total', 'follow visit total experience', 'follow visit total experience interest', 'follow visit total experience interest extremely', 'follow visit total experience interest extremely pleasant', 'follow visit total experience interest extremely pleasant group', 'follow visit total experience interest extremely pleasant group professional', 'visit', 'visit total', 'visit total experience', 'visit total experience interest', 'visit total experience interest extremely', 'visit total experience interest extremely pleasant', 'visit total experience interest extremely pleasant group', 'visit total experience interest extremely pleasant group professional', 'total', 'total experience', 'total experience interest', 'total experience interest extremely', 'total experience interest extremely pleasant', 'total experience interest extremely pleasant group', 'total experience interest extremely pleasant group professional', 'experience', 'experience interest', 'experience interest extremely', 'experience interest extremely pleasant', 'experience interest extremely pleasant group', 'experience interest extremely pleasant group professional', 'interest', 'interest extremely', 'interest extremely pleasant', 'interest extremely pleasant group', 'interest extremely pleasant group professional', 'extremely', 'extremely pleasant', 'extremely pleasant group', 'extremely pleasant group professional', 'pleasant', 'pleasant group', 'pleasant group professional', 'group', 'group professional', 'professional']",0,1,0,0,0.0392156862745098
115079,the doctor and I started in his office then moved to the ultrasound room and came back to his office to discuss the results.,0,start office move ultrasound room come office discus result,"['start', 'start office', 'start office move', 'start office move ultrasound', 'start office move ultrasound room', 'start office move ultrasound room come', 'start office move ultrasound room come office', 'start office move ultrasound room come office discus', 'start office move ultrasound room come office discus result', 'office', 'office move', 'office move ultrasound', 'office move ultrasound room', 'office move ultrasound room come', 'office move ultrasound room come office', 'office move ultrasound room come office discus', 'office move ultrasound room come office discus result', 'move', 'move ultrasound', 'move ultrasound room', 'move ultrasound room come', 'move ultrasound room come office', 'move ultrasound room come office discus', 'move ultrasound room come office discus result', 'ultrasound', 'ultrasound room', 'ultrasound room come', 'ultrasound room come office', 'ultrasound room come office discus', 'ultrasound room come office discus result', 'room', 'room come', 'room come office', 'room come office discus', 'room come office discus result', 'come', 'come office', 'come office discus', 'come office discus result', 'office', 'office discus', 'office discus result', 'discus', 'discus result', 'result']",1,0,0,0,0.0392156862745098
115838,"The whole visit was not a pleasant one, and I am considering another dermatologist.",1,visit not pleasant consider dermatologist,"['visit', 'visit not', 'visit not pleasant', 'visit not pleasant consider', 'visit not pleasant consider dermatologist', 'not', 'not pleasant', 'not pleasant consider', 'not pleasant consider dermatologist', 'pleasant', 'pleasant consider', 'pleasant consider dermatologist', 'consider', 'consider dermatologist', 'dermatologist']",0,1,0,0,0.09523809523809523
124437,for about 45 minutes from beginning to end when I expected to be there much longer like other doctor visits.,0,begin end expect long like visit,"['begin', 'begin end', 'begin end expect', 'begin end expect long', 'begin end expect long like', 'begin end expect long like visit', 'end', 'end expect', 'end expect long', 'end expect long like', 'end expect long like visit', 'expect', 'expect long', 'expect long like', 'expect long like visit', 'long', 'long like', 'long like visit', 'like', 'like visit', 'visit']",0,0,0,1,0.07407407407407407
131718,"My surgery went smoother than I expected, recovery was less painful than expected--tummy tuck and lipo.",0,surgery go smooth expect recovery painful expectedtummy tuck lip,"['surgery', 'surgery go', 'surgery go smooth', 'surgery go smooth expect', 'surgery go smooth expect recovery', 'surgery go smooth expect recovery painful', 'surgery go smooth expect recovery painful expectedtummy', 'surgery go smooth expect recovery painful expectedtummy tuck', 'surgery go smooth expect recovery painful expectedtummy tuck lip', 'go', 'go smooth', 'go smooth expect', 'go smooth expect recovery', 'go smooth expect recovery painful', 'go smooth expect recovery painful expectedtummy', 'go smooth expect recovery painful expectedtummy tuck', 'go smooth expect recovery painful expectedtummy tuck lip', 'smooth', 'smooth expect', 'smooth expect recovery', 'smooth expect recovery painful', 'smooth expect recovery painful expectedtummy', 'smooth expect recovery painful expectedtummy tuck', 'smooth expect recovery painful expectedtummy tuck lip', 'expect', 'expect recovery', 'expect recovery painful', 'expect recovery painful expectedtummy', 'expect recovery painful expectedtummy tuck', 'expect recovery painful expectedtummy tuck lip', 'recovery', 'recovery painful', 'recovery painful expectedtummy', 'recovery painful expectedtummy tuck', 'recovery painful expectedtummy tuck lip', 'painful', 'painful expectedtummy', 'painful expectedtummy tuck', 'painful expectedtummy tuck lip', 'expectedtummy', 'expectedtummy tuck', 'expectedtummy tuck lip', 'tuck', 'tuck lip', 'lip']",0,0,0,1,0.0392156862745098
127918,"His memory of my ongoing back trouble, coupled with his pleasant manner always impresses me.",0,memory go trouble couple pleasant manner impress,"['memory', 'memory go', 'memory go trouble', 'memory go trouble couple', 'memory go trouble couple pleasant', 'memory go trouble couple pleasant manner', 'memory go trouble couple pleasant manner impress', 'go', 'go trouble', 'go trouble couple', 'go trouble couple pleasant', 'go trouble couple pleasant manner', 'go trouble couple pleasant manner impress', 'trouble', 'trouble couple', 'trouble couple pleasant', 'trouble couple pleasant manner', 'trouble couple pleasant manner impress', 'couple', 'couple pleasant', 'couple pleasant manner', 'couple pleasant manner impress', 'pleasant', 'pleasant manner', 'pleasant manner impress', 'manner', 'manner impress', 'impress']",0,1,0,0,0.058823529411764705
125788,The surgery went as expected. ?Looking forward to seeing the final results.,0,surgery go expect look forward see final result,"['surgery', 'surgery go', 'surgery go expect', 'surgery go expect look', 'surgery go expect look forward', 'surgery go expect look forward see', 'surgery go expect look forward see final', 'surgery go expect look forward see final result', 'go', 'go expect', 'go expect look', 'go expect look forward', 'go expect look forward see', 'go expect look forward see final', 'go expect look forward see final result', 'expect', 'expect look', 'expect look forward', 'expect look forward see', 'expect look forward see final', 'expect look forward see final result', 'look', 'look forward', 'look forward see', 'look forward see final', 'look forward see final result', 'forward', 'forward see', 'forward see final', 'forward see final result', 'see', 'see final', 'see final result', 'final', 'final result', 'result']",0,0,0,1,0.047619047619047616
88878,"My total experience with the office has been professional, pleasant, comfortable",0,total experience office professional pleasant comfortable,"['total', 'total experience', 'total experience office', 'total experience office professional', 'total experience office professional pleasant', 'total experience office professional pleasant comfortable', 'experience', 'experience office', 'experience office professional', 'experience office professional pleasant', 'experience office professional pleasant comfortable', 'office', 'office professional', 'office professional pleasant', 'office professional pleasant comfortable', 'professional', 'professional pleasant', 'professional pleasant comfortable', 'pleasant', 'pleasant comfortable', 'comfortable']",0,1,0,0,0.07407407407407407
176195,"The whole experience was unnecessary and pretty insulting, I was also expecting some degree of confidentiality",1,experience unnecessary pretty diss expect degree confidentially,"['experience', 'experience unnecessary', 'experience unnecessary pretty', 'experience unnecessary pretty diss', 'experience unnecessary pretty diss expect', 'experience unnecessary pretty diss expect degree', 'experience unnecessary pretty diss expect degree confidentially', 'unnecessary', 'unnecessary pretty', 'unnecessary pretty diss', 'unnecessary pretty diss expect', 'unnecessary pretty diss expect degree', 'unnecessary pretty diss expect degree confidentially', 'pretty', 'pretty diss', 'pretty diss expect', 'pretty diss expect degree', 'pretty diss expect degree confidentially', 'diss', 'diss expect', 'diss expect degree', 'diss expect degree confidentially', 'expect', 'expect degree', 'expect degree confidentially', 'degree', 'degree confidentially', 'confidentially']",0,0,0,1,0.058823529411764705
131940,Dr. Rodriguez and all of his office staff/assistants/nurses were all so pleasant,0,rodriguez office staffassistantsnurses pleasant,"['rodriguez', 'rodriguez office', 'rodriguez office staffassistantsnurses', 'rodriguez office staffassistantsnurses pleasant', 'office', 'office staffassistantsnurses', 'office staffassistantsnurses pleasant', 'staffassistantsnurses', 'staffassistantsnurses pleasant', 'pleasant']",0,1,0,0,0.125
105540,I am very excited about the new life that awaits me and am grateful to NYBG for giving me that start.,0,excite new life expect grateful nag give start,"['excite', 'excite new', 'excite new life', 'excite new life expect', 'excite new life expect grateful', 'excite new life expect grateful nag', 'excite new life expect grateful nag give', 'excite new life expect grateful nag give start', 'new', 'new life', 'new life expect', 'new life expect grateful', 'new life expect grateful nag', 'new life expect grateful nag give', 'new life expect grateful nag give start', 'life', 'life expect', 'life expect grateful', 'life expect grateful nag', 'life expect grateful nag give', 'life expect grateful nag give start', 'expect', 'expect grateful', 'expect grateful nag', 'expect grateful nag give', 'expect grateful nag give start', 'grateful', 'grateful nag', 'grateful nag give', 'grateful nag give start', 'nag', 'nag give', 'nag give start', 'give', 'give start', 'start']",0,0,0,1,0.047619047619047616
70766,After failed attempts with other fertility doctors I am excited to say my wife and I are expecting twins after working with Dr. K.,0,fail attempt fertility doctor excite wife expect twin work,"['fail', 'fail attempt', 'fail attempt fertility', 'fail attempt fertility doctor', 'fail attempt fertility doctor excite', 'fail attempt fertility doctor excite wife', 'fail attempt fertility doctor excite wife expect', 'fail attempt fertility doctor excite wife expect twin', 'fail attempt fertility doctor excite wife expect twin work', 'attempt', 'attempt fertility', 'attempt fertility doctor', 'attempt fertility doctor excite', 'attempt fertility doctor excite wife', 'attempt fertility doctor excite wife expect', 'attempt fertility doctor excite wife expect twin', 'attempt fertility doctor excite wife expect twin work', 'fertility', 'fertility doctor', 'fertility doctor excite', 'fertility doctor excite wife', 'fertility doctor excite wife expect', 'fertility doctor excite wife expect twin', 'fertility doctor excite wife expect twin work', 'doctor', 'doctor excite', 'doctor excite wife', 'doctor excite wife expect', 'doctor excite wife expect twin', 'doctor excite wife expect twin work', 'excite', 'excite wife', 'excite wife expect', 'excite wife expect twin', 'excite wife expect twin work', 'wife', 'wife expect', 'wife expect twin', 'wife expect twin work', 'expect', 'expect twin', 'expect twin work', 'twin', 'twin work', 'work']",0,0,0,1,0.0392156862745098
170873,I was told what to expect and how long it would take on the upfront.,0,tell expect long,"['tell', 'tell expect', 'tell expect long', 'expect', 'expect long', 'long']",0,0,0,1,0.16666666666666666
62785,"He's very thorough, pleasant.",0,thorough pleasant,"['thorough', 'thorough pleasant', 'pleasant']",0,1,0,0,0.2222222222222222
131721,and are not pleasant but the staff in Pearland has made my visit a great.,0,not pleasant staff zealand visit great,"['not', 'not pleasant', 'not pleasant staff', 'not pleasant staff zealand', 'not pleasant staff zealand visit', 'not pleasant staff zealand visit great', 'pleasant', 'pleasant staff', 'pleasant staff zealand', 'pleasant staff zealand visit', 'pleasant staff zealand visit great', 'staff', 'staff zealand', 'staff zealand visit', 'staff zealand visit great', 'zealand', 'zealand visit', 'zealand visit great', 'visit', 'visit great', 'great']",0,1,0,0,0.07407407407407407
113833,These people are so great and pleasant to deal with!,0,people great pleasant deal,"['people', 'people great', 'people great pleasant', 'people great pleasant deal', 'great', 'great pleasant', 'great pleasant deal', 'pleasant', 'pleasant deal', 'deal']",0,1,0,0,0.125
62786,She's always pleasant,0,pleasant,['pleasant'],0,1,0,0,0.2857142857142857
125874,he was very pleasant yet I felt rushed and he dis not fake time to go into detail or give me a Exact diagnosis.,1,pleasant feel rush dis not face time detail exact diagnosis,"['pleasant', 'pleasant feel', 'pleasant feel rush', 'pleasant feel rush dis', 'pleasant feel rush dis not', 'pleasant feel rush dis not face', 'pleasant feel rush dis not face time', 'pleasant feel rush dis not face time detail', 'pleasant feel rush dis not face time detail exact', 'pleasant feel rush dis not face time detail exact diagnosis', 'feel', 'feel rush', 'feel rush dis', 'feel rush dis not', 'feel rush dis not face', 'feel rush dis not face time', 'feel rush dis not face time detail', 'feel rush dis not face time detail exact', 'feel rush dis not face time detail exact diagnosis', 'rush', 'rush dis', 'rush dis not', 'rush dis not face', 'rush dis not face time', 'rush dis not face time detail', 'rush dis not face time detail exact', 'rush dis not face time detail exact diagnosis', 'dis', 'dis not', 'dis not face', 'dis not face time', 'dis not face time detail', 'dis not face time detail exact', 'dis not face time detail exact diagnosis', 'not', 'not face', 'not face time', 'not face time detail', 'not face time detail exact', 'not face time detail exact diagnosis', 'face', 'face time', 'face time detail', 'face time detail exact', 'face time detail exact diagnosis', 'time', 'time detail', 'time detail exact', 'time detail exact diagnosis', 'detail', 'detail exact', 'detail exact diagnosis', 'exact', 'exact diagnosis', 'diagnosis']",0,1,0,0,0.03278688524590164
104027,I had a very pleasant experience with Dr. Yung.,0,pleasant experience,"['pleasant', 'pleasant experience', 'experience']",0,1,0,0,0.2222222222222222
128707,There was so much information given to me before surgery and what to expect during recovery.,0,information give surgery expect recovery,"['information', 'information give', 'information give surgery', 'information give surgery expect', 'information give surgery expect recovery', 'give', 'give surgery', 'give surgery expect', 'give surgery expect recovery', 'surgery', 'surgery expect', 'surgery expect recovery', 'expect', 'expect recovery', 'recovery']",0,0,0,1,0.09523809523809523
184370,I expected more positive engagement for procedures that I assumed would require me paying him $1000's. - after the visit,1,expect positive engagement procedure assume require pay visit,"['expect', 'expect positive', 'expect positive engagement', 'expect positive engagement procedure', 'expect positive engagement procedure assume', 'expect positive engagement procedure assume require', 'expect positive engagement procedure assume require pay', 'expect positive engagement procedure assume require pay visit', 'positive', 'positive engagement', 'positive engagement procedure', 'positive engagement procedure assume', 'positive engagement procedure assume require', 'positive engagement procedure assume require pay', 'positive engagement procedure assume require pay visit', 'engagement', 'engagement procedure', 'engagement procedure assume', 'engagement procedure assume require', 'engagement procedure assume require pay', 'engagement procedure assume require pay visit', 'procedure', 'procedure assume', 'procedure assume require', 'procedure assume require pay', 'procedure assume require pay visit', 'assume', 'assume require', 'assume require pay', 'assume require pay visit', 'require', 'require pay', 'require pay visit', 'pay', 'pay visit', 'visit']",0,0,0,1,0.047619047619047616
162552,What to expect within the next few weeks with your improvement.,0,expect improvement,"['expect', 'expect improvement', 'improvement']",0,0,0,1,0.2222222222222222
101800,Staff very efficient pleasant healpful doctor very knowledgeable great bedside manor explains thing very well.,0,staff efficient pleasant helpful knowledgeable great bedside manor explain thing,"['staff', 'staff efficient', 'staff efficient pleasant', 'staff efficient pleasant helpful', 'staff efficient pleasant helpful knowledgeable', 'staff efficient pleasant helpful knowledgeable great', 'staff efficient pleasant helpful knowledgeable great bedside', 'staff efficient pleasant helpful knowledgeable great bedside manor', 'staff efficient pleasant helpful knowledgeable great bedside manor explain', 'staff efficient pleasant helpful knowledgeable great bedside manor explain thing', 'efficient', 'efficient pleasant', 'efficient pleasant helpful', 'efficient pleasant helpful knowledgeable', 'efficient pleasant helpful knowledgeable great', 'efficient pleasant helpful knowledgeable great bedside', 'efficient pleasant helpful knowledgeable great bedside manor', 'efficient pleasant helpful knowledgeable great bedside manor explain', 'efficient pleasant helpful knowledgeable great bedside manor explain thing', 'pleasant', 'pleasant helpful', 'pleasant helpful knowledgeable', 'pleasant helpful knowledgeable great', 'pleasant helpful knowledgeable great bedside', 'pleasant helpful knowledgeable great bedside manor', 'pleasant helpful knowledgeable great bedside manor explain', 'pleasant helpful knowledgeable great bedside manor explain thing', 'helpful', 'helpful knowledgeable', 'helpful knowledgeable great', 'helpful knowledgeable great bedside', 'helpful knowledgeable great bedside manor', 'helpful knowledgeable great bedside manor explain', 'helpful knowledgeable great bedside manor explain thing', 'knowledgeable', 'knowledgeable great', 'knowledgeable great bedside', 'knowledgeable great bedside manor', 'knowledgeable great bedside manor explain', 'knowledgeable great bedside manor explain thing', 'great', 'great bedside', 'great bedside manor', 'great bedside manor explain', 'great bedside manor explain thing', 'bedside', 'bedside manor', 'bedside manor explain', 'bedside manor explain thing', 'manor', 'manor explain', 'manor explain thing', 'explain', 'explain thing', 'thing']",0,1,0,0,0.03278688524590164
69155,I still have 25 percent reduction in swelling expected (which is normal)and am excited to see the final results.,0,percentage reduction swell expect normaland excite final result,"['percentage', 'percentage reduction', 'percentage reduction swell', 'percentage reduction swell expect', 'percentage reduction swell expect normaland', 'percentage reduction swell expect normaland excite', 'percentage reduction swell expect normaland excite final', 'percentage reduction swell expect normaland excite final result', 'reduction', 'reduction swell', 'reduction swell expect', 'reduction swell expect normaland', 'reduction swell expect normaland excite', 'reduction swell expect normaland excite final', 'reduction swell expect normaland excite final result', 'swell', 'swell expect', 'swell expect normaland', 'swell expect normaland excite', 'swell expect normaland excite final', 'swell expect normaland excite final result', 'expect', 'expect normaland', 'expect normaland excite', 'expect normaland excite final', 'expect normaland excite final result', 'normaland', 'normaland excite', 'normaland excite final', 'normaland excite final result', 'excite', 'excite final', 'excite final result', 'final', 'final result', 'result']",0,0,0,1,0.047619047619047616
135513,"He preps patients will with a calendar of medications, what to expect each day pre",0,press patient calendar meditation expect pre,"['press', 'press patient', 'press patient calendar', 'press patient calendar meditation', 'press patient calendar meditation expect', 'press patient calendar meditation expect pre', 'patient', 'patient calendar', 'patient calendar meditation', 'patient calendar meditation expect', 'patient calendar meditation expect pre', 'calendar', 'calendar meditation', 'calendar meditation expect', 'calendar meditation expect pre', 'meditation', 'meditation expect', 'meditation expect pre', 'expect', 'expect pre', 'pre']",0,0,0,1,0.07407407407407407
77196,"my experience with this office, short as it was, was less than pleasant.",1,experience office short pleasant,"['experience', 'experience office', 'experience office short', 'experience office short pleasant', 'office', 'office short', 'office short pleasant', 'short', 'short pleasant', 'pleasant']",0,1,0,0,0.125
167697,"I should've expected it though, my entire situation with my nose for almost a decade has been a nightmare.",1,expect entire situation nose nightmare,"['expect', 'expect entire', 'expect entire situation', 'expect entire situation nose', 'expect entire situation nose nightmare', 'entire', 'entire situation', 'entire situation nose', 'entire situation nose nightmare', 'situation', 'situation nose', 'situation nose nightmare', 'nose', 'nose nightmare', 'nightmare']",0,0,0,1,0.09523809523809523
188755,And once you do get into the office for an appointment expect to sit in the lobby,1,office appointment expect sit lobby,"['office', 'office appointment', 'office appointment expect', 'office appointment expect sit', 'office appointment expect sit lobby', 'appointment', 'appointment expect', 'appointment expect sit', 'appointment expect sit lobby', 'expect', 'expect sit', 'expect sit lobby', 'sit', 'sit lobby', 'lobby']",0,0,0,1,0.09523809523809523
93848,"the clinic Dr. Bazell had carried two plastic surgery of the face, the effect is amazing, better than I expected.",0,clinic ball carry plastic surgery face effect amaze good expect,"['clinic', 'clinic ball', 'clinic ball carry', 'clinic ball carry plastic', 'clinic ball carry plastic surgery', 'clinic ball carry plastic surgery face', 'clinic ball carry plastic surgery face effect', 'clinic ball carry plastic surgery face effect amaze', 'clinic ball carry plastic surgery face effect amaze good', 'clinic ball carry plastic surgery face effect amaze good expect', 'ball', 'ball carry', 'ball carry plastic', 'ball carry plastic surgery', 'ball carry plastic surgery face', 'ball carry plastic surgery face effect', 'ball carry plastic surgery face effect amaze', 'ball carry plastic surgery face effect amaze good', 'ball carry plastic surgery face effect amaze good expect', 'carry', 'carry plastic', 'carry plastic surgery', 'carry plastic surgery face', 'carry plastic surgery face effect', 'carry plastic surgery face effect amaze', 'carry plastic surgery face effect amaze good', 'carry plastic surgery face effect amaze good expect', 'plastic', 'plastic surgery', 'plastic surgery face', 'plastic surgery face effect', 'plastic surgery face effect amaze', 'plastic surgery face effect amaze good', 'plastic surgery face effect amaze good expect', 'surgery', 'surgery face', 'surgery face effect', 'surgery face effect amaze', 'surgery face effect amaze good', 'surgery face effect amaze good expect', 'face', 'face effect', 'face effect amaze', 'face effect amaze good', 'face effect amaze good expect', 'effect', 'effect amaze', 'effect amaze good', 'effect amaze good expect', 'amaze', 'amaze good', 'amaze good expect', 'good', 'good expect', 'expect']",0,0,0,1,0.03278688524590164
169276,When I called the office the team was very pleasant.,0,call office team pleasant,"['call', 'call office', 'call office team', 'call office team pleasant', 'office', 'office team', 'office team pleasant', 'team', 'team pleasant', 'pleasant']",0,1,0,0,0.125
140021,The front desk girls and the medical assistant are so pleasant.,0,desk girl medical assistant pleasant,"['desk', 'desk girl', 'desk girl medical', 'desk girl medical assistant', 'desk girl medical assistant pleasant', 'girl', 'girl medical', 'girl medical assistant', 'girl medical assistant pleasant', 'medical', 'medical assistant', 'medical assistant pleasant', 'assistant', 'assistant pleasant', 'pleasant']",0,1,0,0,0.09523809523809523
