commentId,comment,classification,comment_processed,word_phrase_list,ultrasound,pleasant,pleasant expect,expect,similarity_score
91410,"Unfortunately, I expect a professional health-care office be able to provide accurate insurance information to patients.",1,unfortunately expect professional healthcare office able provide accurate insurance information patient,"['unfortunately', 'unfortunately expect', 'unfortunately expect professional', 'unfortunately expect professional healthcare', 'unfortunately expect professional healthcare office', 'unfortunately expect professional healthcare office able', 'unfortunately expect professional healthcare office able provide', 'unfortunately expect professional healthcare office able provide accurate', 'unfortunately expect professional healthcare office able provide accurate insurance', 'unfortunately expect professional healthcare office able provide accurate insurance information', 'unfortunately expect professional healthcare office able provide accurate insurance information patient', 'expect', 'expect professional', 'expect professional healthcare', 'expect professional healthcare office', 'expect professional healthcare office able', 'expect professional healthcare office able provide', 'expect professional healthcare office able provide accurate', 'expect professional healthcare office able provide accurate insurance', 'expect professional healthcare office able provide accurate insurance information', 'expect professional healthcare office able provide accurate insurance information patient', 'professional', 'professional healthcare', 'professional healthcare office', 'professional healthcare office able', 'professional healthcare office able provide', 'professional healthcare office able provide accurate', 'professional healthcare office able provide accurate insurance', 'professional healthcare office able provide accurate insurance information', 'professional healthcare office able provide accurate insurance information patient', 'healthcare', 'healthcare office', 'healthcare office able', 'healthcare office able provide', 'healthcare office able provide accurate', 'healthcare office able provide accurate insurance', 'healthcare office able provide accurate insurance information', 'healthcare office able provide accurate insurance information patient', 'office', 'office able', 'office able provide', 'office able provide accurate', 'office able provide accurate insurance', 'office able provide accurate insurance information', 'office able provide accurate insurance information patient', 'able', 'able provide', 'able provide accurate', 'able provide accurate insurance', 'able provide accurate insurance information', 'able provide accurate insurance information patient', 'provide', 'provide accurate', 'provide accurate insurance', 'provide accurate insurance information', 'provide accurate insurance information patient', 'accurate', 'accurate insurance', 'accurate insurance information', 'accurate insurance information patient', 'insurance', 'insurance information', 'insurance information patient', 'information', 'information patient', 'patient']",0,0,0,1,0.027777777777777776
62568,It was very pleasant,0,pleasant,['pleasant'],0,1,0,0,0.2857142857142857
94478,His medical assistant (Chisty) made the experience a pleasant one.,0,medical assistant city experience pleasant,"['medical', 'medical assistant', 'medical assistant city', 'medical assistant city experience', 'medical assistant city experience pleasant', 'assistant', 'assistant city', 'assistant city experience', 'assistant city experience pleasant', 'city', 'city experience', 'city experience pleasant', 'experience', 'experience pleasant', 'pleasant']",0,1,0,0,0.09523809523809523
66728,His pleasant attitude,0,pleasant attitude,"['pleasant', 'pleasant attitude', 'attitude']",0,1,0,0,0.2222222222222222
125403,but also stays realistic with what can be expected.,0,stay realistic expect,"['stay', 'stay realistic', 'stay realistic expect', 'realistic', 'realistic expect', 'expect']",0,0,0,1,0.16666666666666666
128349,"I now feel great-there are days here and there that I have some pain but, that was to be expected and is tolerable.",0,feel greatthere day pain expect tolerable,"['feel', 'feel greatthere', 'feel greatthere day', 'feel greatthere day pain', 'feel greatthere day pain expect', 'feel greatthere day pain expect tolerable', 'greatthere', 'greatthere day', 'greatthere day pain', 'greatthere day pain expect', 'greatthere day pain expect tolerable', 'day', 'day pain', 'day pain expect', 'day pain expect tolerable', 'pain', 'pain expect', 'pain expect tolerable', 'expect', 'expect tolerable', 'tolerable']",0,0,0,1,0.07407407407407407
130446,The staff is always so pleasant in person and by phone.,0,staff pleasant person phone,"['staff', 'staff pleasant', 'staff pleasant person', 'staff pleasant person phone', 'pleasant', 'pleasant person', 'pleasant person phone', 'person', 'person phone', 'phone']",0,1,0,0,0.125
65479,"Pleasant, straight to the point and informative.",0,pleasant straight point information,"['pleasant', 'pleasant straight', 'pleasant straight point', 'pleasant straight point information', 'straight', 'straight point', 'straight point information', 'point', 'point information', 'information']",0,1,0,0,0.125
178441,Post-surgery Dr. Bonasso met with me on a daily basis and again was very informative about what to expect during my recovery.,0,postsurgery meet basis information expect recovery,"['postsurgery', 'postsurgery meet', 'postsurgery meet basis', 'postsurgery meet basis information', 'postsurgery meet basis information expect', 'postsurgery meet basis information expect recovery', 'meet', 'meet basis', 'meet basis information', 'meet basis information expect', 'meet basis information expect recovery', 'basis', 'basis information', 'basis information expect', 'basis information expect recovery', 'information', 'information expect', 'information expect recovery', 'expect', 'expect recovery', 'recovery']",0,0,0,1,0.07407407407407407
147289,"She is not pleasant first of all, I can right away read her (",1,not pleasant right away read,"['not', 'not pleasant', 'not pleasant right', 'not pleasant right away', 'not pleasant right away read', 'pleasant', 'pleasant right', 'pleasant right away', 'pleasant right away read', 'right', 'right away', 'right away read', 'away', 'away read', 'read']",0,1,0,0,0.09523809523809523
61536,She was pleasant,0,pleasant,['pleasant'],0,1,0,0,0.2857142857142857
177791,I expected lasik to be a painless simple easy process like some may say but that is false it's scary and risky.,1,expect painless simple easy process like false scar risky,"['expect', 'expect painless', 'expect painless simple', 'expect painless simple easy', 'expect painless simple easy process', 'expect painless simple easy process like', 'expect painless simple easy process like false', 'expect painless simple easy process like false scar', 'expect painless simple easy process like false scar risky', 'painless', 'painless simple', 'painless simple easy', 'painless simple easy process', 'painless simple easy process like', 'painless simple easy process like false', 'painless simple easy process like false scar', 'painless simple easy process like false scar risky', 'simple', 'simple easy', 'simple easy process', 'simple easy process like', 'simple easy process like false', 'simple easy process like false scar', 'simple easy process like false scar risky', 'easy', 'easy process', 'easy process like', 'easy process like false', 'easy process like false scar', 'easy process like false scar risky', 'process', 'process like', 'process like false', 'process like false scar', 'process like false scar risky', 'like', 'like false', 'like false scar', 'like false scar risky', 'false', 'false scar', 'false scar risky', 'scar', 'scar risky', 'risky']",0,0,0,1,0.0392156862745098
155425,You helped to make my recent visit more pleasant.,0,help recent visit pleasant,"['help', 'help recent', 'help recent visit', 'help recent visit pleasant', 'recent', 'recent visit', 'recent visit pleasant', 'visit', 'visit pleasant', 'pleasant']",0,1,0,0,0.125
149101,"I was extremely nervous as I awaited surgery,",1,extremely nervous expect surgery,"['extremely', 'extremely nervous', 'extremely nervous expect', 'extremely nervous expect surgery', 'nervous', 'nervous expect', 'nervous expect surgery', 'expect', 'expect surgery', 'surgery']",0,0,0,1,0.125
187901,"so pleasant, and so efficient calling me back and rescheduling me!!",0,pleasant efficient call reschedule,"['pleasant', 'pleasant efficient', 'pleasant efficient call', 'pleasant efficient call reschedule', 'efficient', 'efficient call', 'efficient call reschedule', 'call', 'call reschedule', 'reschedule']",0,1,0,0,0.125
90583,We had our consultation and it was as great as I expected based off Dr. Gartner's reviews.,0,consultation great expect base partner review,"['consultation', 'consultation great', 'consultation great expect', 'consultation great expect base', 'consultation great expect base partner', 'consultation great expect base partner review', 'great', 'great expect', 'great expect base', 'great expect base partner', 'great expect base partner review', 'expect', 'expect base', 'expect base partner', 'expect base partner review', 'base', 'base partner', 'base partner review', 'partner', 'partner review', 'review']",0,0,0,1,0.07407407407407407
148887,and he explained to me beforehand what I should expect for the healing process.,0,explain expect heal process,"['explain', 'explain expect', 'explain expect heal', 'explain expect heal process', 'expect', 'expect heal', 'expect heal process', 'heal', 'heal process', 'process']",0,0,0,1,0.125
89925,Pleasant first time experience after many years of not visiting a dermatologist.,0,pleasant time experience year not visit dermatologist,"['pleasant', 'pleasant time', 'pleasant time experience', 'pleasant time experience year', 'pleasant time experience year not', 'pleasant time experience year not visit', 'pleasant time experience year not visit dermatologist', 'time', 'time experience', 'time experience year', 'time experience year not', 'time experience year not visit', 'time experience year not visit dermatologist', 'experience', 'experience year', 'experience year not', 'experience year not visit', 'experience year not visit dermatologist', 'year', 'year not', 'year not visit', 'year not visit dermatologist', 'not', 'not visit', 'not visit dermatologist', 'visit', 'visit dermatologist', 'dermatologist']",0,1,0,0,0.058823529411764705
117644,"It wasn?t a pleasant procedure,",1,pleasant procedure,"['pleasant', 'pleasant procedure', 'procedure']",0,1,0,0,0.2222222222222222
107953,"In fact, her behavior was very unprofessional and not at all what I would expect at a nice medical facility like this.",1,fact behavior professional not expect nice medical facility like,"['fact', 'fact behavior', 'fact behavior professional', 'fact behavior professional not', 'fact behavior professional not expect', 'fact behavior professional not expect nice', 'fact behavior professional not expect nice medical', 'fact behavior professional not expect nice medical facility', 'fact behavior professional not expect nice medical facility like', 'behavior', 'behavior professional', 'behavior professional not', 'behavior professional not expect', 'behavior professional not expect nice', 'behavior professional not expect nice medical', 'behavior professional not expect nice medical facility', 'behavior professional not expect nice medical facility like', 'professional', 'professional not', 'professional not expect', 'professional not expect nice', 'professional not expect nice medical', 'professional not expect nice medical facility', 'professional not expect nice medical facility like', 'not', 'not expect', 'not expect nice', 'not expect nice medical', 'not expect nice medical facility', 'not expect nice medical facility like', 'expect', 'expect nice', 'expect nice medical', 'expect nice medical facility', 'expect nice medical facility like', 'nice', 'nice medical', 'nice medical facility', 'nice medical facility like', 'medical', 'medical facility', 'medical facility like', 'facility', 'facility like', 'like']",0,0,0,1,0.0392156862745098
67831,Everything was far beyond what I ever expected from a surgeon.,0,far expect surgeon,"['far', 'far expect', 'far expect surgeon', 'expect', 'expect surgeon', 'surgeon']",0,0,0,1,0.16666666666666666
126603,I have had many ultrasounds this pregnancy and have never had a technician as concerned as she was.,0,ultrasound pregnancy technical concerned,"['ultrasound', 'ultrasound pregnancy', 'ultrasound pregnancy technical', 'ultrasound pregnancy technical concerned', 'pregnancy', 'pregnancy technical', 'pregnancy technical concerned', 'technical', 'technical concerned', 'concerned']",1,0,0,0,0.125
65756,They were pleasant,0,pleasant,['pleasant'],0,1,0,0,0.2857142857142857
141203,"and the response seems to be along the lines of ""we always tell patients to expect to be here for at least 2 hours"".",1,response line tell patient expect,"['response', 'response line', 'response line tell', 'response line tell patient', 'response line tell patient expect', 'line', 'line tell', 'line tell patient', 'line tell patient expect', 'tell', 'tell patient', 'tell patient expect', 'patient', 'patient expect', 'expect']",0,0,0,1,0.09523809523809523
82197,and sympathy are not expect to be found there when something goes wrong,1,sympathy not expect find go wrong,"['sympathy', 'sympathy not', 'sympathy not expect', 'sympathy not expect find', 'sympathy not expect find go', 'sympathy not expect find go wrong', 'not', 'not expect', 'not expect find', 'not expect find go', 'not expect find go wrong', 'expect', 'expect find', 'expect find go', 'expect find go wrong', 'find', 'find go', 'find go wrong', 'go', 'go wrong', 'wrong']",0,0,0,1,0.07407407407407407
147683,My husband and I left every appointment feeling like we had a full understanding of what was going on and what to expect next.,0,husband leave appointment feel like understanding go expect,"['husband', 'husband leave', 'husband leave appointment', 'husband leave appointment feel', 'husband leave appointment feel like', 'husband leave appointment feel like understanding', 'husband leave appointment feel like understanding go', 'husband leave appointment feel like understanding go expect', 'leave', 'leave appointment', 'leave appointment feel', 'leave appointment feel like', 'leave appointment feel like understanding', 'leave appointment feel like understanding go', 'leave appointment feel like understanding go expect', 'appointment', 'appointment feel', 'appointment feel like', 'appointment feel like understanding', 'appointment feel like understanding go', 'appointment feel like understanding go expect', 'feel', 'feel like', 'feel like understanding', 'feel like understanding go', 'feel like understanding go expect', 'like', 'like understanding', 'like understanding go', 'like understanding go expect', 'understanding', 'understanding go', 'understanding go expect', 'go', 'go expect', 'expect']",0,0,0,1,0.047619047619047616
101095,"The injections didn't hurt one bit, and NO bruising, which I was expecting.",0,injection hurt bit no bruise expect,"['injection', 'injection hurt', 'injection hurt bit', 'injection hurt bit no', 'injection hurt bit no bruise', 'injection hurt bit no bruise expect', 'hurt', 'hurt bit', 'hurt bit no', 'hurt bit no bruise', 'hurt bit no bruise expect', 'bit', 'bit no', 'bit no bruise', 'bit no bruise expect', 'no', 'no bruise', 'no bruise expect', 'bruise', 'bruise expect', 'expect']",0,0,0,1,0.07407407407407407
184021,"What I didn't expect was the professionalism and adeptness of her staff, from reception staff like Alex (which is too light a term",0,expect professionalism alertness staff reception staff like light term,"['expect', 'expect professionalism', 'expect professionalism alertness', 'expect professionalism alertness staff', 'expect professionalism alertness staff reception', 'expect professionalism alertness staff reception staff', 'expect professionalism alertness staff reception staff like', 'expect professionalism alertness staff reception staff like light', 'expect professionalism alertness staff reception staff like light term', 'professionalism', 'professionalism alertness', 'professionalism alertness staff', 'professionalism alertness staff reception', 'professionalism alertness staff reception staff', 'professionalism alertness staff reception staff like', 'professionalism alertness staff reception staff like light', 'professionalism alertness staff reception staff like light term', 'alertness', 'alertness staff', 'alertness staff reception', 'alertness staff reception staff', 'alertness staff reception staff like', 'alertness staff reception staff like light', 'alertness staff reception staff like light term', 'staff', 'staff reception', 'staff reception staff', 'staff reception staff like', 'staff reception staff like light', 'staff reception staff like light term', 'reception', 'reception staff', 'reception staff like', 'reception staff like light', 'reception staff like light term', 'staff', 'staff like', 'staff like light', 'staff like light term', 'like', 'like light', 'like light term', 'light', 'light term', 'term']",0,0,0,1,0.0392156862745098
113359,You are greeted by a pleasant staff and taken to a room upon arrival.,0,greet pleasant staff take room arrival,"['greet', 'greet pleasant', 'greet pleasant staff', 'greet pleasant staff take', 'greet pleasant staff take room', 'greet pleasant staff take room arrival', 'pleasant', 'pleasant staff', 'pleasant staff take', 'pleasant staff take room', 'pleasant staff take room arrival', 'staff', 'staff take', 'staff take room', 'staff take room arrival', 'take', 'take room', 'take room arrival', 'room', 'room arrival', 'arrival']",0,1,0,0,0.07407407407407407
65688,She's pleasant,0,pleasant,['pleasant'],0,1,0,0,0.2857142857142857
188350,I was in SEVERE PAIN post op some pain is expected,1,severe pain post op pain expect,"['severe', 'severe pain', 'severe pain post', 'severe pain post op', 'severe pain post op pain', 'severe pain post op pain expect', 'pain', 'pain post', 'pain post op', 'pain post op pain', 'pain post op pain expect', 'post', 'post op', 'post op pain', 'post op pain expect', 'op', 'op pain', 'op pain expect', 'pain', 'pain expect', 'expect']",0,0,0,1,0.07407407407407407
62685,She's very nice and pleasant to talk to,0,nice pleasant talk,"['nice', 'nice pleasant', 'nice pleasant talk', 'pleasant', 'pleasant talk', 'talk']",0,1,0,0,0.16666666666666666
170854,I got the IV drip therapy and it was really a pleasant experience for someone who isn't used to needles.,0,get four drip therapy pleasant experience needle,"['get', 'get four', 'get four drip', 'get four drip therapy', 'get four drip therapy pleasant', 'get four drip therapy pleasant experience', 'get four drip therapy pleasant experience needle', 'four', 'four drip', 'four drip therapy', 'four drip therapy pleasant', 'four drip therapy pleasant experience', 'four drip therapy pleasant experience needle', 'drip', 'drip therapy', 'drip therapy pleasant', 'drip therapy pleasant experience', 'drip therapy pleasant experience needle', 'therapy', 'therapy pleasant', 'therapy pleasant experience', 'therapy pleasant experience needle', 'pleasant', 'pleasant experience', 'pleasant experience needle', 'experience', 'experience needle', 'needle']",0,1,0,0,0.058823529411764705
170904,My bill is far more than I was expecting.,1,bill far expect,"['bill', 'bill far', 'bill far expect', 'far', 'far expect', 'expect']",0,0,0,1,0.16666666666666666
104157,"It was a very pleasant, informative 40 minute visit.",0,pleasant information minute visit,"['pleasant', 'pleasant information', 'pleasant information minute', 'pleasant information minute visit', 'information', 'information minute', 'information minute visit', 'minute', 'minute visit', 'visit']",0,1,0,0,0.125
83631,Bertha was exceptional in helping explain the different elements of the ultrasound,0,berth exceptional help explain different element ultrasound,"['berth', 'berth exceptional', 'berth exceptional help', 'berth exceptional help explain', 'berth exceptional help explain different', 'berth exceptional help explain different element', 'berth exceptional help explain different element ultrasound', 'exceptional', 'exceptional help', 'exceptional help explain', 'exceptional help explain different', 'exceptional help explain different element', 'exceptional help explain different element ultrasound', 'help', 'help explain', 'help explain different', 'help explain different element', 'help explain different element ultrasound', 'explain', 'explain different', 'explain different element', 'explain different element ultrasound', 'different', 'different element', 'different element ultrasound', 'element', 'element ultrasound', 'ultrasound']",1,0,0,0,0.058823529411764705
90982,"I had a pleasant experience with him and his office staff,",0,pleasant experience office staff,"['pleasant', 'pleasant experience', 'pleasant experience office', 'pleasant experience office staff', 'experience', 'experience office', 'experience office staff', 'office', 'office staff', 'staff']",0,1,0,0,0.125
101565,I was very anxious about the procedure and she was kind and thorough in explaining what to expect.,0,anxious procedure kind thorough explain expect,"['anxious', 'anxious procedure', 'anxious procedure kind', 'anxious procedure kind thorough', 'anxious procedure kind thorough explain', 'anxious procedure kind thorough explain expect', 'procedure', 'procedure kind', 'procedure kind thorough', 'procedure kind thorough explain', 'procedure kind thorough explain expect', 'kind', 'kind thorough', 'kind thorough explain', 'kind thorough explain expect', 'thorough', 'thorough explain', 'thorough explain expect', 'explain', 'explain expect', 'expect']",0,0,0,1,0.07407407407407407
151689,"He and his staff will tell you exactly what to do, what to expect, and check in with you all along the way.",0,staff tell precisely expect check way,"['staff', 'staff tell', 'staff tell precisely', 'staff tell precisely expect', 'staff tell precisely expect check', 'staff tell precisely expect check way', 'tell', 'tell precisely', 'tell precisely expect', 'tell precisely expect check', 'tell precisely expect check way', 'precisely', 'precisely expect', 'precisely expect check', 'precisely expect check way', 'expect', 'expect check', 'expect check way', 'check', 'check way', 'way']",0,0,0,1,0.07407407407407407
102731,"Post operation went great, little tenderness and slightly swollen (as should be expected).",0,post operation go great little tenderness slightly swell expect,"['post', 'post operation', 'post operation go', 'post operation go great', 'post operation go great little', 'post operation go great little tenderness', 'post operation go great little tenderness slightly', 'post operation go great little tenderness slightly swell', 'post operation go great little tenderness slightly swell expect', 'operation', 'operation go', 'operation go great', 'operation go great little', 'operation go great little tenderness', 'operation go great little tenderness slightly', 'operation go great little tenderness slightly swell', 'operation go great little tenderness slightly swell expect', 'go', 'go great', 'go great little', 'go great little tenderness', 'go great little tenderness slightly', 'go great little tenderness slightly swell', 'go great little tenderness slightly swell expect', 'great', 'great little', 'great little tenderness', 'great little tenderness slightly', 'great little tenderness slightly swell', 'great little tenderness slightly swell expect', 'little', 'little tenderness', 'little tenderness slightly', 'little tenderness slightly swell', 'little tenderness slightly swell expect', 'tenderness', 'tenderness slightly', 'tenderness slightly swell', 'tenderness slightly swell expect', 'slightly', 'slightly swell', 'slightly swell expect', 'swell', 'swell expect', 'expect']",0,0,0,1,0.0392156862745098
114356,"the journey to that point was pleasant and easy, thanks to the team's guidance and expertise.",0,journey point pleasant easy thanks tear guidance expertness,"['journey', 'journey point', 'journey point pleasant', 'journey point pleasant easy', 'journey point pleasant easy thanks', 'journey point pleasant easy thanks tear', 'journey point pleasant easy thanks tear guidance', 'journey point pleasant easy thanks tear guidance expertness', 'point', 'point pleasant', 'point pleasant easy', 'point pleasant easy thanks', 'point pleasant easy thanks tear', 'point pleasant easy thanks tear guidance', 'point pleasant easy thanks tear guidance expertness', 'pleasant', 'pleasant easy', 'pleasant easy thanks', 'pleasant easy thanks tear', 'pleasant easy thanks tear guidance', 'pleasant easy thanks tear guidance expertness', 'easy', 'easy thanks', 'easy thanks tear', 'easy thanks tear guidance', 'easy thanks tear guidance expertness', 'thanks', 'thanks tear', 'thanks tear guidance', 'thanks tear guidance expertness', 'tear', 'tear guidance', 'tear guidance expertness', 'guidance', 'guidance expertness', 'expertness']",0,1,0,0,0.047619047619047616
