commentId,comment,classification,comment_processed,word_phrase_list,ultrasound,pleasant,pleasant expect,expect,similarity_score
148077,From the beginning when calling Dr Camp's office through your post ops you can expect nothing less than feeling very comfortable,0,begin call camp office post op expect feel comfortable,"['begin', 'begin call', 'begin call camp', 'begin call camp office', 'begin call camp office post', 'begin call camp office post op', 'begin call camp office post op expect', 'begin call camp office post op expect feel', 'begin call camp office post op expect feel comfortable', 'call', 'call camp', 'call camp office', 'call camp office post', 'call camp office post op', 'call camp office post op expect', 'call camp office post op expect feel', 'call camp office post op expect feel comfortable', 'camp', 'camp office', 'camp office post', 'camp office post op', 'camp office post op expect', 'camp office post op expect feel', 'camp office post op expect feel comfortable', 'office', 'office post', 'office post op', 'office post op expect', 'office post op expect feel', 'office post op expect feel comfortable', 'post', 'post op', 'post op expect', 'post op expect feel', 'post op expect feel comfortable', 'op', 'op expect', 'op expect feel', 'op expect feel comfortable', 'expect', 'expect feel', 'expect feel comfortable', 'feel', 'feel comfortable', 'comfortable']",0,0,0,1,0.0392156862745098
87049,Could not have expected any better.,0,not expect good,"['not', 'not expect', 'not expect good', 'expect', 'expect good', 'good']",0,0,0,1,0.16666666666666666
74115,"Not only were the results I received from my breast lift more then what I expected, his follow up was outstanding.",0,not result receive breast lift expect follow outstanding,"['not', 'not result', 'not result receive', 'not result receive breast', 'not result receive breast lift', 'not result receive breast lift expect', 'not result receive breast lift expect follow', 'not result receive breast lift expect follow outstanding', 'result', 'result receive', 'result receive breast', 'result receive breast lift', 'result receive breast lift expect', 'result receive breast lift expect follow', 'result receive breast lift expect follow outstanding', 'receive', 'receive breast', 'receive breast lift', 'receive breast lift expect', 'receive breast lift expect follow', 'receive breast lift expect follow outstanding', 'breast', 'breast lift', 'breast lift expect', 'breast lift expect follow', 'breast lift expect follow outstanding', 'lift', 'lift expect', 'lift expect follow', 'lift expect follow outstanding', 'expect', 'expect follow', 'expect follow outstanding', 'follow', 'follow outstanding', 'outstanding']",0,0,0,1,0.047619047619047616
150417,He listens to his patients and is very truthful in the results you can expect.,0,listen patient truthful result expect,"['listen', 'listen patient', 'listen patient truthful', 'listen patient truthful result', 'listen patient truthful result expect', 'patient', 'patient truthful', 'patient truthful result', 'patient truthful result expect', 'truthful', 'truthful result', 'truthful result expect', 'result', 'result expect', 'expect']",0,0,0,1,0.09523809523809523
64596,"I was delighted to find that she is efficient, pleasant, she listened and she was sure of herself.",0,delight find efficient pleasant listen sure,"['delight', 'delight find', 'delight find efficient', 'delight find efficient pleasant', 'delight find efficient pleasant listen', 'delight find efficient pleasant listen sure', 'find', 'find efficient', 'find efficient pleasant', 'find efficient pleasant listen', 'find efficient pleasant listen sure', 'efficient', 'efficient pleasant', 'efficient pleasant listen', 'efficient pleasant listen sure', 'pleasant', 'pleasant listen', 'pleasant listen sure', 'listen', 'listen sure', 'sure']",0,1,0,0,0.07407407407407407
180564,"I really wasn't expecting this fabulous of a job TBH,but boy ??",0,expect fabulous job tbhbut boy,"['expect', 'expect fabulous', 'expect fabulous job', 'expect fabulous job tbhbut', 'expect fabulous job tbhbut boy', 'fabulous', 'fabulous job', 'fabulous job tbhbut', 'fabulous job tbhbut boy', 'job', 'job tbhbut', 'job tbhbut boy', 'tbhbut', 'tbhbut boy', 'boy']",0,0,0,1,0.09523809523809523
113614,I would have liked a little more detail about the healing process and what to expect.,1,like little detail heal process expect,"['like', 'like little', 'like little detail', 'like little detail heal', 'like little detail heal process', 'like little detail heal process expect', 'little', 'little detail', 'little detail heal', 'little detail heal process', 'little detail heal process expect', 'detail', 'detail heal', 'detail heal process', 'detail heal process expect', 'heal', 'heal process', 'heal process expect', 'process', 'process expect', 'expect']",0,0,0,1,0.07407407407407407
130403,"You can't fix stupid...alas, at least I have a heads up on this place, not expecting a whole lot!!!!",1,fix stupidalas head place not expect lot,"['fix', 'fix stupidalas', 'fix stupidalas head', 'fix stupidalas head place', 'fix stupidalas head place not', 'fix stupidalas head place not expect', 'fix stupidalas head place not expect lot', 'stupidalas', 'stupidalas head', 'stupidalas head place', 'stupidalas head place not', 'stupidalas head place not expect', 'stupidalas head place not expect lot', 'head', 'head place', 'head place not', 'head place not expect', 'head place not expect lot', 'place', 'place not', 'place not expect', 'place not expect lot', 'not', 'not expect', 'not expect lot', 'expect', 'expect lot', 'lot']",0,0,0,1,0.058823529411764705
138597,"The treatment I have received has been not only been successful, it has been very comfortable and pleasant.",0,treatment receive not successful comfortable pleasant,"['treatment', 'treatment receive', 'treatment receive not', 'treatment receive not successful', 'treatment receive not successful comfortable', 'treatment receive not successful comfortable pleasant', 'receive', 'receive not', 'receive not successful', 'receive not successful comfortable', 'receive not successful comfortable pleasant', 'not', 'not successful', 'not successful comfortable', 'not successful comfortable pleasant', 'successful', 'successful comfortable', 'successful comfortable pleasant', 'comfortable', 'comfortable pleasant', 'pleasant']",0,1,0,0,0.07407407407407407
115419,and Dr Davis was very pleasant and found a cancer on my head and is ridding me of it now.,0,pleasant find cancer head ride,"['pleasant', 'pleasant find', 'pleasant find cancer', 'pleasant find cancer head', 'pleasant find cancer head ride', 'find', 'find cancer', 'find cancer head', 'find cancer head ride', 'cancer', 'cancer head', 'cancer head ride', 'head', 'head ride', 'ride']",0,1,0,0,0.09523809523809523
138437,The experience was pleasant and effective;,0,experience pleasant effective,"['experience', 'experience pleasant', 'experience pleasant effective', 'pleasant', 'pleasant effective', 'effective']",0,1,0,0,0.16666666666666666
155784,He also checked for any nerve damage and went over what to expect,0,check nerve damage go expect,"['check', 'check nerve', 'check nerve damage', 'check nerve damage go', 'check nerve damage go expect', 'nerve', 'nerve damage', 'nerve damage go', 'nerve damage go expect', 'damage', 'damage go', 'damage go expect', 'go', 'go expect', 'expect']",0,0,0,1,0.09523809523809523
86039,he and his assistant Thannon made the experience very pleasant,0,assistant cannon experience pleasant,"['assistant', 'assistant cannon', 'assistant cannon experience', 'assistant cannon experience pleasant', 'cannon', 'cannon experience', 'cannon experience pleasant', 'experience', 'experience pleasant', 'pleasant']",0,1,0,0,0.125
129407,I was made aware of what to expect and my experience was to plan.,0,aware expect experience plan,"['aware', 'aware expect', 'aware expect experience', 'aware expect experience plan', 'expect', 'expect experience', 'expect experience plan', 'experience', 'experience plan', 'plan']",0,0,0,1,0.125
145222,Not what I expected from non-evasive imaging.,1,not expect nonevasive imagine,"['not', 'not expect', 'not expect nonevasive', 'not expect nonevasive imagine', 'expect', 'expect nonevasive', 'expect nonevasive imagine', 'nonevasive', 'nonevasive imagine', 'imagine']",0,0,0,1,0.125
176968,"My experience was pleasant, friendly and very timely.",0,experience pleasant friendly timely,"['experience', 'experience pleasant', 'experience pleasant friendly', 'experience pleasant friendly timely', 'pleasant', 'pleasant friendly', 'pleasant friendly timely', 'friendly', 'friendly timely', 'timely']",0,1,0,0,0.125
62852,He's always pleasant and very nice,0,pleasant nice,"['pleasant', 'pleasant nice', 'nice']",0,1,0,0,0.2222222222222222
67628,"This is the most professional pleasant medical environment we have ever had to deal with,,,.",0,professional pleasant medical environment deal,"['professional', 'professional pleasant', 'professional pleasant medical', 'professional pleasant medical environment', 'professional pleasant medical environment deal', 'pleasant', 'pleasant medical', 'pleasant medical environment', 'pleasant medical environment deal', 'medical', 'medical environment', 'medical environment deal', 'environment', 'environment deal', 'deal']",0,1,0,0,0.09523809523809523
114054,"Dr. Sheets identified an issue on my 19 week ultrasound that could have been easily missed,",0,identify issue ultrasound easily miss,"['identify', 'identify issue', 'identify issue ultrasound', 'identify issue ultrasound easily', 'identify issue ultrasound easily miss', 'issue', 'issue ultrasound', 'issue ultrasound easily', 'issue ultrasound easily miss', 'ultrasound', 'ultrasound easily', 'ultrasound easily miss', 'easily', 'easily miss', 'miss']",1,0,0,0,0.09523809523809523
90548,also able to breathe much better which is a benefit I did not expect.,0,able breathe good benefit not expect,"['able', 'able breathe', 'able breathe good', 'able breathe good benefit', 'able breathe good benefit not', 'able breathe good benefit not expect', 'breathe', 'breathe good', 'breathe good benefit', 'breathe good benefit not', 'breathe good benefit not expect', 'good', 'good benefit', 'good benefit not', 'good benefit not expect', 'benefit', 'benefit not', 'benefit not expect', 'not', 'not expect', 'expect']",0,0,0,1,0.07407407407407407
60901,I expected a good result and I got one,0,expect good result get,"['expect', 'expect good', 'expect good result', 'expect good result get', 'good', 'good result', 'good result get', 'result', 'result get', 'get']",0,0,0,1,0.125
186380,"and doctor were not pleasant, or willing to provide me the information.",1,not pleasant willing provide information,"['not', 'not pleasant', 'not pleasant willing', 'not pleasant willing provide', 'not pleasant willing provide information', 'pleasant', 'pleasant willing', 'pleasant willing provide', 'pleasant willing provide information', 'willing', 'willing provide', 'willing provide information', 'provide', 'provide information', 'information']",0,1,0,0,0.09523809523809523
120354,Took his time and checked in on me while awaiting results,0,take time check expect result,"['take', 'take time', 'take time check', 'take time check expect', 'take time check expect result', 'time', 'time check', 'time check expect', 'time check expect result', 'check', 'check expect', 'check expect result', 'expect', 'expect result', 'result']",0,0,0,1,0.09523809523809523
115659,"After surgery she stayed in hospital 1 week.Nice food, nice room, included ultrasound procedure .",0,surgery stay hospital food nice room include ultrasound procedure,"['surgery', 'surgery stay', 'surgery stay hospital', 'surgery stay hospital food', 'surgery stay hospital food nice', 'surgery stay hospital food nice room', 'surgery stay hospital food nice room include', 'surgery stay hospital food nice room include ultrasound', 'surgery stay hospital food nice room include ultrasound procedure', 'stay', 'stay hospital', 'stay hospital food', 'stay hospital food nice', 'stay hospital food nice room', 'stay hospital food nice room include', 'stay hospital food nice room include ultrasound', 'stay hospital food nice room include ultrasound procedure', 'hospital', 'hospital food', 'hospital food nice', 'hospital food nice room', 'hospital food nice room include', 'hospital food nice room include ultrasound', 'hospital food nice room include ultrasound procedure', 'food', 'food nice', 'food nice room', 'food nice room include', 'food nice room include ultrasound', 'food nice room include ultrasound procedure', 'nice', 'nice room', 'nice room include', 'nice room include ultrasound', 'nice room include ultrasound procedure', 'room', 'room include', 'room include ultrasound', 'room include ultrasound procedure', 'include', 'include ultrasound', 'include ultrasound procedure', 'ultrasound', 'ultrasound procedure', 'procedure']",1,0,0,0,0.0392156862745098
73200,"Because of him, I have healed faster than expected and will make an 100% recovery!",0,heal fast expect recovery,"['heal', 'heal fast', 'heal fast expect', 'heal fast expect recovery', 'fast', 'fast expect', 'fast expect recovery', 'expect', 'expect recovery', 'recovery']",0,0,0,1,0.125
187020,"From blood work, to ultrasound and then an endoscopy he was understanding and truly helped my son get through all the testing.",0,blood work ultrasound endoscopy understanding truly help son test,"['blood', 'blood work', 'blood work ultrasound', 'blood work ultrasound endoscopy', 'blood work ultrasound endoscopy understanding', 'blood work ultrasound endoscopy understanding truly', 'blood work ultrasound endoscopy understanding truly help', 'blood work ultrasound endoscopy understanding truly help son', 'blood work ultrasound endoscopy understanding truly help son test', 'work', 'work ultrasound', 'work ultrasound endoscopy', 'work ultrasound endoscopy understanding', 'work ultrasound endoscopy understanding truly', 'work ultrasound endoscopy understanding truly help', 'work ultrasound endoscopy understanding truly help son', 'work ultrasound endoscopy understanding truly help son test', 'ultrasound', 'ultrasound endoscopy', 'ultrasound endoscopy understanding', 'ultrasound endoscopy understanding truly', 'ultrasound endoscopy understanding truly help', 'ultrasound endoscopy understanding truly help son', 'ultrasound endoscopy understanding truly help son test', 'endoscopy', 'endoscopy understanding', 'endoscopy understanding truly', 'endoscopy understanding truly help', 'endoscopy understanding truly help son', 'endoscopy understanding truly help son test', 'understanding', 'understanding truly', 'understanding truly help', 'understanding truly help son', 'understanding truly help son test', 'truly', 'truly help', 'truly help son', 'truly help son test', 'help', 'help son', 'help son test', 'son', 'son test', 'test']",1,0,0,0,0.0392156862745098
163193,Everybody was exactly what I would expect professional care-givers to be.,0,everybody precisely expect professional caregiver,"['everybody', 'everybody precisely', 'everybody precisely expect', 'everybody precisely expect professional', 'everybody precisely expect professional caregiver', 'precisely', 'precisely expect', 'precisely expect professional', 'precisely expect professional caregiver', 'expect', 'expect professional', 'expect professional caregiver', 'professional', 'professional caregiver', 'caregiver']",0,0,0,1,0.09523809523809523
73847,It was okay but I was expecting excellence so it was a bit disappointing.,1,okay expect excellence bit disappoint,"['okay', 'okay expect', 'okay expect excellence', 'okay expect excellence bit', 'okay expect excellence bit disappoint', 'expect', 'expect excellence', 'expect excellence bit', 'expect excellence bit disappoint', 'excellence', 'excellence bit', 'excellence bit disappoint', 'bit', 'bit disappoint', 'disappoint']",0,0,0,1,0.09523809523809523
141845,"All phases of visit were very pleasant, from signing in to doctor's assistant, and of course the doctor.",0,phase visit pleasant sign doctor assistant course,"['phase', 'phase visit', 'phase visit pleasant', 'phase visit pleasant sign', 'phase visit pleasant sign doctor', 'phase visit pleasant sign doctor assistant', 'phase visit pleasant sign doctor assistant course', 'visit', 'visit pleasant', 'visit pleasant sign', 'visit pleasant sign doctor', 'visit pleasant sign doctor assistant', 'visit pleasant sign doctor assistant course', 'pleasant', 'pleasant sign', 'pleasant sign doctor', 'pleasant sign doctor assistant', 'pleasant sign doctor assistant course', 'sign', 'sign doctor', 'sign doctor assistant', 'sign doctor assistant course', 'doctor', 'doctor assistant', 'doctor assistant course', 'assistant', 'assistant course', 'course']",0,1,0,0,0.058823529411764705
104452,They all keep me informed of expectations and made it a pleasant experience.,0,inform expectation pleasant experience,"['inform', 'inform expectation', 'inform expectation pleasant', 'inform expectation pleasant experience', 'expectation', 'expectation pleasant', 'expectation pleasant experience', 'pleasant', 'pleasant experience', 'experience']",0,1,0,0,0.125
131376,The girls at the desk are thorough and review every step in the process from cost to what to expect after.,0,girl desk thorough review step process cost expect,"['girl', 'girl desk', 'girl desk thorough', 'girl desk thorough review', 'girl desk thorough review step', 'girl desk thorough review step process', 'girl desk thorough review step process cost', 'girl desk thorough review step process cost expect', 'desk', 'desk thorough', 'desk thorough review', 'desk thorough review step', 'desk thorough review step process', 'desk thorough review step process cost', 'desk thorough review step process cost expect', 'thorough', 'thorough review', 'thorough review step', 'thorough review step process', 'thorough review step process cost', 'thorough review step process cost expect', 'review', 'review step', 'review step process', 'review step process cost', 'review step process cost expect', 'step', 'step process', 'step process cost', 'step process cost expect', 'process', 'process cost', 'process cost expect', 'cost', 'cost expect', 'expect']",0,0,0,1,0.047619047619047616
144727,Her unprofessionalism and failure to meet my expected standard of care led me to seek another physician after roughly a year.,1,unprofessionalism failure meet expect standard care lead seek doctor,"['unprofessionalism', 'unprofessionalism failure', 'unprofessionalism failure meet', 'unprofessionalism failure meet expect', 'unprofessionalism failure meet expect standard', 'unprofessionalism failure meet expect standard care', 'unprofessionalism failure meet expect standard care lead', 'unprofessionalism failure meet expect standard care lead seek', 'unprofessionalism failure meet expect standard care lead seek doctor', 'failure', 'failure meet', 'failure meet expect', 'failure meet expect standard', 'failure meet expect standard care', 'failure meet expect standard care lead', 'failure meet expect standard care lead seek', 'failure meet expect standard care lead seek doctor', 'meet', 'meet expect', 'meet expect standard', 'meet expect standard care', 'meet expect standard care lead', 'meet expect standard care lead seek', 'meet expect standard care lead seek doctor', 'expect', 'expect standard', 'expect standard care', 'expect standard care lead', 'expect standard care lead seek', 'expect standard care lead seek doctor', 'standard', 'standard care', 'standard care lead', 'standard care lead seek', 'standard care lead seek doctor', 'care', 'care lead', 'care lead seek', 'care lead seek doctor', 'lead', 'lead seek', 'lead seek doctor', 'seek', 'seek doctor', 'doctor']",0,0,0,1,0.0392156862745098
125438,Anything that one could possible expect is outlined.,0,possible expect outline,"['possible', 'possible expect', 'possible expect outline', 'expect', 'expect outline', 'outline']",0,0,0,1,0.16666666666666666
114817,"I felt I was led to expect much better results in the consult, I'm very disappointed.",1,feel lead expect good result consult disappoint,"['feel', 'feel lead', 'feel lead expect', 'feel lead expect good', 'feel lead expect good result', 'feel lead expect good result consult', 'feel lead expect good result consult disappoint', 'lead', 'lead expect', 'lead expect good', 'lead expect good result', 'lead expect good result consult', 'lead expect good result consult disappoint', 'expect', 'expect good', 'expect good result', 'expect good result consult', 'expect good result consult disappoint', 'good', 'good result', 'good result consult', 'good result consult disappoint', 'result', 'result consult', 'result consult disappoint', 'consult', 'consult disappoint', 'disappoint']",0,0,0,1,0.058823529411764705
188298,"He then made the comment that he was hoping I wasn't expecting ""world-class service"".",1,comment hop expect worldclass service,"['comment', 'comment hop', 'comment hop expect', 'comment hop expect worldclass', 'comment hop expect worldclass service', 'hop', 'hop expect', 'hop expect worldclass', 'hop expect worldclass service', 'expect', 'expect worldclass', 'expect worldclass service', 'worldclass', 'worldclass service', 'service']",0,0,0,1,0.09523809523809523
61821,I like her forth right manner and she was very pleasant.,0,like forth right manner pleasant,"['like', 'like forth', 'like forth right', 'like forth right manner', 'like forth right manner pleasant', 'forth', 'forth right', 'forth right manner', 'forth right manner pleasant', 'right', 'right manner', 'right manner pleasant', 'manner', 'manner pleasant', 'pleasant']",0,1,0,0,0.09523809523809523
180220,"Staff very friendly, results of procedure better than expected",0,staff friendly result procedure good expect,"['staff', 'staff friendly', 'staff friendly result', 'staff friendly result procedure', 'staff friendly result procedure good', 'staff friendly result procedure good expect', 'friendly', 'friendly result', 'friendly result procedure', 'friendly result procedure good', 'friendly result procedure good expect', 'result', 'result procedure', 'result procedure good', 'result procedure good expect', 'procedure', 'procedure good', 'procedure good expect', 'good', 'good expect', 'expect']",0,0,0,1,0.07407407407407407
92141,My visit with Dr. Shell was pleasant.,0,visit shell pleasant,"['visit', 'visit shell', 'visit shell pleasant', 'shell', 'shell pleasant', 'pleasant']",0,1,0,0,0.16666666666666666
112838,Pleasant visit as usual.,0,pleasant visit usual,"['pleasant', 'pleasant visit', 'pleasant visit usual', 'visit', 'visit usual', 'usual']",0,1,0,0,0.16666666666666666
143606,I didn't know what to expect but Dr White helped me feel comfortable with the whole process.,0,know expect help feel comfortable process,"['know', 'know expect', 'know expect help', 'know expect help feel', 'know expect help feel comfortable', 'know expect help feel comfortable process', 'expect', 'expect help', 'expect help feel', 'expect help feel comfortable', 'expect help feel comfortable process', 'help', 'help feel', 'help feel comfortable', 'help feel comfortable process', 'feel', 'feel comfortable', 'feel comfortable process', 'comfortable', 'comfortable process', 'process']",0,0,0,1,0.07407407407407407
162103,I just went to Next Health for the first time yesterday on a rainy day and had such a pleasant and relaxing hour!,0,go health time pleasant relax hour,"['go', 'go health', 'go health time', 'go health time pleasant', 'go health time pleasant relax', 'go health time pleasant relax hour', 'health', 'health time', 'health time pleasant', 'health time pleasant relax', 'health time pleasant relax hour', 'time', 'time pleasant', 'time pleasant relax', 'time pleasant relax hour', 'pleasant', 'pleasant relax', 'pleasant relax hour', 'relax', 'relax hour', 'hour']",0,1,0,0,0.07407407407407407
191554,The second time around I didn't have a pleasant experience.,1,time pleasant experience,"['time', 'time pleasant', 'time pleasant experience', 'pleasant', 'pleasant experience', 'experience']",0,1,0,0,0.16666666666666666
